, – ,,,
War Risk Insurance Fund, – , – , – , – , – , – , – , – , – , – , – ,-1, – , – , – , – , – ,,,
Maritime Guaranteed Loans, – , – , – , – , – , – , – , – , – , – , 52 , 40 , 41 , 36 , 10 , 70 , 47 ,,,
Saint Lawrence Seaway Development Corporation Total, – , – , 6 , 11 , 11 , 11 , 10 , 11 , 11 , 11 , 10 , 10 , 10 , 11 , 11 , 12 , 13 ,,,
Harbor Maintenance Trust Fund, – , – , 2 , – , – , – , – , – , – , – , – , – , – , – , – , 12 , 13 ,,,
Net Additional Outlays, – , – , 4 , 11 , 11 , 11 , 10 , 11 , 