91.0,"Median nonfamily income (dollars)","27,586","+/-4,455","(X)","(X)"
"DP03",92.0,"Mean nonfamily income (dollars)","34,850","+/-4,656","(X)","(X)"
"DP03",92.3,,,,,
"DP03",93.0,"Median earnings for workers (dollars)","24,632","+/-1,754","(X)","(X)"
"DP03",93.5,"PERCENTAGE OF FAMILIES AND PEOPLE WHOSE INCOME IN THE PAST 12 MONTHS IS BELOW THE POVERTY LEVEL",,,,
"DP03",94.0,"Median earnings for male full-time, year-round workers (dollars)","34,318","+/-2,016","(X)","(X)"
"DP03",95.0,"Median earnings for fe