 synthase F1, gamma subunit
SMT1810,NULL,1797548,1797682,ATP synthase F1, beta subunit
SMT1811,NULL,1797690,1797782,ATP synthase F1, beta subunit
SMT1812,NULL,1797832,1798197,PTS system, IIC component, probable
SMT1813,NULL,1798296,1799192,lacX protein, truncation
SMT1814,NULL,1799478,1799903,galactose-6-phosphate isomerase, LacA subunit
SMT1815,NULL,1800052,1800567,galactose-6-phosphate isomerase, LacB subunit
SMT1816,NULL,1800578,1801507,tagatose-6-phosphate kinase
SMT1817,NULL,1801509,1802489,tagatose 1,