96,NULL,NULL,NULL,dTDP-glucose 4,6-dehydratase
SMT1997,NULL,1937735,1937974,lipopolysaccharide biosynthesis protein, putative
SMT1998,NULL,1938028,1938354,copper homeostasis protein CutC
SMT1999,NULL,1938397,1939053,Protein of unknown function (DUF419) family
SMT2000,NULL,1939385,1939519,tryptophan synthase, beta subunit
SMT2001,NULL,1939512,1940057,tryptophan synthase, alpha subunit
SMT2002,NULL,1940499,1940750,conserved hypothetical protein
SMT2003,NULL,1941855,1941085,hypothetical protein
SMT2004,NULL,19