24010I",7.000,"Business and financial operations occupations","390","+/-313","77","703"
"B24010I",8.000,"Professional and related occupations:","2,661","+/-807","1,854","3,468"
"B24010I",9.000,"Computer and mathematical occupations","499","+/-272","227","771"
"B24010I",10.000,"Architecture and engineering occupations","157","+/-190","0","347"
"B24010I",11.000,"Life, physical, and social science occupations","285","+/-251","34","536"
"B24010I",12.000,"Community and social services occupations","69","+/-110",