"N","N","N","N"
"B08017",6.000,"Worked in a different Micropolitan Statistical Area:","N","N","N","N"
"B08017",7.000,"Worked in a principal city","N","N","N","N"
"B08017",8.000,"Worked outside any principal city","N","N","N","N"
"B08017",9.000,"Worked in a Metropolitan Statistical Area:","N","N","N","N"
"B08017",10.000,"Worked in a principal city","N","N","N","N"
"B08017",11.000,"Worked outside any principal city","N","N","N","N"
"B08017",12.000,"Worked outside any Metropolitan or Micropolitan Statistical A