,021","43,587"
"B24032",50.000,"Arts, entertainment, and recreation, and accommodations and food services","17,209","+/-3,187","14,022","20,396"
"B24032",51.000,"Arts, entertainment, and recreation","19,848","+/-7,354","12,494","27,202"
"B24032",52.000,"Accommodation and food services","16,839","+/-2,655","14,184","19,494"
"B24032",53.000,"Other services except public administration","20,080","+/-7,097","12,983","27,177"
"B24032",54.000,"Public administration","60,830","+/-8,290","52,540","69,120"
"B24040",