ood Stamps in the past 12 months","56,260","+/-2,535","53,725","58,795"
"B22005E",.,"RECEIPT OF FOOD STAMPS IN THE PAST 12 MONTHS BY RACE OF HOUSEHOLDER (NATIVE HAWAIIAN AND OTHER PACIFIC ISLANDER ALONE)",,,,
"B22005E",.,"Universe:  Households with a householder who is Native Hawaiian and Other Pacific Islander alone",,,,
"B22005E",1.000,"Total:","N","N","N","N"
"B22005E",2.000,"Household received Food Stamps in the past 12 months","N","N","N","N"
"B22005E",3.000,"Household did not receive Food Stamps in th