TE ALONE, NOT HISPANIC OR LATINO)",,,,
"C15002H",.,"Universe:  White alone, not Hispanic or Latino population 25 years and over",,,,
"C15002H",1.000,"Total:","243,401","+/-670","242,731","244,071"
"C15002H",2.000,"Male:","119,437","+/-356","119,081","119,793"
"C15002H",3.000,"Less than high school diploma","5,455","+/-1,089","4,366","6,544"
"C15002H",4.000,"High school graduate (includes equivalency)","20,801","+/-2,079","18,722","22,880"
"C15002H",5.000,"Some college or associate's degree","30,317","+/-1,9