1,845","+/-666","1,179","2,511"
"C15002G",7.000,"Female:","5,753","+/-1,131","4,622","6,884"
"C15002G",8.000,"Less than high school diploma","432","+/-320","112","752"
"C15002G",9.000,"High school graduate (includes equivalency)","1,156","+/-664","492","1,820"
"C15002G",10.000,"Some college or associate's degree","2,057","+/-612","1,445","2,669"
"C15002G",11.000,"Bachelor's degree or higher","2,108","+/-667","1,441","2,775"
"C15002H",.,"SEX BY EDUCATIONAL ATTAINMENT FOR THE POPULATION 25 YEARS AND OVER (WHI