tion, maintenance, and repair occupations","213","+/-347","0","560"
"C24060",118.000,"Production, transportation, and material moving occupations:","379","+/-425","0","804"
"C24060",119.000,"Production occupations","232","+/-383","0","615"
"C24060",120.000,"Transportation and material moving occupations","147","+/-179","0","326"
"C24060",121.000,"Local, state, and federal government workers:","44,163","+/-3,238","40,925","47,401"
"C24060",122.000,"Management, professional, and related occupations:","23,737"