in the past 12 months","255","+/-234","21","489"
"B17015",40.000,"Without SSI or cash public assistance income in the past 12 months","7,693","+/-1,370","6,323","9,063"
"B17015",41.000,"Female householder, no husband present:","23,216","+/-2,264","20,952","25,480"
"B17015",42.000,"With Social Security income in the past 12 months:","5,683","+/-1,071","4,612","6,754"
"B17015",43.000,"With SSI and/or cash public assistance income in the past 12 months","1,043","+/-511","532","1,554"
"B17015",44.000,"Without S