ducational services","3,286","+/-923","2,363","4,209"
"B24050",103.000,"Health care and social assistance","5,720","+/-1,178","4,542","6,898"
"B24050",104.000,"Arts, entertainment, and recreation, and accommodation and food services:","5,047","+/-1,328","3,719","6,375"
"B24050",105.000,"Arts, entertainment, and recreation","1,603","+/-700","903","2,303"
"B24050",106.000,"Accommodation and food services","3,444","+/-1,091","2,353","4,535"
"B24050",107.000,"Other services, except public administration","2,626