ng and maintenance occupations","4,472","+/-1,579","2,893","6,051"
"C24020",62.000,"Personal care and service occupations","5,031","+/-1,189","3,842","6,220"
"C24020",63.000,"Sales and office occupations:","31,175","+/-2,634","28,541","33,809"
"C24020",64.000,"Sales and related occupations","10,007","+/-1,791","8,216","11,798"
"C24020",65.000,"Office and administrative support occupations","21,168","+/-2,160","19,008","23,328"
"C24020",66.000,"Farming, fishing, and forestry occupations","55","+/-93","0","14