128","2,384","4,640"
"C24060",106.000,"Healthcare support occupations","822","+/-511","311","1,333"
"C24060",107.000,"Protective service occupations","454","+/-449","5","903"
"C24060",108.000,"Food preparation and serving related occupations","844","+/-519","325","1,363"
"C24060",109.000,"Building and grounds cleaning and maintenance occupations","794","+/-449","345","1,243"
"C24060",110.000,"Personal care and service occupations","598","+/-422","176","1,020"
"C24060",111.000,"Sales and office occupations:"