,"N","N","N"
"B24010F",30.000,"Production, transportation, and material moving occupations:","N","N","N","N"
"B24010F",31.000,"Production occupations","N","N","N","N"
"B24010F",32.000,"Transportation and material moving occupations","N","N","N","N"
"B24010F",33.000,"Female:","N","N","N","N"
"B24010F",34.000,"Management, professional, and related occupations:","N","N","N","N"
"B24010F",35.000,"Management, business, and financial occupations:","N","N","N","N"
"B24010F",36.000,"Management occupations except fa