ting, and auditing clerks","2,740","+/-813","1,927","3,553"
"B24010",210.000,"Bookkeeping, accounting, and auditing clerks","3,286","+/-866","2,420","4,152"
"B24010",211.000,"Information and record clerks except customer service representatives","4,687","+/-1,128","3,559","5,815"
"B24010",212.000,"Customer service representatives","1,721","+/-697","1,024","2,418"
"B24010",213.000,"Material recording, scheduling, dispatching, and distributing workers","3,254","+/-1,117","2,137","4,371"
"B24010",214.000,"Secr