368","+/-770","1,598","3,138"
"B24060",201.000,"Professional and related occupations:","9,453","+/-1,273","8,180","10,726"
"B24060",202.000,"Computer and mathematical occupations","403","+/-355","48","758"
"B24060",203.000,"Architecture and engineering occupations","754","+/-404","350","1,158"
"B24060",204.000,"Life, physical, and social science occupations","478","+/-258","220","736"
"B24060",205.000,"Community and social services occupations","114","+/-136","0","250"
"B24060",206.000,"Legal occupations","