elated occupations","844","+/-519","325","1,363"
"B24060",140.000,"Building and grounds cleaning and maintenance occupations","794","+/-449","345","1,243"
"B24060",141.000,"Personal care and service occupations","598","+/-422","176","1,020"
"B24060",142.000,"Sales and office occupations:","4,421","+/-1,019","3,402","5,440"
"B24060",143.000,"Sales and related occupations","664","+/-370","294","1,034"
"B24060",144.000,"Office and administrative support occupations","3,757","+/-993","2,764","4,750"
"B24060",14