731","48,459"
"C24060",23.000,"Office and administrative support occupations","52,779","+/-3,953","48,826","56,732"
"C24060",24.000,"Farming, fishing, and forestry occupations","1,536","+/-739","797","2,275"
"C24060",25.000,"Construction extraction, maintenance, and repair occupations:","25,491","+/-2,699","22,792","28,190"
"C24060",26.000,"Construction and extraction occupations","16,080","+/-2,109","13,971","18,189"
"C24060",27.000,"Installation, maintenance, and repair occupations","9,411","+/-1,774","7,