ool graduate","284","+/-246","38","530"
"B13014",11.000,"High school graduate (includes equivalency)","424","+/-376","48","800"
"B13014",12.000,"Some college or associate's degree","525","+/-368","157","893"
"B13014",13.000,"Bachelor's degree","879","+/-671","208","1,550"
"B13014",14.000,"Graduate or professional degree","95","+/-172","0","267"
"B13014",15.000,"Women who did not have a birth in the past 12 months:","163,148","+/-2,001","161,147","165,149"
"B13014",16.000,"Now married (including separated an