,"33,520","+/-30,755","2,765","64,275"
"B24012",21.000,"Law enforcement workers including supervisors","86,058","+/-29,471","56,587","115,529"
"B24012",22.000,"Food preparation and serving related occupations","21,346","+/-2,389","18,957","23,735"
"B24012",23.000,"Building and grounds cleaning and maintenance occupations","26,437","+/-4,029","22,408","30,466"
"B24012",24.000,"Personal care and service occupations","20,356","+/-10,992","9,364","31,348"
"B24012",25.000,"Sales and office occupations:","43,569"