,542","19,407","24,491"
"B20004",3.000,"High school graduate (includes equivalency)","31,033","+/-2,427","28,606","33,460"
"B20004",4.000,"Some college or associate's degree","42,414","+/-2,037","40,377","44,451"
"B20004",5.000,"Bachelor's degree","60,270","+/-3,785","56,485","64,055"
"B20004",6.000,"Graduate or professional degree","92,255","+/-4,689","87,566","96,944"
"B20004",7.000,"Male:","52,095","+/-1,419","50,676","53,514"
"B20004",8.000,"Less than high school graduate","25,881","+/-3,030","22,851","