2,685"
"B07013",15.000,"Householder lived in renter-occupied housing units","5,836","+/-2,519","3,317","8,355"
"B07013",16.000,"Moved from abroad:","5,486","+/-1,675","3,811","7,161"
"B07013",17.000,"Householder lived in owner-occupied housing units","1,467","+/-971","496","2,438"
"B07013",18.000,"Householder lived in renter-occupied housing units","4,019","+/-1,239","2,780","5,258"
"B07201",.,"GEOGRAPHICAL MOBILITY IN THE PAST YEAR FOR CURRENT RESIDENCE--METROPOLITAN STATISTICAL AREA LEVEL IN THE UNITED ST