hitecture and engineering occupations","786","+/-396","390","1,182"
"C24060",129.000,"Life, physical, and social science occupations","1,950","+/-696","1,254","2,646"
"C24060",130.000,"Community and social services occupations","1,249","+/-645","604","1,894"
"C24060",131.000,"Legal occupations","634","+/-334","300","968"
"C24060",132.000,"Education, training, and library occupations","8,770","+/-1,275","7,495","10,045"
"C24060",133.000,"Arts, design, entertainment, sports, and media occupations","231","+/-1