,"Grocery and related product merchant wholesalers","2,206","+/-1,163","1,043","3,369"
"B24030",42.000,"Farm product raw material merchant wholesalers","361","+/-267","94","628"
"B24030",43.000,"Petroleum and petroleum products merchant wholesalers","0","+/-292","0","292"
"B24030",44.000,"Alcoholic beverage merchant wholesalers","141","+/-163","0","304"
"B24030",45.000,"Farm supplies merchant wholesalers","0","+/-292","0","292"
"B24030",46.000,"Miscellaneous nondurable goods merchant wholesalers","645","+/-