 time, year-round","588","+/-383","205","971"
"B17004",9.000,"Worked part-time or part-year","4,394","+/-1,239","3,155","5,633"
"B17004",10.000,"Did not work","12,350","+/-2,197","10,153","14,547"
"B17004",11.000,"Income in the past 12 months at or above poverty level:","531,092","+/-4,164","526,928","535,256"
"B17004",12.000,"Male:","263,296","+/-2,561","260,735","265,857"
"B17004",13.000,"Worked full time, year-round","143,256","+/-4,259","138,997","147,515"
"B17004",14.000,"Worked part-time or part-year"