","+/-618","414","1,650"
"B03002",17.000,"Native Hawaiian and Other Pacific Islander alone","185","+/-233","0","418"
"B03002",18.000,"Some other race alone","42,039","+/-5,981","36,058","48,020"
"B03002",19.000,"Two or more races:","8,409","+/-2,737","5,672","11,146"
"B03002",20.000,"Two races including Some other race","5,750","+/-2,477","3,273","8,227"
"B03002",21.000,"Two races excluding Some other race, and three or more races","2,659","+/-1,160","1,499","3,819"
"B04001",.,"FIRST ANCESTRY REPORTED",,,,
