"3,608","6,146"
"B11001H",6.000,"Female householder, no husband present","10,301","+/-1,424","8,877","11,725"
"B11001H",7.000,"Nonfamily households:","52,784","+/-2,820","49,964","55,604"
"B11001H",8.000,"Householder living alone","43,596","+/-2,751","40,845","46,347"
"B11001H",9.000,"Householder not living alone","9,188","+/-1,496","7,692","10,684"
"B11001I",.,"HOUSEHOLD TYPE (INCLUDING LIVING ALONE) (HISPANIC OR LATINO)",,,,
"B11001I",.,"Universe:  Households with a householder who is Hispanic or Latino",