ee or higher","3,426","+/-1,251","2,175","4,677"
"C15001",8.000,"25 to 34 years:","43,734","+/-857","42,877","44,591"
"C15001",9.000,"Less than high school graduate","6,560","+/-1,170","5,390","7,730"
"C15001",10.000,"High school graduate (includes equivalency)","10,446","+/-1,996","8,450","12,442"
"C15001",11.000,"Some college or associate's degree","11,490","+/-1,702","9,788","13,192"
"C15001",12.000,"Bachelor's degree or higher","15,238","+/-1,756","13,482","16,994"
"C15001",13.000,"35 to 44 years:","57,