10.000,"50.0 percent or more","20,629","+/-2,563","18,066","23,192"
"B25070",11.000,"Not computed","3,753","+/-1,166","2,587","4,919"
"B25071",.,"MEDIAN GROSS RENT AS A PERCENTAGE OF HOUSEHOLD INCOME IN THE PAST 12 MONTHS (DOLLARS)",,,,
"B25071",.,"Universe:  Renter-occupied housing units paying cash rent",,,,
"B25071",1.000,"Median gross rent as a percentage of household income","28.4","+/-1.1","27.3","29.5"
"B25072",.,"AGE OF HOUSEHOLDER BY GROSS RENT AS A PERCENTAGE OF HOUSEHOLD INCOME IN THE PAST 12 MON