es, and health care and social assistance:","50,866","+/-3,522","47,344","54,388"
"C24030",49.000,"Educational services","17,484","+/-2,305","15,179","19,789"
"C24030",50.000,"Health care and social assistance","33,382","+/-3,201","30,181","36,583"
"C24030",51.000,"Arts, entertainment, and recreation, and accommodation and food services:","12,028","+/-1,492","10,536","13,520"
"C24030",52.000,"Arts, entertainment, and recreation","3,728","+/-893","2,835","4,621"
"C24030",53.000,"Accommodation and food servic