hitects, surveyors, and cartographers","41","+/-67","0","108"
"B24020",149.000,"Engineers","495","+/-320","175","815"
"B24020",150.000,"Drafters, engineering, and mapping technicians","219","+/-156","63","375"
"B24020",151.000,"Life, physical, and social science occupations:","2,159","+/-686","1,473","2,845"
"B24020",152.000,"Life and physical scientists","1,099","+/-511","588","1,610"
"B24020",153.000,"Social scientists and related workers","532","+/-311","221","843"
"B24020",154.000,"Life, physical, and s