ome furnishings, and household appliance stores","1,003","+/-601","402","1,604"
"B24030",156.000,"Radio, TV, and computer and software, and other electronic stores","922","+/-344","578","1,266"
"B24030",157.000,"Building material and garden equipment and supplies dealers","555","+/-401","154","956"
"B24030",158.000,"Food and beverage stores","3,855","+/-1,276","2,579","5,131"
"B24030",159.000,"Pharmacies and drug stores","1,450","+/-732","718","2,182"
"B24030",160.000,"Other health and personal care stores"