58","2,015","4,131"
"B24060",83.000,"Business and financial operations occupations","1,343","+/-634","709","1,977"
"B24060",84.000,"Professional and related occupations:","2,896","+/-781","2,115","3,677"
"B24060",85.000,"Computer and mathematical occupations","0","+/-292","0","292"
"B24060",86.000,"Architecture and engineering occupations","527","+/-372","155","899"
"B24060",87.000,"Life, physical, and social science occupations","145","+/-163","0","308"
"B24060",88.000,"Community and social services occupa