ST 12 MONTHS (IN 2007 INFLATION-ADJUSTED DOLLARS) FOR HOUSEHOLDS",,,,
"B19066",.,"Universe:  Households",,,,
"B19066",1.000,"Aggregate Supplemental Security Income (SSI) in the past 12 months (in 2007 inflation-adjusted dollars)","73,111,200","+/-16,075,617","57,035,583","89,186,817"
"B19067",.,"AGGREGATE PUBLIC ASSISTANCE INCOME IN THE PAST 12 MONTHS (IN 2007 INFLATION-ADJUSTED DOLLARS) FOR HOUSEHOLDS",,,,
"B19067",.,"Universe:  Households",,,,
"B19067",1.000,"Aggregate public assistance income in the past