8,621","+/-2,012","16,609","20,633"
"C24010",43.000,"Business and financial operations occupations","10,498","+/-1,625","8,873","12,123"
"C24010",44.000,"Professional and related occupations:","42,167","+/-3,181","38,986","45,348"
"C24010",45.000,"Computer and mathematical occupations","4,133","+/-873","3,260","5,006"
"C24010",46.000,"Architecture and engineering occupations","1,076","+/-436","640","1,512"
"C24010",47.000,"Life, physical, and social science occupations","3,058","+/-889","2,169","3,947"
"C24