1","8","430"
"B23007",44.000,"Husband not in labor force:","25,926","+/-1,468","24,458","27,394"
"B23007",45.000,"Wife in labor force:","7,612","+/-1,396","6,216","9,008"
"B23007",46.000,"Employed or in Armed Forces","7,612","+/-1,396","6,216","9,008"
"B23007",47.000,"Unemployed","0","+/-292","0","292"
"B23007",48.000,"Wife not in labor force","18,314","+/-1,252","17,062","19,566"
"B23007",49.000,"Other family:","22,502","+/-2,243","20,259","24,745"
"B23007",50.000,"Male householder, no wife present:","7,10