workers","0","+/-292","0","292"
"B08128",51.000,"Taxicab, motorcycle, bicycle, or other means:","8,662","+/-2,958","5,704","11,620"
"B08128",52.000,"Private for-profit wage and salary workers:","6,622","+/-2,752","3,870","9,374"
"B08128",53.000,"Employee of private company workers","6,622","+/-2,752","3,870","9,374"
"B08128",54.000,"Self-employed in own incorporated business workers","0","+/-292","0","292"
"B08128",55.000,"Private not-for-profit wage and salary workers","1,025","+/-705","320","1,730"
"B0812