7","17,881"
"C24010F",3.000,"Management, professional, and related occupations","1,619","+/-786","833","2,405"
"C24010F",4.000,"Service occupations","4,227","+/-1,540","2,687","5,767"
"C24010F",5.000,"Sales and office occupations","2,958","+/-944","2,014","3,902"
"C24010F",6.000,"Farming, fishing, and forestry occupations","181","+/-170","11","351"
"C24010F",7.000,"Construction, extraction, maintenance, and repair occupations","3,247","+/-1,041","2,206","4,288"
"C24010F",8.000,"Production, transportation, a