,"WOMEN 15 TO 50 YEARS WHO HAD A BIRTH IN THE PAST 12 MONTHS BY MARITAL STATUS (TWO OR MORE RACES)",,,,
"B13002G",.,"Universe:  Two or more races women 15 to 50 years",,,,
"B13002G",1.000,"Total:","6,197","+/-1,304","4,893","7,501"
"B13002G",2.000,"Women who had a birth in the past 12 months:","455","+/-367","88","822"
"B13002G",3.000,"Now married (including separated and spouse absent)","263","+/-274","0","537"
"B13002G",4.000,"Unmarried (never married, widowed and divorced)","192","+/-248","0","440"
"B130