asing:","3,930","+/-1,491","2,439","5,421"
"B24070",149.000,"Finance and insurance","760","+/-405","355","1,165"
"B24070",150.000,"Real estate and rental and leasing","3,170","+/-1,422","1,748","4,592"
"B24070",151.000,"Professional, scientific, and management, and administrative and waste management services:","10,392","+/-1,661","8,731","12,053"
"B24070",152.000,"Professional, scientific, and technical services","7,013","+/-1,207","5,806","8,220"
"B24070",153.000,"Management of companies and enterprises",