terial moving workers","27,047","+/-2,751","24,296","29,798"
"B24022",38.000,"Female:","50,831","+/-1,470","49,361","52,301"
"B24022",39.000,"Management, professional, and related occupations:","70,818","+/-3,287","67,531","74,105"
"B24022",40.000,"Management, business, and financial occupations:","71,683","+/-5,543","66,140","77,226"
"B24022",41.000,"Management occupations","78,608","+/-8,011","70,597","86,619"
"B24022",42.000,"Business and financial operations occupations","60,998","+/-3,500","57,498","64