n under 18 years","53,089","+/-2,447","50,642","55,536"
"B25115",7.000,"Other family:","19,730","+/-2,110","17,620","21,840"
"B25115",8.000,"Male householder, no wife present:","6,258","+/-1,149","5,109","7,407"
"B25115",9.000,"With own children under 18 years","2,521","+/-767","1,754","3,288"
"B25115",10.000,"No own children under 18 years","3,737","+/-873","2,864","4,610"
"B25115",11.000,"Female householder, no husband present:","13,472","+/-1,871","11,601","15,343"
"B25115",12.000,"With own children unde