","+/-655","777","2,087"
"B24020",210.000,"Bookkeeping, accounting, and auditing clerks","1,944","+/-632","1,312","2,576"
"B24020",211.000,"Information and record clerks except customer service representatives","2,430","+/-807","1,623","3,237"
"B24020",212.000,"Customer service representatives","1,454","+/-657","797","2,111"
"B24020",213.000,"Material recording, scheduling, dispatching, and distributing workers","1,921","+/-881","1,040","2,802"
"B24020",214.000,"Secretaries and administrative assistants","5