"131,521","+/-3,938","127,583","135,459"
"B17018",21.000,"Less than high school graduate","9,746","+/-1,325","8,421","11,071"
"B17018",22.000,"High school graduate (includes equivalency)","17,876","+/-2,088","15,788","19,964"
"B17018",23.000,"Some college, associate's degree","34,559","+/-2,443","32,116","37,002"
"B17018",24.000,"Bachelor's degree or higher","69,340","+/-3,084","66,256","72,424"
"B17018",25.000,"Other families:","33,955","+/-2,711","31,244","36,666"
"B17018",26.000,"Male householder, no wif