00,880","+/-3,511","297,369","304,391"
"C18035",.,"GO-OUTSIDE-HOME DISABILITY BY SEX BY POVERTY STATUS FOR THE CIVILIAN NONINSTITUTIONALIZED POPULATION 16 YEARS AND OVER",,,,
"C18035",.,"Universe:  Civilian noninstitutionalized population 16 years and over for whom poverty status is determined",,,,
"C18035",1.000,"Total:","562,199","+/-1,064","561,135","563,263"
"C18035",2.000,"With a go-outside-home disability:","26,193","+/-2,429","23,764","28,622"
"C18035",3.000,"Male:","7,559","+/-1,319","6,240","8,878"