nd health care and social assistance:","1,363","+/-438","925","1,801"
"B24070",75.000,"Educational services","75","+/-124","0","199"
"B24070",76.000,"Health care and social assistance","1,288","+/-439","849","1,727"
"B24070",77.000,"Arts, entertainment, and recreation, and accommodation and food services:","827","+/-466","361","1,293"
"B24070",78.000,"Arts, entertainment, and recreation","333","+/-308","25","641"
"B24070",79.000,"Accommodation and food services","494","+/-348","146","842"
"B24070",80.000,"O