9",7.000,"Income in the past 12 months at or above poverty level:","17,196","+/-2,793","14,403","19,989"
"B10059",8.000,"Grandparent responsible for own grandchildren under 18 years:","2,942","+/-1,097","1,845","4,039"
"B10059",9.000,"30 to 59 years","2,303","+/-1,084","1,219","3,387"
"B10059",10.000,"60 years and over","639","+/-377","262","1,016"
"B10059",11.000,"Grandparent not responsible for own grandchildren under 18 years","14,254","+/-2,416","11,838","16,670"
"B10060",.,"UNITS IN STRUCTURE OF GRANDP