24031",23.000,"Arts, entertainment, and recreation, and accommodations and food services","20,600","+/-1,305","19,295","21,905"
"B24031",24.000,"Arts, entertainment, and recreation","21,740","+/-4,482","17,258","26,222"
"B24031",25.000,"Accommodation and food services","20,364","+/-1,453","18,911","21,817"
"B24031",26.000,"Other services except public administration","25,531","+/-4,072","21,459","29,603"
"B24031",27.000,"Public administration","64,921","+/-5,193","59,728","70,114"
"B24032",.,"SEX BY INDUSTR