, extraction, maintenance, and repair occupations:","3,565","+/-884","2,681","4,449"
"B24010D",28.000,"Construction and extraction occupations","979","+/-582","397","1,561"
"B24010D",29.000,"Installation, maintenance, and repair occupations","2,586","+/-749","1,837","3,335"
"B24010D",30.000,"Production, transportation, and material moving occupations:","4,020","+/-1,172","2,848","5,192"
"B24010D",31.000,"Production occupations","1,057","+/-562","495","1,619"
"B24010D",32.000,"Transportation and material mov