"2,014","+/-811","1,203","2,825"
"B24020",200.000,"Supervisors and other personal care and service workers except personal appearance, transportation, and child care workers","1,957","+/-920","1,037","2,877"
"B24020",201.000,"Sales and office occupations:","31,175","+/-2,634","28,541","33,809"
"B24020",202.000,"Sales and related occupations:","10,007","+/-1,791","8,216","11,798"
"B24020",203.000,"Cashiers","861","+/-431","430","1,292"
"B24020",204.000,"Retail sales workers except cashiers","1,489","+/-810",