5,476","+/-3,739","161,737","169,215"
"C17010",11.000,"Married-couple family:","131,521","+/-3,938","127,583","135,459"
"C17010",12.000,"With related children under 18 years","65,450","+/-3,549","61,901","68,999"
"C17010",13.000,"Other family:","33,955","+/-2,711","31,244","36,666"
"C17010",14.000,"Male householder, no wife present","10,739","+/-1,665","9,074","12,404"
"C17010",15.000,"With related children under 18 years","5,500","+/-1,262","4,238","6,762"
"C17010",16.000,"Female householder, no husband pr