000,"Computer and mathematical occupations","100,000+","***","***","***"
"B24022",8.000,"Architecture and engineering occupations","85,317","+/-11,204","74,113","96,521"
"B24022",9.000,"Life, physical, and social science occupations","84,103","+/-26,129","57,974","110,232"
"B24022",10.000,"Community and social services occupations","51,636","+/-26,774","24,862","78,410"
"B24022",11.000,"Legal occupations","100,000+","***","***","***"
"B24022",12.000,"Education, training, and library occupations","60,706","+