,687","24,714","30,088"
"B24070",45.000,"Management of companies and enterprises","337","+/-437","0","774"
"B24070",46.000,"Administrative and support and waste management services","13,792","+/-2,674","11,118","16,466"
"B24070",47.000,"Educational services, and health care and social assistance:","27,806","+/-3,201","24,605","31,007"
"B24070",48.000,"Educational services","4,345","+/-1,202","3,143","5,547"
"B24070",49.000,"Health care and social assistance","23,461","+/-3,098","20,363","26,559"
"B24070",50