416","+/-726","690","2,142"
"B14001F",4.000,"Enrolled in grade 1 to grade 8","5,258","+/-1,235","4,023","6,493"
"B14001F",5.000,"Enrolled in grade 9 to grade 12","2,286","+/-643","1,643","2,929"
"B14001F",6.000,"Enrolled in college or graduate school","3,659","+/-1,083","2,576","4,742"
"B14001F",7.000,"Not enrolled in school","30,118","+/-4,509","25,609","34,627"
"B14001G",.,"SCHOOL ENROLLMENT BY LEVEL OF SCHOOL FOR THE POPULATION 3 YEARS AND OVER (TWO OR MORE RACES)",,,,
"B14001G",.,"Universe:  Two or more