s","17,091","+/-2,009","15,082","19,100"
"B24040",91.000,"Management of companies and enterprises","310","+/-433","0","743"
"B24040",92.000,"Administrative and support and waste management services","8,432","+/-1,859","6,573","10,291"
"B24040",93.000,"Educational services, and health care and social assistance:","14,936","+/-2,383","12,553","17,319"
"B24040",94.000,"Educational services","5,193","+/-1,198","3,995","6,391"
"B24040",95.000,"Health care and social assistance:","9,743","+/-2,029","7,714","11,77