,140"
"B08007",9.000,"Worked outside county of residence","89,784","+/-3,980","85,804","93,764"
"B08007",10.000,"Worked outside state of residence","1,244","+/-645","599","1,889"
"B08007",11.000,"Female:","156,129","+/-4,269","151,860","160,398"
"B08007",12.000,"Worked in state of residence:","155,725","+/-4,275","151,450","160,000"
"B08007",13.000,"Worked in county of residence","95,527","+/-3,971","91,556","99,498"
"B08007",14.000,"Worked outside county of residence","60,198","+/-3,647","56,551","63,845"
