.,"SEX BY INDUSTRY FOR THE FULL-TIME, YEAR-ROUND CIVILIAN EMPLOYED POPULATION 16 YEARS AND OVER",,,,
"B24040",.,"Universe:  Full-time, year-round civilian employed population 16 years and over",,,,
"B24040",1.000,"Total:","240,448","+/-6,407","234,041","246,855"
"B24040",2.000,"Male:","144,504","+/-4,306","140,198","148,810"
"B24040",3.000,"Agriculture, forestry, fishing and hunting, and mining:","912","+/-535","377","1,447"
"B24040",4.000,"Agriculture, forestry, fishing and hunting","858","+/-536","322","1