,,
"C05001",.,"Universe:  Total population in the United States",,,,
"C05001",1.000,"Total:","706,984","*****","*****","*****"
"C05001",2.000,"U.S. citizen, born in the United States","454,355","+/-7,139","447,216","461,494"
"C05001",3.000,"U.S. citizen, born in Puerto Rico, U.S. Island Areas, or born abroad of American parent(s)","12,983","+/-3,276","9,707","16,259"
"C05001",4.000,"U.S. citizen by naturalization","133,746","+/-6,427","127,319","140,173"
"C05001",5.000,"Not a U.S. citizen","105,900","+/-7,6