7.000,"Local, state, and federal government workers:","44,163","+/-3,238","40,925","47,401"
"B24060",158.000,"Management, professional, and related occupations:","23,737","+/-2,573","21,164","26,310"
"B24060",159.000,"Management, business, and financial occupations:","5,508","+/-1,188","4,320","6,696"
"B24060",160.000,"Management occupations","3,336","+/-1,016","2,320","4,352"
"B24060",161.000,"Business and financial operations occupations","2,172","+/-637","1,535","2,809"
"B24060",162.000,"Professional and