000,"Farmers and farm managers","142","+/-230","0","372"
"B24010A",7.000,"Business and financial operations occupations","6,051","+/-1,113","4,938","7,164"
"B24010A",8.000,"Professional and related occupations:","27,491","+/-2,233","25,258","29,724"
"B24010A",9.000,"Computer and mathematical occupations","6,763","+/-1,394","5,369","8,157"
"B24010A",10.000,"Architecture and engineering occupations","4,839","+/-1,028","3,811","5,867"
"B24010A",11.000,"Life, physical, and social science occupations","2,101","+