r family:","N","N","N","N"
"B11001E",5.000,"Male householder, no wife present","N","N","N","N"
"B11001E",6.000,"Female householder, no husband present","N","N","N","N"
"B11001E",7.000,"Nonfamily households:","N","N","N","N"
"B11001E",8.000,"Householder living alone","N","N","N","N"
"B11001E",9.000,"Householder not living alone","N","N","N","N"
"B11001F",.,"HOUSEHOLD TYPE (INCLUDING LIVING ALONE) (SOME OTHER RACE ALONE)",,,,
"B11001F",.,"Universe:  Households with a householder who is Some other race alone",