,27.000,"Sales and related occupations","24,426","+/-2,982","21,444","27,408"
"C24010",28.000,"Office and administrative support occupations","18,435","+/-2,356","16,079","20,791"
"C24010",29.000,"Farming, fishing, and forestry occupations","1,411","+/-720","691","2,131"
"C24010",30.000,"Construction, extraction, maintenance, and repair occupations:","24,870","+/-2,684","22,186","27,554"
"C24010",31.000,"Construction and extraction occupations","15,759","+/-2,114","13,645","17,873"
"C24010",32.000,"Installa