-couple family:","64,089","+/-3,565","60,524","67,654"
"C23007",4.000,"Husband in labor force:","60,513","+/-3,620","56,893","64,133"
"C23007",5.000,"Wife in labor force","41,763","+/-3,020","38,743","44,783"
"C23007",6.000,"Wife not in labor force","18,750","+/-2,233","16,517","20,983"
"C23007",7.000,"Husband not in labor force:","3,576","+/-850","2,726","4,426"
"C23007",8.000,"Wife in labor force","2,230","+/-689","1,541","2,919"
"C23007",9.000,"Wife not in labor force","1,346","+/-508","838","1,854"
"C23