000,"Armed forces","0","+/-292","0","292"
"C08124",41.000,"Worked at home:","16,107","+/-1,992","14,115","18,099"
"C08124",42.000,"Management, professional, and related occupations","8,011","+/-1,256","6,755","9,267"
"C08124",43.000,"Service occupations","3,143","+/-845","2,298","3,988"
"C08124",44.000,"Sales and office occupations","3,788","+/-970","2,818","4,758"
"C08124",45.000,"Farming, fishing, and forestry occupations","64","+/-105","0","169"
"C08124",46.000,"Construction and extraction, and maintenan