nd rental and leasing:","915","+/-462","453","1,377"
"B24070",95.000,"Finance and insurance","915","+/-462","453","1,377"
"B24070",96.000,"Real estate and rental and leasing","0","+/-292","0","292"
"B24070",97.000,"Professional, scientific, and management, and administrative and waste management services:","1,619","+/-728","891","2,347"
"B24070",98.000,"Professional, scientific, and technical services","821","+/-500","321","1,321"
"B24070",99.000,"Management of companies and enterprises","0","+/-292","0","2