 and related occupations","50,300","+/-6,683","43,617","56,983"
"B24022",64.000,"Office and administrative support occupations","44,372","+/-2,902","41,470","47,274"
"B24022",65.000,"Farming, fishing, and forestry occupations","-","**","**","**"
"B24022",66.000,"Construction, extraction, maintenance, and repair occupations:","45,601","+/-16,552","29,049","62,153"
"B24022",67.000,"Construction and extraction occupations","44,673","+/-126,939","-82,266","171,612"
"B24022",68.000,"Installation, maintenance, an