128","13,526","17,782"
"B24030",192.000,"Finance and insurance","10,830","+/-1,568","9,262","12,398"
"B24030",193.000,"Real estate and rental and leasing","4,824","+/-1,255","3,569","6,079"
"B24030",194.000,"Professional, scientific, and management, and administrative and waste management services:","23,364","+/-2,807","20,557","26,171"
"B24030",195.000,"Professional, scientific, and technical services","16,039","+/-2,055","13,984","18,094"
"B24030",196.000,"Management of companies and enterprises","82","+/