.000,"Bachelor's degree","5,004","+/-1,441","3,563","6,445"
"B07009",24.000,"Graduate or professional degree","3,273","+/-1,006","2,267","4,279"
"B07009",25.000,"Moved from different state:","5,477","+/-1,769","3,708","7,246"
"B07009",26.000,"Less than high school graduate","372","+/-279","93","651"
"B07009",27.000,"High school graduate (includes equivalency)","523","+/-446","77","969"
"B07009",28.000,"Some college or associate's degree","1,111","+/-732","379","1,843"
"B07009",29.000,"Bachelor's degree","1,