rs","296","+/-319","0","615"
"B24020",189.000,"Other protective service workers including supervisors","636","+/-448","188","1,084"
"B24020",190.000,"Food preparation and serving related occupations:","3,367","+/-1,049","2,318","4,416"
"B24020",191.000,"Cooks and food preparation workers","913","+/-602","311","1,515"
"B24020",192.000,"Waiters and waitresses","1,044","+/-589","455","1,633"
"B24020",193.000,"Food and beverage serving workers except waiters/waitresses","656","+/-445","211","1,101"
"B24020",194