e householder, no wife present","777","+/-417","360","1,194"
"C17010F",15.000,"With related children under 18 years","391","+/-288","103","679"
"C17010F",16.000,"Female householder, no husband present","1,641","+/-577","1,064","2,218"
"C17010F",17.000,"With related children under 18 years","1,124","+/-525","599","1,649"
"C17010G",.,"POVERTY STATUS IN THE PAST 12 MONTHS OF FAMILIES BY FAMILY TYPE BY PRESENCE OF RELATED CHILDREN UNDER 18 YEARS (TWO OR MORE RACES HOUSEHOLDER)",,,,
"C17010G",.,"Universe:  Famil