farmers and farm managers","17,594","+/-1,944","15,650","19,538"
"B24010H",6.000,"Farmers and farm managers","142","+/-230","0","372"
"B24010H",7.000,"Business and financial operations occupations","5,991","+/-1,116","4,875","7,107"
"B24010H",8.000,"Professional and related occupations:","25,690","+/-2,188","23,502","27,878"
"B24010H",9.000,"Computer and mathematical occupations","6,381","+/-1,350","5,031","7,731"
"B24010H",10.000,"Architecture and engineering occupations","4,682","+/-1,036","3,646","5,718"