"36,202","+/-3,126","33,076","39,328"
"B24060",67.000,"Farming, fishing, and forestry occupations","1,417","+/-719","698","2,136"
"B24060",68.000,"Construction, extraction, maintenance, and repair occupations:","19,928","+/-2,638","17,290","22,566"
"B24060",69.000,"Construction and extraction occupations","12,424","+/-1,983","10,441","14,407"
"B24060",70.000,"Installation, maintenance, and repair occupations","7,504","+/-1,649","5,855","9,153"
"B24060",71.000,"Production, transportation, and material moving