gineers","709","+/-376","333","1,085"
"B24010",150.000,"Drafters, engineering, and mapping technicians","326","+/-197","129","523"
"B24010",151.000,"Life, physical, and social science occupations:","3,058","+/-889","2,169","3,947"
"B24010",152.000,"Life and physical scientists","1,388","+/-668","720","2,056"
"B24010",153.000,"Social scientists and related workers","1,087","+/-415","672","1,502"
"B24010",154.000,"Life, physical, and social science technicians","583","+/-283","300","866"
"B24010",155.000,"Com