0.000,"Other family:","3,171","+/-951","2,220","4,122"
"B17015",11.000,"Male householder, no wife present:","600","+/-407","193","1,007"
"B17015",12.000,"With Social Security income in the past 12 months:","48","+/-80","0","128"
"B17015",13.000,"With SSI and/or cash public assistance income in the past 12 months","0","+/-292","0","292"
"B17015",14.000,"Without SSI or cash public assistance income in the past 12 months","48","+/-80","0","128"
"B17015",15.000,"Without Social Security income in the past 12 mon