 MORE OTHER RACES",,,,
"B02009",.,"Universe:  Black or African American alone or in combination with one or more other races",,,,
"B02009",1.000,"Total:","24,846","+/-1,241","23,605","26,087"
"B02010",.,"AMERICAN INDIAN AND ALASKA NATIVE ALONE OR IN COMBINATION WITH ONE OR MORE OTHER RACES",,,,
"B02010",.,"Universe:  American Indian and Alaska Native alone or in combination with one or more other races",,,,
"B02010",1.000,"Total:","5,732","+/-1,057","4,675","6,789"
"B02011",.,"ASIAN ALONE OR IN COMBINATION 