ths:","552","+/-411","141","963"
"B17015",16.000,"With SSI and/or cash public assistance income in the past 12 months","0","+/-292","0","292"
"B17015",17.000,"Without SSI or cash public assistance income in the past 12 months","552","+/-411","141","963"
"B17015",18.000,"Female householder, no husband present:","2,571","+/-913","1,658","3,484"
"B17015",19.000,"With Social Security income in the past 12 months:","681","+/-479","202","1,160"
"B17015",20.000,"With SSI and/or cash public assistance income in the