 BY SEX BY POVERTY STATUS FOR THE CIVILIAN NONINSTITUTIONALIZED POPULATION 5 YEARS AND OVER",,,,
"C18034",.,"Universe:  Civilian noninstitutionalized population 16 years and over for whom poverty status is determined",,,,
"C18034",1.000,"Total:","654,820","+/-759","654,061","655,579"
"C18034",2.000,"With a self-care disability:","15,230","+/-1,937","13,293","17,167"
"C18034",3.000,"Male:","3,996","+/-979","3,017","4,975"
"C18034",4.000,"Income in the past 12 months below the poverty level","441","+/-292","1