 occupations","996","+/-409","587","1,405"
"C24060",140.000,"Personal care and service occupations","1,009","+/-653","356","1,662"
"C24060",141.000,"Sales and office occupations:","11,123","+/-1,788","9,335","12,911"
"C24060",142.000,"Sales and related occupations","153","+/-141","12","294"
"C24060",143.000,"Office and administrative support occupations","10,970","+/-1,805","9,165","12,775"
"C24060",144.000,"Farming, fishing, and forestry occupations","0","+/-292","0","292"
"C24060",145.000,"Construction ex