elated occupations:","41,735","+/-3,205","38,530","44,940"
"B24060",46.000,"Computer and mathematical occupations","13,428","+/-1,849","11,579","15,277"
"B24060",47.000,"Architecture and engineering occupations","6,311","+/-1,194","5,117","7,505"
"B24060",48.000,"Life, physical, and social science occupations","3,612","+/-922","2,690","4,534"
"B24060",49.000,"Community and social services occupations","167","+/-166","1","333"
"B24060",50.000,"Legal occupations","3,669","+/-992","2,677","4,661"
"B24060",51.0