","+/-292","0","292"
"B24060",118.000,"Private not-for-profit wage and salary workers:","25,789","+/-3,146","22,643","28,935"
"B24060",119.000,"Management, professional, and related occupations:","17,138","+/-2,368","14,770","19,506"
"B24060",120.000,"Management, business, and financial occupations:","5,413","+/-1,235","4,178","6,648"
"B24060",121.000,"Management occupations","4,389","+/-1,108","3,281","5,497"
"B24060",122.000,"Business and financial operations occupations","1,024","+/-501","523","1,525"
"B