12",11.000,"No physical disability:","138,781","+/-1,187","137,594","139,968"
"B18012",12.000,"Enrolled in school:","41,561","+/-2,896","38,665","44,457"
"B18012",13.000,"Below college","5,623","+/-1,268","4,355","6,891"
"B18012",14.000,"College or graduate school","35,938","+/-2,890","33,048","38,828"
"B18012",15.000,"Not enrolled in school:","97,220","+/-2,729","94,491","99,949"
"B18012",16.000,"Less than high school graduate","15,372","+/-2,746","12,626","18,118"
"B18012",17.000,"High school graduate (in