","1,053"
"B24030",208.000,"Personal and laundry services","3,490","+/-911","2,579","4,401"
"B24030",209.000,"Religious, grantmaking, civic, professional, and similar organizations","2,731","+/-811","1,920","3,542"
"B24030",210.000,"Private households","5,663","+/-1,296","4,367","6,959"
"B24030",211.000,"Public administration","5,589","+/-1,276","4,313","6,865"
"B24031",.,"INDUSTRY BY MEDIAN EARNINGS IN THE PAST 12 MONTHS (IN 2007 INFLATION-ADJUSTED DOLLARS) FOR THE CIVILIAN EMPLOYED POPULATION 16 YEARS AND