5","+/-3,239","32,776","39,254"
"C08137",11.000,"Householder lived in owner-occupied housing units","15,288","+/-2,204","13,084","17,492"
"C08137",12.000,"Householder lived in renter-occupied housing units","20,727","+/-2,960","17,767","23,687"
"C08137",13.000,"Taxicab, motorcycle, bicycle, walked, or other means:","17,633","+/-3,882","13,751","21,515"
"C08137",14.000,"Householder lived in owner-occupied housing units","5,582","+/-1,354","4,228","6,936"
"C08137",15.000,"Householder lived in renter-occupied 