9,1331761,+/-23928,,,,,,
S0502,48,Less than high school graduate,27.7,+/-0.5,27.3,+/-1.6,25.4,+/-0.9,29.2,+/-0.7,,,,,,
S0502,49,High school graduate (includes equivalency),28.5,+/-0.5,26.9,+/-1.4,29.2,+/-0.9,28.5,+/-0.8,,,,,,
S0502,50,Some college or associate's degree,16.5,+/-0.4,13.9,+/-1.0,16.6,+/-0.8,17.4,+/-0.5,,,,,,
S0502,51,Bachelor's degree,17.3,+/-0.4,17.7,+/-1.2,19.2,+/-0.8,15.9,+/-0.6,,,,,,
S0502,52,Graduate or professional degree,10.1,+/-0.4,14.1,+/-1.2,9.5,+/-0.6,9.0,+/-0.5,,,,,,
S0502,52.3, ,,