an Social Security income (dollars),12300,+/-233,14871,+/-438,16858,+/-900,14304,+/-460,,,,,,
S0503,103,With Supplemental Security Income,7.4,+/-0.4,11.3,+/-0.8,1.8,+/-0.7,13.7,+/-1.0,,,,,,
S0503,104,Mean Supplemental Security Income (dollars),7540,+/-177,8945,+/-314,6586,+/-1615,9042,+/-321,,,,,,
S0503,105,With cash public assistance income,3.3,+/-0.3,1.2,+/-0.3,0.5,+/-0.4,1.3,+/-0.4,,,,,,
S0503,106,Mean cash public assistance income (dollars),3411,+/-274,3893,+/-1056,1578,+/-917,4098,+/-1118,,,,,,
S0503,1