OF WORK",,,,,,,,,,,,
"S0801",14.0,"Worked in state of residence","96.8","+/-0.2","96.1","+/-0.3","97.6","+/-0.2",,,,,,
"S0801",15.0,"Worked in county of residence","55.0","+/-0.5","52.8","+/-0.6","57.5","+/-0.6",,,,,,
"S0801",16.0,"Worked outside county of residence","41.8","+/-0.5","43.3","+/-0.6","40.1","+/-0.6",,,,,,
"S0801",17.0,"Worked outside state of residence","3.2","+/-0.2","3.9","+/-0.3","2.4","+/-0.2",,,,,,
"S0801",17.3,,,,,,,,,,,,,
"S0801",18.0,"Living in a place","100.0","+/-0.1","100.0","+/-0.