,2.9,+/-1.1,3.2,+/-0.8,,,,,,
S0503,79,Retail trade,10.1,+/-0.4,7.4,+/-1.1,3.9,+/-1.3,8.4,+/-1.4,,,,,,
S0503,80,Transportation and warehousing and utilities,7.7,+/-0.4,5.4,+/-0.8,2.4,+/-1.0,6.2,+/-1.0,,,,,,
S0503,81,Information,2.1,+/-0.2,3.7,+/-0.7,5.9,+/-2.0,3.1,+/-0.7,,,,,,
S0503,82,Finance and insurance and real estate and rental and leasing,8.8,+/-0.4,13.1,+/-1.1,18.4,+/-3.1,11.5,+/-1.3,,,,,,
S0503,83,Professional scientific and management and administrative and waste management services,9.4,+/-0.4,14.4