","+/-814","32,562","+/-527",,,,,,
"S2001",16.0,"Less than high school graduate","18,655","+/-515","21,610","+/-423","14,443","+/-506",,,,,,
"S2001",17.0,"High school graduate (includes equivalency)","26,689","+/-381","30,252","+/-472","23,269","+/-714",,,,,,
"S2001",18.0,"Some college or associate's degree","34,772","+/-737","39,239","+/-1,313","31,398","+/-436",,,,,,
"S2001",19.0,"Bachelor's degree","50,472","+/-498","53,900","+/-1,876","46,296","+/-765",,,,,,
"S2001",20.0,"Graduate or professional degree