,,
"S1701",18.0,"Population 25 years and over","5,513,106","+/-1,708","827,539","+/-19,531","15.0","+/-0.4",,,,,,
"S1701",19.0,"Less than high school graduate","1,146,109","+/-17,308","335,632","+/-11,865","29.3","+/-0.9",,,,,,
"S1701",20.0,"High school graduate (includes equivalency)","1,492,591","+/-19,964","246,708","+/-10,463","16.5","+/-0.7",,,,,,
"S1701",21.0,"Some college, associate's degree","1,047,107","+/-16,945","132,277","+/-5,929","12.6","+/-0.6",,,,,,
"S1701",22.0,"Bachelor's degree or higher"