481","+/-2,598","15,883","21,079"
"C17010H",6.000,"Male householder, no wife present","2,007","+/-839","1,168","2,846"
"C17010H",7.000,"With related children under 18 years","1,496","+/-785","711","2,281"
"C17010H",8.000,"Female householder, no husband present","16,474","+/-2,417","14,057","18,891"
"C17010H",9.000,"With related children under 18 years","13,746","+/-2,244","11,502","15,990"
"C17010H",10.000,"Income in the past 12 months at or above poverty level:","831,377","+/-8,485","822,892","839,862"
"C1