ept farmers and farm managers","1,073","+/-728","345","1,801"
"B24010G",37.000,"Farmers and farm managers","0","+/-283","0","283"
"B24010G",38.000,"Business and financial operations occupations","575","+/-349","226","924"
"B24010G",39.000,"Professional and related occupations:","3,147","+/-932","2,215","4,079"
"B24010G",40.000,"Computer and mathematical occupations","625","+/-373","252","998"
"B24010G",41.000,"Architecture and engineering occupations","0","+/-283","0","283"
"B24010G",42.000,"Life, physical,