"B16008",37.000,"Speak only English","23,876","+/-2,817","21,059","26,693"
"B16008",38.000,"Speak Spanish","122,263","+/-6,172","116,091","128,435"
"B16008",39.000,"Speak other Indo-European languages","47,806","+/-5,119","42,687","52,925"
"B16008",40.000,"Speak Asian and Pacific Island languages","56,814","+/-4,925","51,889","61,739"
"B16008",41.000,"Speak other languages","21,720","+/-3,972","17,748","25,692"
"B16009",.,"POVERTY STATUS IN THE PAST 12 MONTHS BY AGE BY LANGUAGE SPOKEN AT HOME FOR THE POPULA