","17,927","+/-2,012","15,915","19,939"
"B24020",63.000,"Other protective service workers including supervisors","10,127","+/-1,619","8,508","11,746"
"B24020",64.000,"Food preparation and serving related occupations:","18,642","+/-2,600","16,042","21,242"
"B24020",65.000,"Cooks and food preparation workers","8,043","+/-1,780","6,263","9,823"
"B24020",66.000,"Waiters and waitresses","3,552","+/-1,157","2,395","4,709"
"B24020",67.000,"Food and beverage serving workers except waiters/waitresses","1,860","+/-83