,8.000,"Professional and related occupations:","201,162","+/-6,463","194,699","207,625"
"B24010A",9.000,"Computer and mathematical occupations","62,782","+/-3,642","59,140","66,424"
"B24010A",10.000,"Architecture and engineering occupations","39,991","+/-2,879","37,112","42,870"
"B24010A",11.000,"Life, physical, and social science occupations","11,565","+/-1,403","10,162","12,968"
"B24010A",12.000,"Community and social services occupations","8,228","+/-1,383","6,845","9,611"
"B24010A",13.000,"Legal occupati