",1.000,"Aggregate value (dollars):","481,997,240,000","+/-4,727,772,919","477,269,467,081","486,725,012,919"
"B25082",2.000,"Housing units with a mortgage (dollars)","392,833,535,000","+/-4,887,113,459","387,946,421,541","397,720,648,459"
"B25082",3.000,"Housing units without a mortgage (dollars)","89,163,705,000","+/-3,178,182,515","85,985,522,485","92,341,887,515"
"B25083",.,"MEDIAN VALUE (DOLLARS) FOR MOBILE HOMES",,,,
"B25083",.,"Universe:  Owner-occupied mobile homes",,,,
"B25083",1.000,"Median value 