 and social science occupations","9,559","+/-1,305","8,254","10,864"
"C24060",40.000,"Community and social services occupations","4,142","+/-1,045","3,097","5,187"
"C24060",41.000,"Legal occupations","17,489","+/-2,317","15,172","19,806"
"C24060",42.000,"Education, training, and library occupations","21,913","+/-2,237","19,676","24,150"
"C24060",43.000,"Arts, design, entertainment, sports, and media occupations","20,949","+/-1,932","19,017","22,881"
"C24060",44.000,"Healthcare practitioner and technical occ