00,"Income in the past 12 months below poverty level:","60,267","+/-4,280","55,987","64,547"
"B17018",3.000,"Married-couple family:","22,695","+/-2,362","20,333","25,057"
"B17018",4.000,"Less than high school graduate","7,352","+/-1,326","6,026","8,678"
"B17018",5.000,"High school graduate (includes equivalency)","7,131","+/-1,537","5,594","8,668"
"B17018",6.000,"Some college, associate's degree","3,515","+/-1,008","2,507","4,523"
"B17018",7.000,"Bachelor's degree or higher","4,697","+/-1,224","3,473","5,92