"Top executives","32,072","+/-2,973","29,099","35,045"
"B24010",7.000,"Advertising, marketing, promotions, public relations, and sales managers","11,052","+/-1,759","9,293","12,811"
"B24010",8.000,"Financial managers","10,342","+/-1,358","8,984","11,700"
"B24010",9.000,"Operations specialties managers except financial managers","24,195","+/-2,310","21,885","26,505"
"B24010",10.000,"Farmers and farm managers","5,783","+/-1,245","4,538","7,028"
"B24010",11.000,"Other management occupations except farmers and 