9",13.000,"Moved within same county:","140,186","+/-7,265","132,921","147,451"
"B07009",14.000,"Less than high school graduate","17,858","+/-2,618","15,240","20,476"
"B07009",15.000,"High school graduate (includes equivalency)","43,535","+/-4,587","38,948","48,122"
"B07009",16.000,"Some college or associate's degree","35,455","+/-3,652","31,803","39,107"
"B07009",17.000,"Bachelor's degree","28,332","+/-3,447","24,885","31,779"
"B07009",18.000,"Graduate or professional degree","15,006","+/-2,146","12,860","1