86,800","+/-2,239","184,561","189,039"
"B25077",.,"MEDIAN VALUE (DOLLARS)",,,,
"B25077",.,"Universe:  Owner-occupied housing units",,,,
"B25077",1.000,"Median value (dollars)","326,500","+/-3,370","323,130","329,870"
"B25078",.,"UPPER VALUE QUARTILE (DOLLARS)",,,,
"B25078",.,"Universe:  Owner-occupied housing units",,,,
"B25078",1.000,"Upper value quartile (dollars)","511,700","+/-7,588","504,112","519,288"
"B25079",.,"AGGREGATE VALUE (DOLLARS) BY AGE OF HOUSEHOLDER",,,,
"B25079",.,"Universe:  Owner-occupie