25","1,471"
"B24030",66.000,"Used merchandise, gift, novelty, and souvenir, and other miscellaneous stores","3,724","+/-865","2,859","4,589"
"B24030",67.000,"Electronic shopping and mail-order houses","1,804","+/-818","986","2,622"
"B24030",68.000,"Vending machine operators","258","+/-175","83","433"
"B24030",69.000,"Fuel dealers","1,270","+/-431","839","1,701"
"B24030",70.000,"Other direct selling establishments","2,977","+/-886","2,091","3,863"
"B24030",71.000,"Transportation and warehousing, and utilitie