-1,485","8,468","11,438"
"B24070",155.000,"Educational services, and health care and social assistance:","15,719","+/-2,370","13,349","18,089"
"B24070",156.000,"Educational services","3,281","+/-1,073","2,208","4,354"
"B24070",157.000,"Health care and social assistance","12,438","+/-1,800","10,638","14,238"
"B24070",158.000,"Arts, entertainment, and recreation, and accommodation and food services:","5,105","+/-950","4,155","6,055"
"B24070",159.000,"Arts, entertainment, and recreation","3,090","+/-772","2,31