97","65","659"
"B24040",166.000,"Music stores","0","+/-283","0","283"
"B24040",167.000,"Book stores and news dealers","1,384","+/-592","792","1,976"
"B24040",168.000,"Department and other general merchandise stores","11,591","+/-1,904","9,687","13,495"
"B24040",169.000,"Florists","871","+/-567","304","1,438"
"B24040",170.000,"Office supplies and stationery stores","519","+/-400","119","919"
"B24040",171.000,"Used merchandise, gift, novelty, and souvenir, and other miscellaneous stores","3,311","+/-823","2,4