119,154","130,160"
"B24030",49.000,"Motor vehicle and parts dealers","24,600","+/-2,621","21,979","27,221"
"B24030",50.000,"Furniture and home furnishings, and household appliance stores","6,041","+/-1,318","4,723","7,359"
"B24030",51.000,"Radio, TV, and computer and software, and other electronic stores","8,168","+/-1,372","6,796","9,540"
"B24030",52.000,"Building material and garden equipment and supplies dealers","16,301","+/-2,579","13,722","18,880"
"B24030",53.000,"Food and beverage stores","24,130","+