tions:","26,243","+/-520","25,723","26,763"
"B24012",63.000,"Sales and related occupations","20,060","+/-985","19,075","21,045"
"B24012",64.000,"Office and administrative support occupations","28,801","+/-758","28,043","29,559"
"B24012",65.000,"Farming, fishing, and forestry occupations","21,201","+/-19,322","1,879","40,523"
"B24012",66.000,"Construction, extraction, maintenance, and repair occupations:","35,464","+/-6,321","29,143","41,785"
"B24012",67.000,"Construction and extraction occupations","32,649"