ance and insurance","104,967","+/-5,409","99,558","110,376"
"B24070",42.000,"Real estate and rental and leasing","32,360","+/-2,993","29,367","35,353"
"B24070",43.000,"Professional, scientific, and management, and administrative and waste management services:","271,816","+/-7,525","264,291","279,341"
"B24070",44.000,"Professional, scientific, and technical services","204,800","+/-6,854","197,946","211,654"
"B24070",45.000,"Management of companies and enterprises","3,260","+/-991","2,269","4,251"
"B24070",46