,238","4,774","7,250"
"B15004",8.000,"Income in the past 12 months at or above poverty level:","2,765,804","+/-11,132","2,754,672","2,776,936"
"B15004",9.000,"Less than high school graduate","283,783","+/-10,124","273,659","293,907"
"B15004",10.000,"High school graduate (includes equivalency)","693,127","+/-12,485","680,642","705,612"
"B15004",11.000,"Some college or associate's degree","705,384","+/-13,311","692,073","718,695"
"B15004",12.000,"Bachelor's degree","640,675","+/-11,815","628,860","652,490"
"B