 related occupations","80,044","+/-5,296","74,748","85,340"
"B24060",62.000,"Building and grounds cleaning and maintenance occupations","39,949","+/-3,505","36,444","43,454"
"B24060",63.000,"Personal care and service occupations","39,695","+/-3,513","36,182","43,208"
"B24060",64.000,"Sales and office occupations:","408,244","+/-9,972","398,272","418,216"
"B24060",65.000,"Sales and related occupations","203,528","+/-7,599","195,929","211,127"
"B24060",66.000,"Office and administrative support occupations","2