/-6,537","62,290","75,364"
"B24011",10.000,"Community and social services occupations","37,709","+/-1,855","35,854","39,564"
"B24011",11.000,"Legal occupations","79,686","+/-5,263","74,423","84,949"
"B24011",12.000,"Education, training, and library occupations","38,277","+/-1,071","37,206","39,348"
"B24011",13.000,"Arts, design, entertainment, sports, and media occupations","40,600","+/-3,327","37,273","43,927"
"B24011",14.000,"Healthcare practitioner and technical occupations:","50,114","+/-1,309","48,805"