 or more","1,096","+/-483","613","1,579"
"B20005E",.,"SEX BY WORK EXPERIENCE IN THE PAST 12 MONTHS BY EARNINGS IN THE PAST 12 MONTHS (IN 2007 INFLATION-ADJUSTED DOLLARS) FOR THE POPULATION 16 YEARS AND OVER (NATIVE HAWAIIAN AND OTHER PACIFIC ISLANDER ALONE)",,,,
"B20005E",.,"Universe:  Native Hawaiian and Other Pacific Islander alone population 16 years and over",,,,
"B20005E",1.000,"Total:","N","N","N","N"
"B20005E",2.000,"Male:","N","N","N","N"
"B20005E",3.000,"Worked full-time, year-round in the past 12 