 and office occupations","553,155","+/-10,217","542,938","563,372"
"B24060",26.000,"Sales and related occupations","249,246","+/-7,601","241,645","256,847"
"B24060",27.000,"Office and administrative support occupations","303,909","+/-8,068","295,841","311,977"
"B24060",28.000,"Farming, fishing, and forestry occupations","8,699","+/-1,644","7,055","10,343"
"B24060",29.000,"Construction, extraction, maintenance, and repair occupations:","222,752","+/-7,866","214,886","230,618"
"B24060",30.000,"Construction an