000,"Worked in Metropolitan Statistical Area of residence:","2,131,290","+/-12,706","2,118,584","2,143,996"
"C08016",3.000,"Worked in a principal city","635,262","+/-11,990","623,272","647,252"
"C08016",4.000,"Worked outside any principal city","1,496,028","+/-13,927","1,482,101","1,509,955"
"C08016",5.000,"Worked in a different Metropolitan Statistical Area:","105,035","+/-4,732","100,303","109,767"
"C08016",6.000,"Worked in a principal city","40,425","+/-3,103","37,322","43,528"
"C08016",7.000,"Worked out