9.000,"Building and grounds cleaning and maintenance occupations","3,398","+/-1,154","2,244","4,552"
"C24060",110.000,"Personal care and service occupations","4,584","+/-1,092","3,492","5,676"
"C24060",111.000,"Sales and office occupations:","27,979","+/-2,759","25,220","30,738"
"C24060",112.000,"Sales and related occupations","5,988","+/-1,196","4,792","7,184"
"C24060",113.000,"Office and administrative support occupations","21,991","+/-2,570","19,421","24,561"
"C24060",114.000,"Farming, fishing, and fores