010A",50.000,"Protective service occupations","9,177","+/-1,384","7,793","10,561"
"B24010A",51.000,"Food preparation and serving related occupations","38,355","+/-2,771","35,584","41,126"
"B24010A",52.000,"Building and grounds cleaning and maintenance occupations","16,816","+/-2,382","14,434","19,198"
"B24010A",53.000,"Personal care and service occupations","35,160","+/-3,001","32,159","38,161"
"B24010A",54.000,"Sales and office occupations:","255,448","+/-7,802","247,646","263,250"
"B24010A",55.000,"Sales 