10A",24.000,"Sales and related occupations","97,619","+/-4,469","93,150","102,088"
"B24010A",25.000,"Office and administrative support occupations","50,678","+/-3,284","47,394","53,962"
"B24010A",26.000,"Farming, fishing, and forestry occupations","5,034","+/-1,313","3,721","6,347"
"B24010A",27.000,"Construction, extraction, maintenance, and repair occupations:","159,544","+/-6,331","153,213","165,875"
"B24010A",28.000,"Construction and extraction occupations","100,725","+/-5,850","94,875","106,575"
"B24010