49","+/-2,272","18,677","23,221"
"C24010",22.000,"Law enforcement workers including supervisors","20,066","+/-2,175","17,891","22,241"
"C24010",23.000,"Food preparation and serving related occupations","37,212","+/-3,537","33,675","40,749"
"C24010",24.000,"Building and grounds cleaning and maintenance occupations","38,625","+/-3,303","35,322","41,928"
"C24010",25.000,"Personal care and service occupations","12,429","+/-2,053","10,376","14,482"
"C24010",26.000,"Sales and office occupations:","198,089","+/-6,