months at or above the poverty level","1,298,351","+/-8,329","1,290,022","1,306,680"
"C18036",13.000,"Female:","1,430,156","+/-7,417","1,422,739","1,437,573"
"C18036",14.000,"Income in the past 12 months below the poverty level","92,239","+/-4,826","87,413","97,065"
"C18036",15.000,"Income in the past 12 months at or above the poverty level","1,337,917","+/-8,776","1,329,141","1,346,693"
"C19001",.,"HOUSEHOLD INCOME IN THE PAST 12 MONTHS (IN 2007 INFLATION-ADJUSTED DOLLARS)",,,,
"C19001",.,"Universe:  House