"+/-4,242","80,199","88,683"
"C08105B",.,"MEANS OF TRANSPORTATION TO WORK (BLACK OR AFRICAN AMERICAN ALONE)",,,,
"C08105B",.,"Universe:  Black or African American alone workers 16 years and over",,,,
"C08105B",1.000,"Total:","339,678","+/-6,667","333,011","346,345"
"C08105B",2.000,"Car, truck, or van - drove alone","269,234","+/-6,512","262,722","275,746"
"C08105B",3.000,"Car, truck, or van - carpooled","37,827","+/-3,347","34,480","41,174"
"C08105B",4.000,"Public transportation (excluding taxicab)","11,966