on workers including supervisors","4,992","+/-1,549","3,443","6,541"
"B24010",62.000,"Law enforcement workers including supervisors","20,066","+/-2,175","17,891","22,241"
"B24010",63.000,"Other protective service workers including supervisors","15,957","+/-1,768","14,189","17,725"
"B24010",64.000,"Food preparation and serving related occupations:","37,212","+/-3,537","33,675","40,749"
"B24010",65.000,"Cooks and food preparation workers","16,403","+/-2,308","14,095","18,711"
"B24010",66.000,"Waiters and wait