,"SEX BY EDUCATIONAL ATTAINMENT FOR THE POPULATION 25 YEARS AND OVER (WHITE ALONE, NOT HISPANIC OR LATINO)",,,,
"C15002H",.,"Universe:  White alone, not Hispanic or Latino population 25 years and over",,,,
"C15002H",1.000,"Total:","2,123,432","+/-5,731","2,117,701","2,129,163"
"C15002H",2.000,"Male:","1,021,012","+/-3,431","1,017,581","1,024,443"
"C15002H",3.000,"Less than high school diploma","103,325","+/-5,526","97,799","108,851"
"C15002H",4.000,"High school graduate (includes equivalency)","244,977","+/