ists' sundries, and chemical and allied products merchant wholesalers","1,596","+/-648","948","2,244"
"B24040",145.000,"Apparel, piece goods, and notions merchant wholesalers","259","+/-268","0","527"
"B24040",146.000,"Grocery and related product merchant wholesalers","1,842","+/-709","1,133","2,551"
"B24040",147.000,"Farm product raw material merchant wholesalers","356","+/-346","10","702"
"B24040",148.000,"Petroleum and petroleum products merchant wholesalers","285","+/-212","73","497"
"B24040",149.000,"A