"79,800","+/-5,867","73,933","85,667"
"B18011",17.000,"High school graduate (includes equivalency)","223,433","+/-10,081","213,352","233,514"
"B18011",18.000,"Some college or associate's degree","157,594","+/-7,611","149,983","165,205"
"B18011",19.000,"Bachelor's degree or higher","204,290","+/-7,504","196,786","211,794"
"B18012",.,"PHYSICAL DISABILITY BY SCHOOL ENROLLMENT AND EDUCATIONAL ATTAINMENT FOR THE CIVILIAN NONINSTITUTIONALIZED POPULATION 18 TO 34 YEARS",,,,
"B18012",.,"Universe:  Civilian noninsti