d extraction occupations","142,520","+/-6,812","135,708","149,332"
"B24060",31.000,"Installation, maintenance, and repair occupations","80,232","+/-4,580","75,652","84,812"
"B24060",32.000,"Production, transportation, and material moving occupations:","206,022","+/-6,923","199,099","212,945"
"B24060",33.000,"Production occupations","97,115","+/-5,545","91,570","102,660"
"B24060",34.000,"Transportation and material moving occupations:","108,907","+/-5,382","103,525","114,289"
"B24060",35.000,"Supervisors, tr