 (never married, widowed and divorced)","26,573","+/-2,012","24,561","28,585"
"B13002E",.,"WOMEN 15 TO 50 YEARS WHO HAD A BIRTH IN THE PAST 12 MONTHS BY MARITAL STATUS (NATIVE HAWAIIAN AND OTHER PACIFIC ISLANDER ALONE)",,,,
"B13002E",.,"Universe:  Native Hawaiian and Other Pacific Islander alone women 15 to 50 years",,,,
"B13002E",1.000,"Total:","N","N","N","N"
"B13002E",2.000,"Women who had a birth in the past 12 months:","N","N","N","N"
"B13002E",3.000,"Now married (including separated and spouse absent)"