,212","75,103","83,527"
"B24010H",37.000,"Farmers and farm managers","1,991","+/-634","1,357","2,625"
"B24010H",38.000,"Business and financial operations occupations","52,510","+/-3,318","49,192","55,828"
"B24010H",39.000,"Professional and related occupations:","235,182","+/-5,756","229,426","240,938"
"B24010H",40.000,"Computer and mathematical occupations","22,640","+/-2,084","20,556","24,724"
"B24010H",41.000,"Architecture and engineering occupations","6,286","+/-1,064","5,222","7,350"
"B24010H",42.000,"L