rs and farm managers","3,815","+/-1,074","2,741","4,889"
"B24010I",37.000,"Farmers and farm managers","0","+/-283","0","283"
"B24010I",38.000,"Business and financial operations occupations","3,070","+/-793","2,277","3,863"
"B24010I",39.000,"Professional and related occupations:","9,305","+/-1,685","7,620","10,990"
"B24010I",40.000,"Computer and mathematical occupations","1,216","+/-541","675","1,757"
"B24010I",41.000,"Architecture and engineering occupations","245","+/-170","75","415"
"B24010I",42.000,"Life