42","115,700"
"C15002A",9.000,"High school graduate (includes equivalency)","296,368","+/-7,711","288,657","304,079"
"C15002A",10.000,"Some college or associate's degree","313,285","+/-7,087","306,198","320,372"
"C15002A",11.000,"Bachelor's degree or higher","431,372","+/-7,061","424,311","438,433"
"C15002B",.,"SEX BY EDUCATIONAL ATTAINMENT FOR THE POPULATION 25 YEARS AND OVER (BLACK OR AFRICAN AMERICAN ALONE)",,,,
"C15002B",.,"Universe:  Black or African American alone population 25 years and over",,,,
"C1