
"C24060",146.000,"Construction and extraction occupations","7,292","+/-1,280","6,012","8,572"
"C24060",147.000,"Installation, maintenance, and repair occupations","8,245","+/-1,299","6,946","9,544"
"C24060",148.000,"Production, transportation, and material moving occupations:","18,549","+/-2,173","16,376","20,722"
"C24060",149.000,"Production occupations","5,302","+/-1,007","4,295","6,309"
"C24060",150.000,"Transportation and material moving occupations","13,247","+/-1,833","11,414","15,080"
"C24060",151.0