.000,"Management, professional, and related occupations:","401,184","+/-7,099","394,085","408,283"
"B24010A",4.000,"Management, business, and financial occupations:","200,022","+/-5,517","194,505","205,539"
"B24010A",5.000,"Management occupations except farmers and farm managers","144,341","+/-4,581","139,760","148,922"
"B24010A",6.000,"Farmers and farm managers","5,706","+/-1,232","4,474","6,938"
"B24010A",7.000,"Business and financial operations occupations","49,975","+/-3,289","46,686","53,264"
"B24010A"