0,"Information","2,142","+/-670","1,472","2,812"
"B24070",94.000,"Finance and insurance, and real estate and rental and leasing:","8,609","+/-1,781","6,828","10,390"
"B24070",95.000,"Finance and insurance","7,593","+/-1,725","5,868","9,318"
"B24070",96.000,"Real estate and rental and leasing","1,016","+/-526","490","1,542"
"B24070",97.000,"Professional, scientific, and management, and administrative and waste management services:","10,361","+/-1,645","8,716","12,006"
"B24070",98.000,"Professional, scientifi