-6,491","238,486","251,468"
"C15002H",5.000,"Some college or associate's degree","245,017","+/-7,334","237,683","252,351"
"C15002H",6.000,"Bachelor's degree or higher","427,693","+/-7,144","420,549","434,837"
"C15002H",7.000,"Female:","1,102,420","+/-3,729","1,098,691","1,106,149"
"C15002H",8.000,"Less than high school diploma","98,914","+/-4,688","94,226","103,602"
"C15002H",9.000,"High school graduate (includes equivalency)","283,235","+/-7,120","276,115","290,355"
"C15002H",10.000,"Some college or associ