the past 12 months","6,658","+/-1,022","5,636","7,680"
"B17016",16.000,"Other family:","37,572","+/-3,454","34,118","41,026"
"B17016",17.000,"Male householder, no wife present:","4,594","+/-1,333","3,261","5,927"
"B17016",18.000,"Householder worked full-time, year-round in the past 12 months","1,203","+/-784","419","1,987"
"B17016",19.000,"Householder worked part-time or part-year in the past 12 months","1,788","+/-889","899","2,677"
"B17016",20.000,"Householder did not work in the past 12 months","1,603","