,"+/-1,717","5,677","9,111"
"C17010B",16.000,"Female householder, no husband present","48,153","+/-3,077","45,076","51,230"
"C17010B",17.000,"With related children under 18 years","34,487","+/-2,927","31,560","37,414"
"C17010C",.,"POVERTY STATUS IN THE PAST 12 MONTHS OF FAMILIES BY FAMILY TYPE BY PRESENCE OF RELATED CHILDREN UNDER 18 YEARS (AMERICAN INDIAN AND ALASKA NATIVE ALONE)",,,,
"C17010C",.,"Universe:  Families with a householder who is American Indian and Alaska Native alone",,,,
"C17010C",1.000,"To