.000,"No related children under 18 years","758","+/-427","331","1,185"
"B17010G",.,"POVERTY STATUS IN THE PAST 12 MONTHS OF FAMILIES BY FAMILY TYPE BY PRESENCE OF RELATED CHILDREN UNDER 18 YEARS BY AGE OF RELATED CHILDREN (TWO OR MORE RACES HOUSEHOLDER)",,,,
"B17010G",.,"Universe:  Families with a householder who is Two or more races",,,,
"B17010G",1.000,"Total:","N","N","N","N"
"B17010G",2.000,"Income in the past 12 months below poverty level:","N","N","N","N"
"B17010G",3.000,"Married-couple family:","N","