"43,454"
"C24060",50.000,"Personal care and service occupations","39,695","+/-3,513","36,182","43,208"
"C24060",51.000,"Sales and office occupations:","408,244","+/-9,972","398,272","418,216"
"C24060",52.000,"Sales and related occupations","203,528","+/-7,599","195,929","211,127"
"C24060",53.000,"Office and administrative support occupations","204,716","+/-7,326","197,390","212,042"
"C24060",54.000,"Farming, fishing, and forestry occupations","6,809","+/-1,462","5,347","8,271"
"C24060",55.000,"Construction 