d engineering occupations","57,228","+/-4,021","53,207","61,249"
"C24060",9.000,"Life, physical, and social science occupations","22,428","+/-2,136","20,292","24,564"
"C24060",10.000,"Community and social services occupations","33,284","+/-2,732","30,552","36,016"
"C24060",11.000,"Legal occupations","38,289","+/-3,500","34,789","41,789"
"C24060",12.000,"Education, training, and library occupations","141,791","+/-5,041","136,750","146,832"
"C24060",13.000,"Arts, design, entertainment, sports, and media occup