2,414","+/-738","1,676","3,152"
"B24050",180.000,"Management of companies and enterprises","0","+/-283","0","283"
"B24050",181.000,"Administrative and support and waste management services","8,884","+/-1,736","7,148","10,620"
"B24050",182.000,"Educational services, and health care and social assistance:","8,736","+/-1,190","7,546","9,926"
"B24050",183.000,"Educational services","6,213","+/-1,103","5,110","7,316"
"B24050",184.000,"Health care and social assistance","2,523","+/-716","1,807","3,239"
"B24050",1