"+/-5,030","98,674","108,734"
"C24060",93.000,"Management, business, and financial occupations:","33,626","+/-2,557","31,069","36,183"
"C24060",94.000,"Management occupations","24,666","+/-1,914","22,752","26,580"
"C24060",95.000,"Business and financial operations occupations","8,960","+/-1,592","7,368","10,552"
"C24060",96.000,"Professional and related occupations:","70,078","+/-4,327","65,751","74,405"
"C24060",97.000,"Computer and mathematical occupations","6,257","+/-1,225","5,032","7,482"
"C24060",98.0