10B",4.000,"With related children under 18 years","2,399","+/-781","1,618","3,180"
"C17010B",5.000,"Other family:","13,651","+/-2,051","11,600","15,702"
"C17010B",6.000,"Male householder, no wife present","1,427","+/-732","695","2,159"
"C17010B",7.000,"With related children under 18 years","1,106","+/-689","417","1,795"
"C17010B",8.000,"Female householder, no husband present","12,224","+/-1,912","10,312","14,136"
"C17010B",9.000,"With related children under 18 years","10,377","+/-1,772","8,605","12,149"
"C1