ervices occupations","41,582","+/-2,251","39,331","43,833"
"B24022",48.000,"Legal occupations","61,736","+/-6,639","55,097","68,375"
"B24022",49.000,"Education, training, and library occupations","41,095","+/-878","40,217","41,973"
"B24022",50.000,"Arts, design, entertainment, sports, and media occupations","46,257","+/-2,823","43,434","49,080"
"B24022",51.000,"Healthcare practitioner and technical occupations:","50,912","+/-1,444","49,468","52,356"
"B24022",52.000,"Health diagnosing and treating practition