"B24060",104.000,"Sales and related occupations","16,294","+/-2,115","14,179","18,409"
"B24060",105.000,"Office and administrative support occupations","4,643","+/-922","3,721","5,565"
"B24060",106.000,"Farming, fishing, and forestry occupations","79","+/-100","0","179"
"B24060",107.000,"Construction, extraction, maintenance, and repair occupations:","10,581","+/-1,568","9,013","12,149"
"B24060",108.000,"Construction and extraction occupations","8,471","+/-1,405","7,066","9,876"
"B24060",109.000,"Installati