,576","39,112","42,264"
"B24012",32.000,"Production, transportation, and material moving occupations:","32,991","+/-1,276","31,715","34,267"
"B24012",33.000,"Production occupations","37,370","+/-1,843","35,527","39,213"
"B24012",34.000,"Transportation and material moving occupations:","30,482","+/-1,101","29,381","31,583"
"B24012",35.000,"Supervisors, transportation and material moving workers, and other transportation workers except motor vehicle operators","49,655","+/-5,435","44,220","55,090"
"B24012",36