pearance workers","2,232","+/-746","1,486","2,978"
"B24010",72.000,"Transportation, tourism, and lodging attendants","1,493","+/-691","802","2,184"
"B24010",73.000,"Child care workers","1,402","+/-760","642","2,162"
"B24010",74.000,"Supervisors and other personal care and service workers except personal appearance, transportation, and child care workers","7,302","+/-1,298","6,004","8,600"
"B24010",75.000,"Sales and office occupations:","198,089","+/-6,324","191,765","204,413"
"B24010",76.000,"Sales and rela