ssional, and related occupations","976,017","+/-12,423","963,594","988,440"
"B08124",3.000,"Service occupations","312,311","+/-8,123","304,188","320,434"
"B08124",4.000,"Sales and office occupations","539,198","+/-10,290","528,908","549,488"
"B08124",5.000,"Farming, fishing, and forestry occupations","8,508","+/-1,641","6,867","10,149"
"B08124",6.000,"Construction and extraction, and maintenance occupations","218,362","+/-7,365","210,997","225,727"
"B08124",7.000,"Production, transportation, and material mo