d social assistance:","115,756","+/-5,031","110,725","120,787"
"B24040",201.000,"Health care","92,690","+/-4,790","87,900","97,480"
"B24040",202.000,"Social assistance","23,066","+/-2,499","20,567","25,565"
"B24040",203.000,"Arts, entertainment, and recreation, and accommodation and food services:","34,737","+/-3,484","31,253","38,221"
"B24040",204.000,"Arts, entertainment, and recreation","6,165","+/-1,266","4,899","7,431"
"B24040",205.000,"Accommodation and food services","28,572","+/-3,169","25,403","31,