 occupations:","1,655","+/-640","1,015","2,295"
"B24060",137.000,"Fire fighting and prevention, and other protective service workers including supervisors","1,595","+/-610","985","2,205"
"B24060",138.000,"Law enforcement workers including supervisors","60","+/-99","0","159"
"B24060",139.000,"Food preparation and serving related occupations","2,328","+/-890","1,438","3,218"
"B24060",140.000,"Building and grounds cleaning and maintenance occupations","3,398","+/-1,154","2,244","4,552"
"B24060",141.000,"Person