 MOBILITY IN THE PAST YEAR BY RACE (WHITE ALONE) FOR CURRENT RESIDENCE IN THE UNITED STATES",,,,
"B07004A",.,"Universe:  White alone population 1 year and over in the United States",,,,
"B07004A",1.000,"Total:","3,227,718","+/-13,487","3,214,231","3,241,205"
"B07004A",2.000,"Same house 1 year ago","2,796,754","+/-16,677","2,780,077","2,813,431"
"B07004A",3.000,"Moved within same county","164,731","+/-10,339","154,392","175,070"
"B07004A",4.000,"Moved from different county within same state","147,827","+/-7,