e","2,099","+/-808","1,291","2,907"
"C14005",17.000,"Not high school graduate:","3,994","+/-1,107","2,887","5,101"
"C14005",18.000,"In the labor force (employed or unemployed)","1,268","+/-476","792","1,744"
"C14005",19.000,"Not in the labor force","2,726","+/-915","1,811","3,641"
"C14006",.,"POVERTY STATUS IN THE PAST 12 MONTHS BY SCHOOL ENROLLMENT BY LEVEL OF SCHOOL FOR THE POPULATION 3 YEARS AND OVER",,,,
"C14006",.,"Universe:  Population 3 years and over for whom poverty status is determined",,,,
"C1400