"12,790"
"B25012",17.000,"No related children under 18","258,200","+/-7,562","250,638","265,762"
"B25013",.,"TENURE BY EDUCATIONAL ATTAINMENT OF HOUSEHOLDER",,,,
"B25013",.,"Universe:  Occupied housing units",,,,
"B25013",1.000,"Total:","1,661,033","+/-7,953","1,653,080","1,668,986"
"B25013",2.000,"Owner-occupied housing units:","1,250,426","+/-10,485","1,239,941","1,260,911"
"B25013",3.000,"Less than high school graduate","114,902","+/-5,334","109,568","120,236"
"B25013",4.000,"High school graduate (includ