,5.000,"Ancestry not specified","478,283","+/-16,687","461,596","494,970"
"C05001",.,"CITIZENSHIP STATUS IN THE UNITED STATES",,,,
"C05001",.,"Universe:  Total population in the United States",,,,
"C05001",1.000,"Total:","4,497,744","+/-8,037","4,489,707","4,505,781"
"C05001",2.000,"U.S. citizen, born in the United States","3,859,880","+/-14,334","3,845,546","3,874,214"
"C05001",3.000,"U.S. citizen, born in Puerto Rico, U.S. Island Areas, or born abroad of American parent(s)","77,493","+/-6,130","71,363","8