,443","6,299","9,185"
"B24070",70.000,"Professional, scientific, and management, and administrative and waste management services:","20,806","+/-2,607","18,199","23,413"
"B24070",71.000,"Professional, scientific, and technical services","15,414","+/-2,102","13,312","17,516"
"B24070",72.000,"Management of companies and enterprises","91","+/-116","0","207"
"B24070",73.000,"Administrative and support and waste management services","5,301","+/-1,260","4,041","6,561"
"B24070",74.000,"Educational services, and he