,663","4,785"
"B24070",19.000,"Administrative and support and waste management services","85,128","+/-4,904","80,224","90,032"
"B24070",20.000,"Educational services, and health care and social assistance:","431,000","+/-9,327","421,673","440,327"
"B24070",21.000,"Educational services","201,586","+/-7,600","193,986","209,186"
"B24070",22.000,"Health care and social assistance","229,414","+/-6,802","222,612","236,216"
"B24070",23.000,"Arts, entertainment, and recreation, and accommodation and food services:",