0,"With related children under 18 years","1,233","+/-605","628","1,838"
"C17010F",10.000,"Income in the past 12 months at or above poverty level:","24,524","+/-2,292","22,232","26,816"
"C17010F",11.000,"Married-couple family:","16,550","+/-1,892","14,658","18,442"
"C17010F",12.000,"With related children under 18 years","13,244","+/-1,714","11,530","14,958"
"C17010F",13.000,"Other family:","7,974","+/-1,596","6,378","9,570"
"C17010F",14.000,"Male householder, no wife present","3,733","+/-1,161","2,572","4,89