00,"Professional and related occupations:","80,231","+/-1,978","78,253","82,209"
"B24022",7.000,"Computer and mathematical occupations","84,672","+/-2,214","82,458","86,886"
"B24022",8.000,"Architecture and engineering occupations","80,932","+/-4,250","76,682","85,182"
"B24022",9.000,"Life, physical, and social science occupations","91,635","+/-9,077","82,558","100,712"
"B24022",10.000,"Community and social services occupations","41,734","+/-4,836","36,898","46,570"
"B24022",11.000,"Legal occupations","100,