arpooled","37,827","+/-3,347","34,480","41,174"
"B08105B",4.000,"Public transportation (excluding taxicab)","11,966","+/-1,964","10,002","13,930"
"B08105B",5.000,"Walked","6,444","+/-1,674","4,770","8,118"
"B08105B",6.000,"Taxicab, motorcycle, bicycle, or other means","4,790","+/-1,366","3,424","6,156"
"B08105B",7.000,"Worked at home","9,417","+/-1,777","7,640","11,194"
"B08105C",.,"MEANS OF TRANSPORTATION TO WORK (AMERICAN INDIAN AND ALASKA NATIVE ALONE)",,,,
"B08105C",.,"Universe:  American Indian and Ala