-5,672","70,686","82,030"
"B18013",17.000,"High school graduate (includes equivalency)","216,304","+/-10,061","206,243","226,365"
"B18013",18.000,"Some college or associate's degree","154,513","+/-7,559","146,954","162,072"
"B18013",19.000,"Bachelor's degree or higher","203,980","+/-7,477","196,503","211,457"
"B18014",.,"SELF-CARE DISABILITY BY SCHOOL ENROLLMENT AND EDUCATIONAL ATTAINMENT FOR THE CIVILIAN NONINSTITUTIONALIZED POPULATION 18 TO 34 YEARS",,,,
"B18014",.,"Universe:  Civilian noninstitutionalize