ertainment, and recreation","17,896","+/-2,029","15,867","19,925"
"B24030",100.000,"Accommodation and food services","55,780","+/-4,538","51,242","60,318"
"B24030",101.000,"Other services, except public administration:","51,658","+/-3,687","47,971","55,345"
"B24030",102.000,"Repair and maintenance","25,971","+/-3,097","22,874","29,068"
"B24030",103.000,"Personal and laundry services","7,398","+/-1,264","6,134","8,662"
"B24030",104.000,"Religious, grantmaking, civic, professional, and similar organizations",