ental and leasing","0","+/-283","0","283"
"C24050",66.000,"Professional, scientific, and management, and administrative and waste management services","47","+/-78","0","125"
"C24050",67.000,"Educational services, and health care and social assistance","153","+/-185","0","338"
"C24050",68.000,"Arts, entertainment, and recreation, and accommodation and food services","187","+/-297","0","484"
"C24050",69.000,"Other services, except public administration","0","+/-283","0","283"
"C24050",70.000,"Public administr