00,"$100,000 or more","9,492","+/-1,458","8,034","10,950"
"B20005A",.,"SEX BY WORK EXPERIENCE IN THE PAST 12 MONTHS BY EARNINGS IN THE PAST 12 MONTHS (IN 2007 INFLATION-ADJUSTED DOLLARS) FOR THE POPULATION 16 YEARS AND OVER (WHITE ALONE)",,,,
"B20005A",.,"Universe:  White alone population 16 years and over",,,,
"B20005A",1.000,"Total:","2,599,814","+/-9,223","2,590,591","2,609,037"
"B20005A",2.000,"Male:","1,266,262","+/-5,457","1,260,805","1,271,719"
"B20005A",3.000,"Worked full-time, year-round in the pas