"40,551","43,323"
"B24042",42.000,"Real estate and rental and leasing","42,284","+/-5,772","36,512","48,056"
"B24042",43.000,"Professional, scientific, and management, and administrative and waste management services:","54,492","+/-2,791","51,701","57,283"
"B24042",44.000,"Professional, scientific, and technical services","60,601","+/-1,827","58,774","62,428"
"B24042",45.000,"Management of companies and enterprises","53,333","+/-21,347","31,986","74,680"
"B24042",46.000,"Administrative and support and waste