 school","63,342","+/-4,379","58,963","67,721"
"B14001",10.000,"Not enrolled in school","3,122,647","+/-13,200","3,109,447","3,135,847"
"B14001A",.,"SCHOOL ENROLLMENT BY LEVEL OF SCHOOL FOR THE POPULATION 3 YEARS AND OVER (WHITE ALONE)",,,,
"B14001A",.,"Universe:  White alone population 3 years and over",,,,
"B14001A",1.000,"Total:","3,148,267","+/-12,604","3,135,663","3,160,871"
"B14001A",2.000,"Enrolled in school:","827,460","+/-8,339","819,121","835,799"
"B14001A",3.000,"Enrolled in nursery school, kinde