406","522,706"
"B08137",4.000,"Car, truck, or van - drove alone:","1,786,037","+/-15,808","1,770,229","1,801,845"
"B08137",5.000,"Householder lived in owner-occupied housing units","1,406,448","+/-16,577","1,389,871","1,423,025"
"B08137",6.000,"Householder lived in renter-occupied housing units","379,589","+/-13,710","365,879","393,299"
"B08137",7.000,"Car, truck, or van - carpooled:","250,622","+/-9,522","241,100","260,144"
"B08137",8.000,"Householder lived in owner-occupied housing units","176,484","+/-8,