0",46.000,"Computer and mathematical occupations","83,967","+/-4,255","79,712","88,222"
"B24060",47.000,"Architecture and engineering occupations","39,294","+/-3,573","35,721","42,867"
"B24060",48.000,"Life, physical, and social science occupations","9,559","+/-1,305","8,254","10,864"
"B24060",49.000,"Community and social services occupations","4,142","+/-1,045","3,097","5,187"
"B24060",50.000,"Legal occupations","17,489","+/-2,317","15,172","19,806"
"B24060",51.000,"Education, training, and library occupat