","10,939"
"C24060",156.000,"Professional and related occupations:","21,003","+/-2,475","18,528","23,478"
"C24060",157.000,"Computer and mathematical occupations","1,922","+/-576","1,346","2,498"
"C24060",158.000,"Architecture and engineering occupations","1,564","+/-405","1,159","1,969"
"C24060",159.000,"Life, physical, and social science occupations","896","+/-419","477","1,315"
"C24060",160.000,"Community and social services occupations","360","+/-255","105","615"
"C24060",161.000,"Legal occupations","3,