","+/-2,902","37,746","43,550"
"B18012",14.000,"College or graduate school","226,134","+/-7,799","218,335","233,933"
"B18012",15.000,"Not enrolled in school:","656,448","+/-9,634","646,814","666,082"
"B18012",16.000,"Less than high school graduate","78,544","+/-5,845","72,699","84,389"
"B18012",17.000,"High school graduate (includes equivalency)","218,840","+/-9,962","208,878","228,802"
"B18012",18.000,"Some college or associate's degree","155,391","+/-7,590","147,801","162,981"
"B18012",19.000,"Bachelor's 