lated occupations:","240,509","+/-6,010","234,499","246,519"
"B24010A",40.000,"Computer and mathematical occupations","23,531","+/-2,109","21,422","25,640"
"B24010A",41.000,"Architecture and engineering occupations","6,453","+/-1,095","5,358","7,548"
"B24010A",42.000,"Life, physical, and social science occupations","5,951","+/-1,117","4,834","7,068"
"B24010A",43.000,"Community and social services occupations","15,151","+/-1,828","13,323","16,979"
"B24010A",44.000,"Legal occupations","14,372","+/-2,109","12,