ure and engineering occupations","723","+/-509","214","1,232"
"B24010F",11.000,"Life, physical, and social science occupations","0","+/-283","0","283"
"B24010F",12.000,"Community and social services occupations","794","+/-543","251","1,337"
"B24010F",13.000,"Legal occupations","419","+/-397","22","816"
"B24010F",14.000,"Education, training, and library occupations","288","+/-356","0","644"
"B24010F",15.000,"Arts, design, entertainment, sports, and media occupations","186","+/-244","0","430"
"B24010F",16.000