same state:","205,098","+/-11,494","193,604","216,592"
"B07013",11.000,"Householder lived in owner-occupied housing units","90,952","+/-7,563","83,389","98,515"
"B07013",12.000,"Householder lived in renter-occupied housing units","114,146","+/-9,211","104,935","123,357"
"B07013",13.000,"Moved from different state:","128,762","+/-10,210","118,552","138,972"
"B07013",14.000,"Householder lived in owner-occupied housing units","57,389","+/-6,270","51,119","63,659"
"B07013",15.000,"Householder lived in renter-oc