r van - carpooled","4,248","+/-1,171","3,077","5,419"
"C08105G",4.000,"Public transportation (excluding taxicab)","872","+/-464","408","1,336"
"C08105G",5.000,"Taxicab, motorcycle, bicycle, walked, or other means","1,054","+/-678","376","1,732"
"C08105G",6.000,"Worked at home","1,599","+/-792","807","2,391"
"C08105H",.,"MEANS OF TRANSPORTATION TO WORK (WHITE ALONE, NOT HISPANIC OR LATINO)",,,,
"C08105H",.,"Universe:  White alone, not Hispanic or Latino workers 16 years and over",,,,
"C08105H",1.000,"Total:"