"Total:","27,190","+/-3,406","23,784","30,596"
"C24010G",2.000,"Male:","14,444","+/-2,405","12,039","16,849"
"C24010G",3.000,"Management, professional, and related occupations","6,810","+/-1,479","5,331","8,289"
"C24010G",4.000,"Service occupations","1,839","+/-746","1,093","2,585"
"C24010G",5.000,"Sales and office occupations","2,893","+/-1,100","1,793","3,993"
"C24010G",6.000,"Farming, fishing, and forestry occupations","0","+/-283","0","283"
"C24010G",7.000,"Construction, extraction, maintenance, and rep