.000,"Under 5 years and 5 to 17 years","N","N","N","N"
"B17010E",40.000,"5 to 17 years only","N","N","N","N"
"B17010E",41.000,"No related children under 18 years","N","N","N","N"
"B17010F",.,"POVERTY STATUS IN THE PAST 12 MONTHS OF FAMILIES BY FAMILY TYPE BY PRESENCE OF RELATED CHILDREN UNDER 18 YEARS BY AGE OF RELATED CHILDREN (SOME OTHER RACE ALONE HOUSEHOLDER)",,,,
"B17010F",.,"Universe:  Families with a householder who is Some other race alone",,,,
"B17010F",1.000,"Total:","26,954","+/-2,273","24,681","