ing equivalency)","268,887","+/-7,054","261,833","275,941"
"B25013",5.000,"Some college or associate's degree","317,809","+/-9,064","308,745","326,873"
"B25013",6.000,"Bachelor's degree or higher","548,828","+/-8,720","540,108","557,548"
"B25013",7.000,"Renter-occupied housing units:","410,607","+/-8,998","401,609","419,605"
"B25013",8.000,"Less than high school graduate","65,987","+/-4,768","61,219","70,755"
"B25013",9.000,"High school graduate (including equivalency)","120,315","+/-5,789","114,526","126,1