27","48,566","54,420"
"B14001B",6.000,"Enrolled in college or graduate school","54,556","+/-3,895","50,661","58,451"
"B14001B",7.000,"Not enrolled in school","465,799","+/-7,189","458,610","472,988"
"B14001C",.,"SCHOOL ENROLLMENT BY LEVEL OF SCHOOL FOR THE POPULATION 3 YEARS AND OVER (AMERICAN INDIAN AND ALASKA NATIVE ALONE)",,,,
"B14001C",.,"Universe:  American Indian and Alaska Native alone population 3 years and over",,,,
"B14001C",1.000,"Total:","12,731","+/-2,549","10,182","15,280"
"B14001C",2.000,"Enr