try occupations","246","+/-314","0","560"
"C24060",115.000,"Construction extraction, maintenance, and repair occupations:","3,423","+/-860","2,563","4,283"
"C24060",116.000,"Construction and extraction occupations","2,160","+/-763","1,397","2,923"
"C24060",117.000,"Installation, maintenance, and repair occupations","1,263","+/-362","901","1,625"
"C24060",118.000,"Production, transportation, and material moving occupations:","3,652","+/-910","2,742","4,562"
"C24060",119.000,"Production occupations","1,937","