04","+/-834","34,670","36,338"
"B24021",31.000,"Installation, maintenance, and repair occupations","43,609","+/-2,703","40,906","46,312"
"B24021",32.000,"Production, transportation, and material moving occupations:","35,071","+/-870","34,201","35,941"
"B24021",33.000,"Production occupations","36,816","+/-1,322","35,494","38,138"
"B24021",34.000,"Transportation and material moving occupations:","33,069","+/-1,583","31,486","34,652"
"B24021",35.000,"Supervisors, transportation and material moving workers, and