nufacturing","4,496","+/-1,144","3,352","5,640"
"B24030",132.000,"Wholesale trade:","16,662","+/-1,945","14,717","18,607"
"B24030",133.000,"Motor vehicle, parts and supplies merchant wholesalers","208","+/-174","34","382"
"B24030",134.000,"Furniture and home furnishing merchant wholesalers","479","+/-338","141","817"
"B24030",135.000,"Lumber and other construction materials merchant wholesalers","736","+/-533","203","1,269"
"B24030",136.000,"Professional and commercial equipment and supplies merchant wholes