"B25086",.,"Universe:  Vacant-for-sale-only and sold, not occupied housing units",,,,
"B25086",1.000,"Aggregate price asked (dollars)","13,112,512,500","+/-1,681,115,869","11,431,396,631","14,793,628,369"
"B25087",.,"MORTGAGE STATUS AND SELECTED MONTHLY OWNER COSTS",,,,
"B25087",.,"Universe:  Owner-occupied housing units",,,,
"B25087",1.000,"Total:","1,250,426","+/-10,485","1,239,941","1,260,911"
"B25087",2.000,"Housing units with a mortgage:","963,688","+/-10,499","953,189","974,187"
"B25087",3.000,"Less t