002D",6.000,"Bachelor's degree or higher","54,023","+/-2,724","51,299","56,747"
"C15002D",7.000,"Female:","103,379","+/-1,574","101,805","104,953"
"C15002D",8.000,"Less than high school diploma","13,997","+/-1,858","12,139","15,855"
"C15002D",9.000,"High school graduate (includes equivalency)","18,446","+/-2,040","16,406","20,486"
"C15002D",10.000,"Some college or associate's degree","17,723","+/-1,624","16,099","19,347"
"C15002D",11.000,"Bachelor's degree or higher","53,213","+/-2,551","50,662","55,764"
"C