","12,661","+/-1,802","10,859","14,463"
"C24010",12.000,"Legal occupations","19,748","+/-2,199","17,549","21,947"
"C24010",13.000,"Education, training, and library occupations","32,296","+/-2,665","29,631","34,961"
"C24010",14.000,"Arts, design, entertainment, sports, and media occupations","18,726","+/-2,199","16,527","20,925"
"C24010",15.000,"Healthcare practitioner and technical occupations:","25,972","+/-2,541","23,431","28,513"
"C24010",16.000,"Health diagnosing and treating practitioners and other tec