479","15,866","20,824"
"B24020",191.000,"Cooks and food preparation workers","6,284","+/-1,357","4,927","7,641"
"B24020",192.000,"Waiters and waitresses","6,245","+/-1,484","4,761","7,729"
"B24020",193.000,"Food and beverage serving workers except waiters/waitresses","1,971","+/-610","1,361","2,581"
"B24020",194.000,"Other food preparation and serving workers including supervisors","3,845","+/-1,135","2,710","4,980"
"B24020",195.000,"Building and grounds cleaning and maintenance occupations","14,994","+/-2,