324","191,765","204,413"
"C24010",27.000,"Sales and related occupations","123,654","+/-5,353","118,301","129,007"
"C24010",28.000,"Office and administrative support occupations","74,435","+/-4,510","69,925","78,945"
"C24010",29.000,"Farming, fishing, and forestry occupations","7,141","+/-1,522","5,619","8,663"
"C24010",30.000,"Construction, extraction, maintenance, and repair occupations:","215,471","+/-7,662","207,809","223,133"
"C24010",31.000,"Construction and extraction occupations","138,924","+/-6,707"