"B24082",11.000,"Female:","31,595","+/-352","31,243","31,947"
"B24082",12.000,"Private for-profit wage and salary workers:","28,220","+/-672","27,548","28,892"
"B24082",13.000,"Employee of private company workers","27,852","+/-690","27,162","28,542"
"B24082",14.000,"Self-employed in own incorporated business workers","37,152","+/-4,796","32,356","41,948"
"B24082",15.000,"Private not-for-profit wage and salary workers","35,547","+/-1,257","34,290","36,804"
"B24082",16.000,"Local government workers","36,794",