r 18 years","28,195","+/-2,947","25,248","31,142"
"C17010",10.000,"Income in the past 12 months at or above poverty level:","1,128,776","+/-10,540","1,118,236","1,139,316"
"C17010",11.000,"Married-couple family:","913,749","+/-10,930","902,819","924,679"
"C17010",12.000,"With related children under 18 years","433,775","+/-8,293","425,482","442,068"
"C17010",13.000,"Other family:","215,027","+/-6,161","208,866","221,188"
"C17010",14.000,"Male householder, no wife present","62,610","+/-4,281","58,329","66,891