:","74,937","+/-5,029","69,908","79,966"
"B24050",75.000,"Educational services","16,908","+/-2,386","14,522","19,294"
"B24050",76.000,"Health care and social assistance","58,029","+/-4,634","53,395","62,663"
"B24050",77.000,"Arts, entertainment, and recreation, and accommodation and food services:","97,123","+/-5,609","91,514","102,732"
"B24050",78.000,"Arts, entertainment, and recreation","16,510","+/-1,803","14,707","18,313"
"B24050",79.000,"Accommodation and food services","80,613","+/-5,218","75,395","8