e alone","165,030","+/-5,779","159,251","170,809"
"B08105H",3.000,"Car, truck, or van - carpooled","21,424","+/-2,310","19,114","23,734"
"B08105H",4.000,"Public transportation (excluding taxicab)","878","+/-538","340","1,416"
"B08105H",5.000,"Walked","5,256","+/-1,285","3,971","6,541"
"B08105H",6.000,"Taxicab, motorcycle, bicycle, or other means","1,954","+/-610","1,344","2,564"
"B08105H",7.000,"Worked at home","5,784","+/-1,362","4,422","7,146"
"B08105I",.,"MEANS OF TRANSPORTATION TO WORK (HISPANIC OR LATI