"Life, physical, and social science occupations","1,153","+/-674","479","1,827"
"B24060",49.000,"Community and social services occupations","877","+/-411","466","1,288"
"B24060",50.000,"Legal occupations","96","+/-111","0","207"
"B24060",51.000,"Education, training, and library occupations","868","+/-535","333","1,403"
"B24060",52.000,"Arts, design, entertainment, sports, and media occupations","966","+/-454","512","1,420"
"B24060",53.000,"Healthcare practitioner and technical occupations:","8,966","+/-1,53