st 12 months below poverty level:","67,547","+/-4,927","62,620","72,474"
"C17003",3.000,"Less than high school graduate","26,104","+/-2,738","23,366","28,842"
"C17003",4.000,"High school graduate (includes equivalency)","27,366","+/-3,401","23,965","30,767"
"C17003",5.000,"Some college, associate's degree","10,863","+/-1,887","8,976","12,750"
"C17003",6.000,"Bachelor's degree or higher","3,214","+/-1,082","2,132","4,296"
"C17003",7.000,"Income in the past 12 months at or above poverty level:","333,786","+/-