rs and over","303","+/-375","0","678"
"B10060",16.000,"Grandparent not responsible for own grandchildren under 18 years","937","+/-529","408","1,466"
"B10061",.,"TENURE OF GRANDPARENTS LIVING WITH OWN GRANDCHILDREN UNDER 18 YEARS BY RESPONSIBILITY FOR OWN GRANDCHILDREN AND AGE OF GRANDPARENT",,,,
"B10061",.,"Universe:  Grandparents living with own grandchildren under 18 years in households",,,,
"B10061",1.000,"Total:","14,074","+/-2,423","11,651","16,497"
"B10061",2.000,"Living in owner-occupied housing uni