,"265"
"B24030",39.000,"Drugs and druggists' sundries, and chemical and allied products merchant wholesalers","127","+/-154","0","281"
"B24030",40.000,"Apparel, piece goods, and notions merchant wholesalers","0","+/-265","0","265"
"B24030",41.000,"Grocery and related product merchant wholesalers","1,292","+/-602","690","1,894"
"B24030",42.000,"Farm product raw material merchant wholesalers","0","+/-265","0","265"
"B24030",43.000,"Petroleum and petroleum products merchant wholesalers","68","+/-116","0","184"