English less than ""very well""","36","+/-59","0","95"
"C16004",35.000,"Speak other Indo-European languages:","577","+/-455","122","1,032"
"C16004",36.000,"Speak English ""very well""","491","+/-439","52","930"
"C16004",37.000,"Speak English less than ""very well""","86","+/-125","0","211"
"C16004",38.000,"Speak Asian and Pacific Island languages:","96","+/-105","0","201"
"C16004",39.000,"Speak English ""very well""","96","+/-105","0","201"
"C16004",40.000,"Speak English less than ""very well""","0","+/-265