e stores","53","+/-91","0","144"
"B24030",56.000,"Gasoline stations","599","+/-340","259","939"
"B24030",57.000,"Clothing and clothing accessories, including shoe, stores","299","+/-275","24","574"
"B24030",58.000,"Jewelry, luggage, and leather goods stores","14","+/-24","0","38"
"B24030",59.000,"Sporting goods, camera, and hobby and toy stores","283","+/-275","8","558"
"B24030",60.000,"Sewing, needlework, and piece goods stores","73","+/-127","0","200"
"B24030",61.000,"Music stores","61","+/-102","0","163"