000,"No Social Security income","139,235","+/-3,688","135,547","142,923"
"B19056",.,"SUPPLEMENTAL SECURITY INCOME (SSI) IN THE PAST 12 MONTHS FOR HOUSEHOLDS",,,,
"B19056",.,"Universe:  Households",,,,
"B19056",1.000,"Total:","236,700","+/-3,436","233,264","240,136"
"B19056",2.000,"With Supplemental Security Income (SSI)","22,253","+/-2,159","20,094","24,412"
"B19056",3.000,"No Supplemental Security Income (SSI)","214,447","+/-3,796","210,651","218,243"
"B19057",.,"PUBLIC ASSISTANCE INCOME IN THE PAST 12 MON