.000,"Furniture and home furnishings, and household appliance stores","705","+/-548","157","1,253"
"B24030",51.000,"Radio, TV, and computer and software, and other electronic stores","122","+/-150","0","272"
"B24030",52.000,"Building material and garden equipment and supplies dealers","2,676","+/-817","1,859","3,493"
"B24030",53.000,"Food and beverage stores","2,523","+/-773","1,750","3,296"
"B24030",54.000,"Pharmacies and drug stores","393","+/-361","32","754"
"B24030",55.000,"Other health and personal car