repair occupations:","28,939","+/-2,648","26,291","31,587"
"B24010H",28.000,"Construction and extraction occupations","18,996","+/-2,120","16,876","21,116"
"B24010H",29.000,"Installation, maintenance, and repair occupations","9,943","+/-1,481","8,462","11,424"
"B24010H",30.000,"Production, transportation, and material moving occupations:","26,297","+/-2,607","23,690","28,904"
"B24010H",31.000,"Production occupations","10,606","+/-1,824","8,782","12,430"
"B24010H",32.000,"Transportation and material moving o