diting clerks","1,804","+/-668","1,136","2,472"
"B24010",210.000,"Bookkeeping, accounting, and auditing clerks","907","+/-413","494","1,320"
"B24010",211.000,"Information and record clerks except customer service representatives","3,459","+/-931","2,528","4,390"
"B24010",212.000,"Customer service representatives","1,475","+/-564","911","2,039"
"B24010",213.000,"Material recording, scheduling, dispatching, and distributing workers","1,965","+/-671","1,294","2,636"
"B24010",214.000,"Secretaries and administra