13002D",6.000,"Now married (including separated and spouse absent)","329","+/-162","167","491"
"B13002D",7.000,"Unmarried (never married, widowed and divorced)","436","+/-302","134","738"
"B13002E",.,"WOMEN 15 TO 50 YEARS WHO HAD A BIRTH IN THE PAST 12 MONTHS BY MARITAL STATUS (NATIVE HAWAIIAN AND OTHER PACIFIC ISLANDER ALONE)",,,,
"B13002E",.,"Universe:  Native Hawaiian and Other Pacific Islander alone women 15 to 50 years",,,,
"B13002E",1.000,"Total:","N","N","N","N"
"B13002E",2.000,"Women who had a birth