20.000,"High school graduate (includes equivalency)","36,269","+/-1,997","34,272","38,266"
"C15001",21.000,"Some college or associate's degree","14,624","+/-1,573","13,051","16,197"
"C15001",22.000,"Bachelor's degree or higher","10,992","+/-1,391","9,601","12,383"
"C15001",23.000,"65 years and over:","38,834","+/-463","38,371","39,297"
"C15001",24.000,"Less than high school graduate","17,029","+/-1,144","15,885","18,173"
"C15001",25.000,"High school graduate (includes equivalency)","12,404","+/-1,223","11,1