 occupations except farmers and farm managers","N","N","N","N"
"B24010F",37.000,"Farmers and farm managers","N","N","N","N"
"B24010F",38.000,"Business and financial operations occupations","N","N","N","N"
"B24010F",39.000,"Professional and related occupations:","N","N","N","N"
"B24010F",40.000,"Computer and mathematical occupations","N","N","N","N"
"B24010F",41.000,"Architecture and engineering occupations","N","N","N","N"
"B24010F",42.000,"Life, physical, and social science occupations","N","N","N","N"
"B2