 lived in owner-occupied housing units","300","+/-344","0","644"
"B08137",12.000,"Householder lived in renter-occupied housing units","1,417","+/-759","658","2,176"
"B08137",13.000,"Walked:","5,971","+/-1,426","4,545","7,397"
"B08137",14.000,"Householder lived in owner-occupied housing units","3,305","+/-1,038","2,267","4,343"
"B08137",15.000,"Householder lived in renter-occupied housing units","2,666","+/-1,008","1,658","3,674"
"B08137",16.000,"Taxicab, motorcycle, bicycle, or other means:","2,218","+/-647