 FAMILIES BY FAMILY TYPE BY PRESENCE OF RELATED CHILDREN UNDER 18 YEARS (BLACK OR AFRICAN AMERICAN ALONE HOUSEHOLDER)",,,,
"C17010B",.,"Universe:  Families with a householder who is Black or African American alone",,,,
"C17010B",1.000,"Total:","5,875","+/-878","4,997","6,753"
"C17010B",2.000,"Income in the past 12 months below poverty level:","2,170","+/-737","1,433","2,907"
"C17010B",3.000,"Married-couple family:","620","+/-370","250","990"
"C17010B",4.000,"With related children under 18 years","0","+/-265