"C08014",15.000,"3 or more vehicles available","30,496","+/-3,123","27,373","33,619"
"C08016",.,"PLACE OF WORK FOR WORKERS 16 YEARS AND OVER--METROPOLITAN STATISTICAL AREA LEVEL",,,,
"C08016",.,"Universe:  Workers 16 years and over living in a Metropolitan Statistical Area",,,,
"C08016",1.000,"Total:","70,404","+/-3,159","67,245","73,563"
"C08016",2.000,"Worked in Metropolitan Statistical Area of residence:","61,081","+/-3,116","57,965","64,197"
"C08016",3.000,"Worked in a principal city","27,479","+/-2,454