orkers","75","+/-135","0","210"
"C24030",.,"SEX BY INDUSTRY FOR THE CIVILIAN EMPLOYED POPULATION 16 YEARS AND OVER",,,,
"C24030",.,"Universe:  Civilian employed population 16 years and over",,,,
"C24030",1.000,"Total:","219,544","+/-6,337","213,207","225,881"
"C24030",2.000,"Male:","118,596","+/-3,705","114,891","122,301"
"C24030",3.000,"Agriculture, forestry, fishing and hunting, and mining:","17,450","+/-2,187","15,263","19,637"
"C24030",4.000,"Agriculture, forestry, fishing and hunting","2,120","+/-844",