C ISLANDER ALONE) IN THE UNITED STATES",,,,
"B06004E",.,"Universe:  Native Hawaiian and Other Pacific Islander alone population in the United States",,,,
"B06004E",1.000,"Total:","N","N","N","N"
"B06004E",2.000,"Born in state of residence","N","N","N","N"
"B06004E",3.000,"Born in other state in the United States","N","N","N","N"
"B06004E",4.000,"Native; born outside the United States","N","N","N","N"
"B06004E",5.000,"Foreign born","N","N","N","N"
"B06004F",.,"PLACE OF BIRTH BY RACE (SOME OTHER RACE ALONE) I