 in renter-occupied housing units","6,624","+/-1,554","5,070","8,178"
"C08137",10.000,"Public transportation (excluding taxicab):","1,717","+/-867","850","2,584"
"C08137",11.000,"Householder lived in owner-occupied housing units","300","+/-344","0","644"
"C08137",12.000,"Householder lived in renter-occupied housing units","1,417","+/-759","658","2,176"
"C08137",13.000,"Taxicab, motorcycle, bicycle, walked, or other means:","8,189","+/-1,602","6,587","9,791"
"C08137",14.000,"Householder lived in owner-occupi