"B17015",32.000,"Without SSI or cash public assistance income in the past 12 months","63,730","+/-3,236","60,494","66,966"
"B17015",33.000,"Other family:","23,902","+/-2,327","21,575","26,229"
"B17015",34.000,"Male householder, no wife present:","7,714","+/-1,298","6,416","9,012"
"B17015",35.000,"With Social Security income in the past 12 months:","3,119","+/-757","2,362","3,876"
"B17015",36.000,"With SSI and/or cash public assistance income in the past 12 months","365","+/-312","53","677"
"B17015",37.000,"