,10.000,"60 years and over","517","+/-256","261","773"
"B10057",11.000,"Grandparent not responsible for own grandchildren under 18 years","2,414","+/-885","1,529","3,299"
"B10058",.,"EMPLOYMENT STATUS OF GRANDPARENTS LIVING WITH OWN GRANDCHILDREN UNDER 18 YEARS BY RESPONSIBILITY FOR OWN GRANDCHILDREN AND AGE OF GRANDPARENT",,,,
"B10058",.,"Universe:  Grandparents living with own grandchildren under 18 years",,,,
"B10058",1.000,"Total:","14,074","+/-2,423","11,651","16,497"
"B10058",2.000,"In labor force:","