","366"
"B24010",237.000,"Metal workers and plastic workers","0","+/-265","0","265"
"B24010",238.000,"Printing workers","107","+/-149","0","256"
"B24010",239.000,"Textile, apparel, and furnishings workers","251","+/-234","17","485"
"B24010",240.000,"Woodworkers","269","+/-332","0","601"
"B24010",241.000,"Plant and system operators","0","+/-265","0","265"
"B24010",242.000,"Other production occupations including supervisors","986","+/-551","435","1,537"
"B24010",243.000,"Transportation and material moving occ