","+/-1,893","10,876","14,662"
"B25064",.,"MEDIAN GROSS RENT (DOLLARS)",,,,
"B25064",.,"Universe:  Renter-occupied housing units paying cash rent",,,,
"B25064",1.000,"Median gross rent","486","+/-17","469","503"
"B25065",.,"AGGREGATE GROSS RENT (DOLLARS)",,,,
"B25065",.,"Universe:  Renter-occupied housing units paying cash rent",,,,
"B25065",1.000,"Aggregate gross rent","22,972,400","+/-1,635,194","21,337,206","24,607,594"
"B25066",.,"AGGREGATE GROSS RENT (DOLLARS) BY UNITS IN STRUCTURE",,,,
"B25066",.,"Uni