"B24010F",23.000,"Sales and office occupations:","N","N","N","N"
"B24010F",24.000,"Sales and related occupations","N","N","N","N"
"B24010F",25.000,"Office and administrative support occupations","N","N","N","N"
"B24010F",26.000,"Farming, fishing, and forestry occupations","N","N","N","N"
"B24010F",27.000,"Construction, extraction, maintenance, and repair occupations:","N","N","N","N"
"B24010F",28.000,"Construction and extraction occupations","N","N","N","N"
"B24010F",29.000,"Installation, maintenance, and r