","+/-1,210","7,193","9,613"
"C25020",13.000,"7 rooms or more","5,955","+/-1,197","4,758","7,152"
"C25023",.,"AGGREGATE NUMBER OF ROOMS BY VACANCY STATUS",,,,
"C25023",.,"Universe:  Vacant housing units",,,,
"C25023",1.000,"Aggregate number of rooms:","275,446","+/-17,364","258,082","292,810"
"C25023",2.000,"For rent, for sale only, and rented or sold, not occupied","67,590","+/-10,506","57,084","78,096"
"C25023",3.000,"All other vacant units","207,856","+/-15,769","192,087","223,625"
"C25032",.,"TENURE BY 