0,"Customer service representatives","1,309","+/-515","794","1,824"
"B24020",213.000,"Material recording, scheduling, dispatching, and distributing workers","1,534","+/-572","962","2,106"
"B24020",214.000,"Secretaries and administrative assistants","4,006","+/-977","3,029","4,983"
"B24020",215.000,"Other office and administrative support workers including supervisors","3,566","+/-968","2,598","4,534"
"B24020",216.000,"Farming, fishing, and forestry occupations:","0","+/-265","0","265"
"B24020",217.000,"Agri