r product merchant wholesalers","0","+/-265","0","265"
"B24030",144.000,"Drugs and druggists' sundries, and chemical and allied products merchant wholesalers","64","+/-107","0","171"
"B24030",145.000,"Apparel, piece goods, and notions merchant wholesalers","0","+/-265","0","265"
"B24030",146.000,"Grocery and related product merchant wholesalers","326","+/-350","0","676"
"B24030",147.000,"Farm product raw material merchant wholesalers","0","+/-265","0","265"
"B24030",148.000,"Petroleum and petroleum products