 occupations","10,113","+/-2,137","7,976","12,250"
"B24011",23.000,"Building and grounds cleaning and maintenance occupations","13,508","+/-3,306","10,202","16,814"
"B24011",24.000,"Personal care and service occupations","9,629","+/-2,899","6,730","12,528"
"B24011",25.000,"Sales and office occupations:","20,276","+/-910","19,366","21,186"
"B24011",26.000,"Sales and related occupations","17,196","+/-1,788","15,408","18,984"
"B24011",27.000,"Office and administrative support occupations","21,655","+/-1,101","