/-3,705","114,891","122,301"
"C24010",3.000,"Management, professional, and related occupations:","24,404","+/-1,926","22,478","26,330"
"C24010",4.000,"Management, business, and financial occupations:","10,836","+/-1,294","9,542","12,130"
"C24010",5.000,"Management occupations","8,059","+/-1,257","6,802","9,316"
"C24010",6.000,"Business and financial operations occupations","2,777","+/-791","1,986","3,568"
"C24010",7.000,"Professional and related occupations:","13,568","+/-1,753","11,815","15,321"
"C24010",8