l, and related occupations:","N","N","N","N"
"B24010E",35.000,"Management, business, and financial occupations:","N","N","N","N"
"B24010E",36.000,"Management occupations except farmers and farm managers","N","N","N","N"
"B24010E",37.000,"Farmers and farm managers","N","N","N","N"
"B24010E",38.000,"Business and financial operations occupations","N","N","N","N"
"B24010E",39.000,"Professional and related occupations:","N","N","N","N"
"B24010E",40.000,"Computer and mathematical occupations","N","N","N","N"
"B24