e past 12 months","359","+/-304","55","663"
"B17016",19.000,"Householder worked part-time or part-year in the past 12 months","519","+/-415","104","934"
"B17016",20.000,"Householder did not work in the past 12 months","1,244","+/-560","684","1,804"
"B17016",21.000,"Female householder, no husband present:","11,271","+/-1,496","9,775","12,767"
"B17016",22.000,"Householder worked full-time, year-round in the past 12 months","511","+/-305","206","816"
"B17016",23.000,"Householder worked part-time or part-year i