 TO WORK",,,,
"C08136",.,"Universe: Workers 16 years and over who did not work at home",,,,
"C08136",1.000,"Aggregate travel time to work (in minutes):","5,136,415","+/-200,449","4,935,966","5,336,864"
"C08136",2.000,"Car, truck, or van - drove alone","4,211,670","+/-188,826","4,022,844","4,400,496"
"C08136",3.000,"Car, truck, or van - carpooled","777,095","+/-95,911","681,184","873,006"
"C08136",4.000,"Public transportation (excluding taxicab)","62,870","+/-39,582","23,288","102,452"
"C08136",5.000,"Taxica