3",6.000,"Some college, associate's degree","3,345","+/-924","2,421","4,269"
"B17003",7.000,"Bachelor's degree or higher","1,470","+/-628","842","2,098"
"B17003",8.000,"Female:","39,510","+/-3,064","36,446","42,574"
"B17003",9.000,"Less than high school graduate","14,230","+/-1,843","12,387","16,073"
"B17003",10.000,"High school graduate (includes equivalency)","16,018","+/-2,079","13,939","18,097"
"B17003",11.000,"Some college, associate's degree","7,518","+/-1,454","6,064","8,972"
"B17003",12.000,"Bachelo