ations","40,310","+/-29,441","10,869","69,751"
"B24022",25.000,"Sales and office occupations:","36,756","+/-7,248","29,508","44,004"
"B24022",26.000,"Sales and related occupations","40,920","+/-5,593","35,327","46,513"
"B24022",27.000,"Office and administrative support occupations","31,072","+/-2,517","28,555","33,589"
"B24022",28.000,"Farming, fishing, and forestry occupations","19,151","+/-13,026","6,125","32,177"
"B24022",29.000,"Construction, extraction, maintenance, and repair occupations:","40,304","+