OPULATION 25 YEARS AND OVER (HISPANIC OR LATINO)",,,,
"C15002I",.,"Universe:  Hispanic or Latino population 25 years and over",,,,
"C15002I",1.000,"Total:","N","N","N","N"
"C15002I",2.000,"Male:","N","N","N","N"
"C15002I",3.000,"Less than high school diploma","N","N","N","N"
"C15002I",4.000,"High school graduate (includes equivalency)","N","N","N","N"
"C15002I",5.000,"Some college or associate's degree","N","N","N","N"
"C15002I",6.000,"Bachelor's degree or higher","N","N","N","N"
"C15002I",7.000,"Female:","