over in households",,,,
"B08137",1.000,"Total:","209,758","+/-6,064","203,694","215,822"
"B08137",2.000,"Householder lived in owner-occupied housing units","164,466","+/-6,143","158,323","170,609"
"B08137",3.000,"Householder lived in renter-occupied housing units","45,292","+/-3,157","42,135","48,449"
"B08137",4.000,"Car, truck, or van - drove alone:","171,728","+/-5,851","165,877","177,579"
"B08137",5.000,"Householder lived in owner-occupied housing units","138,671","+/-5,664","133,007","144,335"
"B08137",