rance, and real estate and rental and leasing:","26,322","+/-1,042","25,280","27,364"
"B24031",14.000,"Finance and insurance","26,269","+/-930","25,339","27,199"
"B24031",15.000,"Real estate and rental and leasing","26,497","+/-6,084","20,413","32,581"
"B24031",16.000,"Professional, scientific, and management, and administrative and waste management services:","23,560","+/-2,264","21,296","25,824"
"B24031",17.000,"Professional, scientific, and technical services","25,967","+/-2,648","23,319","28,615"
"B2403