n the past 12 months","4,558","+/-1,144","3,414","5,702"
"B17016",24.000,"Householder did not work in the past 12 months","6,202","+/-1,337","4,865","7,539"
"B17016",25.000,"Income in the past 12 months at or above poverty level:","132,576","+/-3,923","128,653","136,499"
"B17016",26.000,"Married-couple family:","108,674","+/-3,838","104,836","112,512"
"B17016",27.000,"Householder worked full-time, year-round in the past 12 months:","45,348","+/-2,973","42,375","48,321"
"B17016",28.000,"Spouse worked full-ti