tional services","2,292","+/-802","1,490","3,094"
"B24050",76.000,"Health care and social assistance","10,644","+/-1,611","9,033","12,255"
"B24050",77.000,"Arts, entertainment, and recreation, and accommodation and food services:","13,453","+/-1,936","11,517","15,389"
"B24050",78.000,"Arts, entertainment, and recreation","764","+/-387","377","1,151"
"B24050",79.000,"Accommodation and food services","12,689","+/-1,882","10,807","14,571"
"B24050",80.000,"Other services, except public administration","3,943","