0,"Other family:","18,550","+/-1,992","16,558","20,542"
"C23007",26.000,"Male householder, no wife present:","5,615","+/-1,070","4,545","6,685"
"C23007",27.000,"In labor force","2,799","+/-936","1,863","3,735"
"C23007",28.000,"Not in labor force","2,816","+/-673","2,143","3,489"
"C23007",29.000,"Female householder, no husband present:","12,935","+/-1,735","11,200","14,670"
"C23007",30.000,"In labor force","4,519","+/-925","3,594","5,444"
"C23007",31.000,"Not in labor force","8,416","+/-1,360","7,056","9,776