13,549","+/-1,989","11,560","15,538"
"B24070",17.000,"Professional, scientific, and technical services","6,909","+/-1,554","5,355","8,463"
"B24070",18.000,"Management of companies and enterprises","0","+/-265","0","265"
"B24070",19.000,"Administrative and support and waste management services","6,640","+/-1,452","5,188","8,092"
"B24070",20.000,"Educational services, and health care and social assistance:","54,007","+/-3,607","50,400","57,614"
"B24070",21.000,"Educational services","19,216","+/-2,173","17,04