8,390","+/-1,368","7,022","9,758"
"B21003",7.000,"Nonveteran:","353,636","+/-3,490","350,146","357,126"
"B21003",8.000,"Less than high school graduate","85,936","+/-4,049","81,887","89,985"
"B21003",9.000,"High school graduate (includes equivalency)","146,832","+/-5,226","141,606","152,058"
"B21003",10.000,"Some college or associate's degree","71,520","+/-3,779","67,741","75,299"
"B21003",11.000,"Bachelor's degree or higher","49,348","+/-3,805","45,543","53,153"
"B21004",.,"MEDIAN INCOME IN THE PAST 12 MONT