ial assistance:","942","+/-482","460","1,424"
"B24070",156.000,"Educational services","174","+/-213","0","387"
"B24070",157.000,"Health care and social assistance","768","+/-435","333","1,203"
"B24070",158.000,"Arts, entertainment, and recreation, and accommodation and food services:","157","+/-207","0","364"
"B24070",159.000,"Arts, entertainment, and recreation","0","+/-265","0","265"
"B24070",160.000,"Accommodation and food services","157","+/-207","0","364"
"B24070",161.000,"Other services, except public