00,"Personal care and service occupations:","479","+/-334","145","813"
"B24020",71.000,"Personal appearance workers","170","+/-243","0","413"
"B24020",72.000,"Transportation, tourism, and lodging attendants","0","+/-265","0","265"
"B24020",73.000,"Child care workers","0","+/-265","0","265"
"B24020",74.000,"Supervisors and other personal care and service workers except personal appearance, transportation, and child care workers","309","+/-231","78","540"
"B24020",75.000,"Sales and office occupations:","14,26