7","915","1,969"
"C24020",22.000,"Law enforcement workers including supervisors","1,523","+/-580","943","2,103"
"C24020",23.000,"Food preparation and serving related occupations","1,204","+/-681","523","1,885"
"C24020",24.000,"Building and grounds cleaning and maintenance occupations","3,033","+/-920","2,113","3,953"
"C24020",25.000,"Personal care and service occupations","479","+/-334","145","813"
"C24020",26.000,"Sales and office occupations:","14,268","+/-1,964","12,304","16,232"
"C24020",27.000,"Sales a