,271","24,194","26,736"
"B02010",.,"AMERICAN INDIAN AND ALASKA NATIVE ALONE OR IN COMBINATION WITH ONE OR MORE OTHER RACES",,,,
"B02010",.,"Universe:  American Indian and Alaska Native alone or in combination with one or more other races",,,,
"B02010",1.000,"Total:","2,539","+/-760","1,779","3,299"
"B02011",.,"ASIAN ALONE OR IN COMBINATION WITH ONE OR MORE OTHER RACES",,,,
"B02011",.,"Universe:  Asian alone or in combination with one or more other races",,,,
"B02011",1.000,"Total:","3,774","+/-656","3,118",