grounds cleaning and maintenance occupations","5,033","+/-1,198","3,835","6,231"
"C24010",25.000,"Personal care and service occupations","1,315","+/-616","699","1,931"
"C24010",26.000,"Sales and office occupations:","20,678","+/-2,150","18,528","22,828"
"C24010",27.000,"Sales and related occupations","13,819","+/-1,934","11,885","15,753"
"C24010",28.000,"Office and administrative support occupations","6,859","+/-1,285","5,574","8,144"
"C24010",29.000,"Farming, fishing, and forestry occupations","1,435","+/-