ment occupations except farmers and farm managers","7,549","+/-1,265","6,284","8,814"
"B24010H",6.000,"Farmers and farm managers","346","+/-348","0","694"
"B24010H",7.000,"Business and financial operations occupations","2,777","+/-791","1,986","3,568"
"B24010H",8.000,"Professional and related occupations:","12,207","+/-1,639","10,568","13,846"
"B24010H",9.000,"Computer and mathematical occupations","454","+/-360","94","814"
"B24010H",10.000,"Architecture and engineering occupations","2,551","+/-834","1,717"