,662"
"C24060",136.000,"Healthcare support occupations","622","+/-367","255","989"
"C24060",137.000,"Protective service occupations","3,587","+/-936","2,651","4,523"
"C24060",138.000,"Food preparation and serving related occupations","374","+/-254","120","628"
"C24060",139.000,"Building and grounds cleaning and maintenance occupations","2,110","+/-780","1,330","2,890"
"C24060",140.000,"Personal care and service occupations","625","+/-344","281","969"
"C24060",141.000,"Sales and office occupations:","6,215",