3.000,"Transportation and material moving occupations","N","N","N","N"
"B24010G",.,"SEX BY OCCUPATION FOR THE CIVILIAN EMPLOYED POPULATION 16 YEARS AND OVER (TWO OR MORE RACES)",,,,
"B24010G",.,"Universe:  Civilian employed Two or more races population 16 years and over",,,,
"B24010G",1.000,"Total:","N","N","N","N"
"B24010G",2.000,"Male:","N","N","N","N"
"B24010G",3.000,"Management, professional, and related occupations:","N","N","N","N"
"B24010G",4.000,"Management, business, and financial occupations:","N"