/-748","979","2,475"
"B24090",10.000,"Self-employed in own not incorporated business workers","4,234","+/-832","3,402","5,066"
"B24090",11.000,"Unpaid family workers","0","+/-265","0","265"
"B24090",12.000,"Female:","57,327","+/-3,856","53,471","61,183"
"B24090",13.000,"Private for-profit wage and salary workers:","37,077","+/-3,260","33,817","40,337"
"B24090",14.000,"Employee of private company workers","36,316","+/-3,250","33,066","39,566"
"B24090",15.000,"Self-employed in own incorporated business worker