548,890"
"B07004A",2.000,"Same house 1 year ago","472,968","+/-6,259","466,709","479,227"
"B07004A",3.000,"Moved within same county","44,409","+/-5,698","38,711","50,107"
"B07004A",4.000,"Moved from different county within same state","16,152","+/-2,902","13,250","19,054"
"B07004A",5.000,"Moved from different state","12,433","+/-2,409","10,024","14,842"
"B07004A",6.000,"Moved from abroad","461","+/-314","147","775"
"B07004B",.,"GEOGRAPHICAL MOBILITY IN THE PAST YEAR BY RACE (BLACK OR AFRICAN AMERICAN ALONE)