ent, and recreation, and accommodations and food services","10,361","+/-2,511","7,850","12,872"
"B24032",51.000,"Arts, entertainment, and recreation","7,472","+/-11,163","-3,691","18,635"
"B24032",52.000,"Accommodation and food services","10,379","+/-2,424","7,955","12,803"
"B24032",53.000,"Other services except public administration","12,753","+/-3,392","9,361","16,145"
"B24032",54.000,"Public administration","27,573","+/-3,211","24,362","30,784"
"B24040",.,"SEX BY INDUSTRY FOR THE FULL-TIME, YEAR-ROUND CI