ineers","962","+/-519","443","1,481"
"B24020",24.000,"Drafters, engineering, and mapping technicians","1,421","+/-596","825","2,017"
"B24020",25.000,"Life, physical, and social science occupations:","1,047","+/-611","436","1,658"
"B24020",26.000,"Life and physical scientists","322","+/-384","0","706"
"B24020",27.000,"Social scientists and related workers","58","+/-102","0","160"
"B24020",28.000,"Life, physical, and social science technicians","667","+/-481","186","1,148"
"B24020",29.000,"Community and socia