rance","1,775","+/-613","1,162","2,388"
"B24030",88.000,"Real estate and rental and leasing","1,892","+/-767","1,125","2,659"
"B24030",89.000,"Professional, scientific, and management, and administrative and waste management services:","8,190","+/-1,471","6,719","9,661"
"B24030",90.000,"Professional, scientific, and technical services","4,146","+/-1,121","3,025","5,267"
"B24030",91.000,"Management of companies and enterprises","0","+/-265","0","265"
"B24030",92.000,"Administrative and support and waste mana