97","537"
"B24020",92.000,"Fishing and hunting, and forest and logging workers","177","+/-182","0","359"
"B24020",93.000,"Construction, extraction, maintenance, and repair occupations:","23,506","+/-2,397","21,109","25,903"
"B24020",94.000,"Construction and extraction occupations:","15,022","+/-2,001","13,021","17,023"
"B24020",95.000,"Supervisors, construction and extraction workers","2,517","+/-717","1,800","3,234"
"B24020",96.000,"Carpenters","459","+/-340","119","799"
"B24020",97.000,"Construction labor