and office occupations","1,660","+/-580","1,080","2,240"
"C24010B",13.000,"Farming, fishing, and forestry occupations","0","+/-265","0","265"
"C24010B",14.000,"Construction, extraction, maintenance, and repair occupations","0","+/-265","0","265"
"C24010B",15.000,"Production, transportation, and material moving occupations","48","+/-68","0","116"
"C24010C",.,"SEX BY OCCUPATION FOR THE CIVILIAN EMPLOYED POPULATION 16 YEARS AND OVER (AMERICAN INDIAN AND ALASKA NATIVE ALONE)",,,,
"C24010C",.,"Universe:  Civilia