+/-1,024","3,651","5,699"
"B24030",203.000,"Arts, entertainment, and recreation, and accommodation and food services:","10,419","+/-1,694","8,725","12,113"
"B24030",204.000,"Arts, entertainment, and recreation","717","+/-428","289","1,145"
"B24030",205.000,"Accommodation and food services","9,702","+/-1,620","8,082","11,322"
"B24030",206.000,"Other services, except public administration:","4,273","+/-908","3,365","5,181"
"B24030",207.000,"Repair and maintenance","181","+/-197","0","378"
"B24030",208.000,"Pe