959","4,391","6,309"
"C24030",42.000,"Finance and insurance","3,959","+/-887","3,072","4,846"
"C24030",43.000,"Real estate and rental and leasing","1,391","+/-498","893","1,889"
"C24030",44.000,"Professional, scientific, and management, and administrative and waste management services:","5,359","+/-1,259","4,100","6,618"
"C24030",45.000,"Professional, scientific, and technical services","2,763","+/-829","1,934","3,592"
"C24030",46.000,"Management of companies and enterprises","0","+/-265","0","265"
"C24030"