rts, design, entertainment, sports, and media occupations","21,970","+/-11,179","10,791","33,149"
"B24012",51.000,"Healthcare practitioner and technical occupations:","36,463","+/-4,941","31,522","41,404"
"B24012",52.000,"Health diagnosing and treating practitioners and other technical occupations","41,940","+/-4,656","37,284","46,596"
"B24012",53.000,"Health technologists and technicians","26,139","+/-4,456","21,683","30,595"
"B24012",54.000,"Service occupations:","11,153","+/-744","10,409","11,897"
"B2401