onths","N","N","N","N"
"B22005G",.,"RECEIPT OF FOOD STAMPS IN THE PAST 12 MONTHS BY RACE OF HOUSEHOLDER (TWO OR MORE RACES)",,,,
"B22005G",.,"Universe:  Households with a householder who is Two or more races",,,,
"B22005G",1.000,"Total:","1,348","+/-638","710","1,986"
"B22005G",2.000,"Household received Food Stamps in the past 12 months","245","+/-219","26","464"
"B22005G",3.000,"Household did not receive Food Stamps in the past 12 months","1,103","+/-597","506","1,700"
"B22005H",.,"RECEIPT OF FOOD STAMPS I