0,"Householder worked part-time or part-year in the past 12 months:","2,194","+/-782","1,412","2,976"
"B17016",9.000,"Spouse worked full-time, year-round in the past 12 months","324","+/-263","61","587"
"B17016",10.000,"Spouse worked part-time or part-year in the past 12 months","877","+/-517","360","1,394"
"B17016",11.000,"Spouse did not work in the past 12 months","993","+/-562","431","1,555"
"B17016",12.000,"Householder did not work in the past 12 months:","8,167","+/-1,716","6,451","9,883"
"B17016",13.0