N","N","N"
"B24010F",57.000,"Farming, fishing, and forestry occupations","N","N","N","N"
"B24010F",58.000,"Construction, extraction, maintenance, and repair occupations:","N","N","N","N"
"B24010F",59.000,"Construction and extraction occupations","N","N","N","N"
"B24010F",60.000,"Installation, maintenance, and repair occupations","N","N","N","N"
"B24010F",61.000,"Production, transportation, and material moving occupations:","N","N","N","N"
"B24010F",62.000,"Production occupations","N","N","N","N"
"B24010F",6