l, and related occupations:","2,324","+/-751","1,573","3,075"
"B24060",81.000,"Management, business, and financial occupations:","1,477","+/-569","908","2,046"
"B24060",82.000,"Management occupations","1,214","+/-521","693","1,735"
"B24060",83.000,"Business and financial operations occupations","263","+/-229","34","492"
"B24060",84.000,"Professional and related occupations:","847","+/-473","374","1,320"
"B24060",85.000,"Computer and mathematical occupations","0","+/-265","0","265"
"B24060",86.000,"Architect