5,796","+/-4,499","21,297","30,295"
"B07013",10.000,"Moved from different county within same state:","13,835","+/-3,025","10,810","16,860"
"B07013",11.000,"Householder lived in owner-occupied housing units","5,112","+/-1,647","3,465","6,759"
"B07013",12.000,"Householder lived in renter-occupied housing units","8,723","+/-2,528","6,195","11,251"
"B07013",13.000,"Moved from different state:","12,535","+/-2,890","9,645","15,425"
"B07013",14.000,"Householder lived in owner-occupied housing units","5,354","+/-1,