26","52,422"
"B19025",.,"AGGREGATE HOUSEHOLD INCOME IN THE PAST 12 MONTHS (IN 2007 INFLATION-ADJUSTED DOLLARS)",,,,
"B19025",.,"Universe:  Households",,,,
"B19025",1.000,"Aggregate household income in the past 12 months (in 2007 inflation-adjusted dollars)","10,261,945,600","+/-349,163,881","9,912,781,719","10,611,109,481"
"B19025A",.,"AGGREGATE HOUSEHOLD INCOME IN THE PAST 12 MONTHS (IN 2007 INFLATION-ADJUSTED DOLLARS) (WHITE ALONE HOUSEHOLDER)",,,,
"B19025A",.,"Universe:  Households with a householder who