166","74,938","81,270"
"C23007",19.000,"Husband in labor force:","36,345","+/-2,556","33,789","38,901"
"C23007",20.000,"Wife in labor force","22,199","+/-2,225","19,974","24,424"
"C23007",21.000,"Wife not in labor force","14,146","+/-1,643","12,503","15,789"
"C23007",22.000,"Husband not in labor force:","41,759","+/-2,382","39,377","44,141"
"C23007",23.000,"Wife in labor force","10,067","+/-1,321","8,746","11,388"
"C23007",24.000,"Wife not in labor force","31,692","+/-2,126","29,566","33,818"
"C23007",25.00