ACES) FOR CURRENT RESIDENCE IN THE UNITED STATES",,,,
"B07004G",.,"Universe:  Two or more races population 1 year and over in the United States",,,,
"B07004G",1.000,"Total:","4,271","+/-1,076","3,195","5,347"
"B07004G",2.000,"Same house 1 year ago","3,124","+/-1,058","2,066","4,182"
"B07004G",3.000,"Moved within same county","798","+/-518","280","1,316"
"B07004G",4.000,"Moved from different county within same state","163","+/-183","0","346"
"B07004G",5.000,"Moved from different state","142","+/-141","1","28