s","1,175","+/-568","607","1,743"
"B24060",200.000,"Business and financial operations occupations","755","+/-510","245","1,265"
"B24060",201.000,"Professional and related occupations:","1,079","+/-470","609","1,549"
"B24060",202.000,"Computer and mathematical occupations","214","+/-274","0","488"
"B24060",203.000,"Architecture and engineering occupations","67","+/-106","0","173"
"B24060",204.000,"Life, physical, and social science occupations","0","+/-265","0","265"
"B24060",205.000,"Community and social se