,"Married-couple family:","11,886","+/-1,963","9,923","13,849"
"C17010",4.000,"With related children under 18 years","6,479","+/-1,317","5,162","7,796"
"C17010",5.000,"Other family:","13,393","+/-1,481","11,912","14,874"
"C17010",6.000,"Male householder, no wife present","2,122","+/-783","1,339","2,905"
"C17010",7.000,"With related children under 18 years","1,876","+/-768","1,108","2,644"
"C17010",8.000,"Female householder, no husband present","11,271","+/-1,496","9,775","12,767"
"C17010",9.000,"With relate