"+/-374","197","945"
"B24020",87.000,"Material recording, scheduling, dispatching, and distributing workers","2,208","+/-912","1,296","3,120"
"B24020",88.000,"Secretaries and administrative assistants","203","+/-235","0","438"
"B24020",89.000,"Other office and administrative support workers including supervisors","1,207","+/-537","670","1,744"
"B24020",90.000,"Farming, fishing, and forestry occupations:","494","+/-276","218","770"
"B24020",91.000,"Agricultural workers including supervisors","317","+/-220","