00,"Enrolled in nursery school, kindergarten","1,268","+/-561","707","1,829"
"B14001B",4.000,"Enrolled in grade 1 to grade 8","2,134","+/-674","1,460","2,808"
"B14001B",5.000,"Enrolled in grade 9 to grade 12","1,192","+/-518","674","1,710"
"B14001B",6.000,"Enrolled in college or graduate school","2,956","+/-756","2,200","3,712"
"B14001B",7.000,"Not enrolled in school","15,193","+/-1,052","14,141","16,245"
"B14001C",.,"SCHOOL ENROLLMENT BY LEVEL OF SCHOOL FOR THE POPULATION 3 YEARS AND OVER (AMERICAN INDIAN 