+/-378","153","909"
"B08126",97.000,"Transportation and warehousing, and utilities","171","+/-189","0","360"
"B08126",98.000,"Information","173","+/-174","0","347"
"B08126",99.000,"Finance and insurance, and real estate and rental and leasing","500","+/-299","201","799"
"B08126",100.000,"Professional, scientific, and management, and administrative and waste management services","885","+/-558","327","1,443"
"B08126",101.000,"Educational services, and health care and social assistance","1,454","+/-584","870",