7 inflation-adjusted dollars)","N","N","N","N"
"B19301I",.,"PER CAPITA INCOME IN THE PAST 12 MONTHS (IN 2007 INFLATION-ADJUSTED DOLLARS) (HISPANIC OR LATINO)",,,,
"B19301I",.,"Universe:  Hispanic or Latino population",,,,
"B19301I",1.000,"Per capita income in the past 12 months (in 2007 inflation-adjusted dollars)","N","N","N","N"
"B19313",.,"AGGREGATE INCOME IN THE PAST 12 MONTHS (IN 2007 INFLATION-ADJUSTED DOLLARS)",,,,
"B19313",.,"Universe:  Population 15 years and over",,,,
"B19313",1.000,"Aggregate inc