+/-959","4,391","6,309"
"B24030",192.000,"Finance and insurance","3,959","+/-887","3,072","4,846"
"B24030",193.000,"Real estate and rental and leasing","1,391","+/-498","893","1,889"
"B24030",194.000,"Professional, scientific, and management, and administrative and waste management services:","5,359","+/-1,259","4,100","6,618"
"B24030",195.000,"Professional, scientific, and technical services","2,763","+/-829","1,934","3,592"
"B24030",196.000,"Management of companies and enterprises","0","+/-265","0","265"
