004D",3.000,"Moved within same county","N","N","N","N"
"B07004D",4.000,"Moved from different county within same state","N","N","N","N"
"B07004D",5.000,"Moved from different state","N","N","N","N"
"B07004D",6.000,"Moved from abroad","N","N","N","N"
"B07004E",.,"GEOGRAPHICAL MOBILITY IN THE PAST YEAR BY RACE (NATIVE HAWAIIAN AND OTHER PACIFIC ISLANDER ALONE) FOR CURRENT RESIDENCE IN THE UNITED STATES",,,,
"B07004E",.,"Universe:  Native Hawaiian and Other Pacific Islander alone population 1 year and over in th