010B",29.000,"Installation, maintenance, and repair occupations","N","N","N","N"
"B24010B",30.000,"Production, transportation, and material moving occupations:","N","N","N","N"
"B24010B",31.000,"Production occupations","N","N","N","N"
"B24010B",32.000,"Transportation and material moving occupations","N","N","N","N"
"B24010B",33.000,"Female:","N","N","N","N"
"B24010B",34.000,"Management, professional, and related occupations:","N","N","N","N"
"B24010B",35.000,"Management, business, and financial occupations: