,,,,,,,,,,
"S1002",22.0,"Civilian grandparents living with own grandchildren under 18 years","3,323","+/-906","1,770","+/-677","987","+/-519","783","+/-552",,,,
"S1002",23.0,"With any disability","48.4","+/-14.0","36.4","+/-19.5","13.7","+/-14.5","65.0","+/-24.7",,,,
"S1002",23.3,,,,,,,,,,,,,
"S1002",23.5,"POVERTY STATUS IN THE PAST 12 MONTHS",,,,,,,,,,,,
"S1002",24.0,"Grandparents living with own grandchildren under 18 years for whom poverty status is determined","3,323","+/-906","1,770","+/-677","987","+/