/-460","6,426","+/-254",,,,,,
"S1801",6.0,"With any disability","13.8","+/-6.0","15.4","+/-9.5","12.0","+/-9.2",,,,,,
"S1801",7.0,"With a sensory disability","0.4","+/-0.6","0.0","+/-2.2","0.8","+/-1.2",,,,,,
"S1801",8.0,"With a physical disability","2.1","+/-2.8","0.3","+/-0.6","4.2","+/-6.1",,,,,,
"S1801",9.0,"With a mental disability","11.3","+/-5.0","15.0","+/-9.6","7.0","+/-6.1",,,,,,
"S1801",10.0,"With a self-care disability","0.7","+/-1.1","0.0","+/-2.2","1.4","+/-2.4",,,,,,
"S1801",10.3,,,,,,,,,,,,,