,"+/-1,785",,
"S1101",9.5,"SELECTED HOUSEHOLDS BY TYPE",,,,,,,,,,,,
"S1101",10.0,"Households with one or more people under 18 years","36.5","+/-4.7","42.8","+/-5.6","76.4","+/-16.0","73.8","+/-8.4","2.1","+/-3.0",,
"S1101",11.0,"Households with one or more people 60 years and over","34.3","+/-2.3","31.9","+/-4.1","41.4","+/-23.6","27.5","+/-8.8","40.6","+/-8.2",,
"S1101",12.0,"Householder living alone","27.7","+/-4.6","(X)","(X)","(X)","(X)","(X)","(X)","89.6","+/-5.8",,
"S1101",13.0,"65 years and over","8.