4,425","17,397"
"C17010",12.000,"With related children under 18 years","7,362","+/-1,215","6,147","8,577"
"C17010",13.000,"Other family:","6,871","+/-1,130","5,741","8,001"
"C17010",14.000,"Male householder, no wife present","2,136","+/-661","1,475","2,797"
"C17010",15.000,"With related children under 18 years","992","+/-503","489","1,495"
"C17010",16.000,"Female householder, no husband present","4,735","+/-1,096","3,639","5,831"
"C17010",17.000,"With related children under 18 years","3,085","+/-863","2,222