A",4.000,"60 years and over","312","+/-299","13","611"
"B10051A",5.000,"Grandparent not responsible for own grandchildren under 18 years:","545","+/-341","204","886"
"B10051A",6.000,"30 to 59 years","210","+/-207","3","417"
"B10051A",7.000,"60 years and over","335","+/-298","37","633"
"B10051B",.,"GRANDPARENTS LIVING WITH OWN GRANDCHILDREN UNDER 18 YEARS BY RESPONSIBILITY FOR OWN GRANDCHILDREN AND AGE OF GRANDPARENT (BLACK OR AFRICAN AMERICAN ALONE)",,,,
"B10051B",.,"Universe:  Grandparents (Black or Africa