1.000,"Total:","22,462","+/-2,653","19,809","25,115"
"C23008",2.000,"Under 6 years:","8,070","+/-1,518","6,552","9,588"
"C23008",3.000,"Living with two parents:","4,892","+/-1,198","3,694","6,090"
"C23008",4.000,"Both parents in labor force","3,001","+/-907","2,094","3,908"
"C23008",5.000,"Father only in labor force","1,371","+/-529","842","1,900"
"C23008",6.000,"Mother only in labor force","233","+/-226","7","459"
"C23008",7.000,"Neither parent in labor force","287","+/-352","0","639"
"C23008",8.000,"Livin