","884"
"C24020",51.000,"Arts, design, entertainment, sports, and media occupations","223","+/-185","38","408"
"C24020",52.000,"Healthcare practitioner and technical occupations:","1,105","+/-616","489","1,721"
"C24020",53.000,"Health diagnosing and treating practitioners and other technical occupations","606","+/-456","150","1,062"
"C24020",54.000,"Health technologists and technicians","499","+/-343","156","842"
"C24020",55.000,"Service occupations:","2,517","+/-897","1,620","3,414"
"C24020",56.000,"Health