,"N","N","N","N"
"B24050",13.000,"Finance and insurance, and real estate and rental and leasing:","N","N","N","N"
"B24050",14.000,"Finance and insurance","N","N","N","N"
"B24050",15.000,"Real estate and rental and leasing","N","N","N","N"
"B24050",16.000,"Professional, scientific, and management, and administrative and waste management services:","N","N","N","N"
"B24050",17.000,"Professional, scientific, and technical services","N","N","N","N"
"B24050",18.000,"Management of companies and enterprises","N","N