ale:","13,964","+/-1,591","12,373","15,555"
"C15002A",3.000,"Less than high school diploma","2,045","+/-759","1,286","2,804"
"C15002A",4.000,"High school graduate (includes equivalency)","2,932","+/-818","2,114","3,750"
"C15002A",5.000,"Some college or associate's degree","4,942","+/-987","3,955","5,929"
"C15002A",6.000,"Bachelor's degree or higher","4,045","+/-940","3,105","4,985"
"C15002A",7.000,"Female:","15,743","+/-1,605","14,138","17,348"
"C15002A",8.000,"Less than high school diploma","2,809","+/-830