d in a different Micropolitan Statistical Area","N","N","N","N"
"C08017",6.000,"Worked in a Metropolitan Statistical Area:","N","N","N","N"
"C08017",7.000,"Worked in a principal city","N","N","N","N"
"C08017",8.000,"Worked outside any principal city","N","N","N","N"
"C08017",9.000,"Worked outside any Metropolitan or Micropolitan Statistical Area","N","N","N","N"
"C08018",.,"PLACE OF WORK FOR WORKERS 16 YEARS AND OVER--NOT METROPOLITAN OR MICROPOLITAN STATISTICAL AREA LEVEL",,,,
"C08018",.,"Universe:  Worker