or cash public assistance income in the past 12 months","597","+/-300","297","897"
"B17015",32.000,"Without SSI or cash public assistance income in the past 12 months","11,127","+/-1,467","9,660","12,594"
"B17015",33.000,"Other family:","6,871","+/-1,130","5,741","8,001"
"B17015",34.000,"Male householder, no wife present:","2,136","+/-661","1,475","2,797"
"B17015",35.000,"With Social Security income in the past 12 months:","456","+/-298","158","754"
"B17015",36.000,"With SSI and/or cash public assistance in