"N","N","N"
"B24010I",18.000,"Healthcare support occupations","N","N","N","N"
"B24010I",19.000,"Protective service occupations","N","N","N","N"
"B24010I",20.000,"Food preparation and serving related occupations","N","N","N","N"
"B24010I",21.000,"Building and grounds cleaning and maintenance occupation","N","N","N","N"
"B24010I",22.000,"Personal care and service occupations","N","N","N","N"
"B24010I",23.000,"Sales and office occupations:","N","N","N","N"
"B24010I",24.000,"Sales and related occupations","N","