nt occupations","61,836","+/-9,657","52,179","71,493"
"B24012",42.000,"Business and financial operations occupations","61,229","+/-24,157","37,072","85,386"
"B24012",43.000,"Professional and related occupations:","44,659","+/-13,556","31,103","58,215"
"B24012",44.000,"Computer and mathematical occupations","63,391","+/-15,589","47,802","78,980"
"B24012",45.000,"Architecture and engineering occupations","16,317","+/-15,845","472","32,162"
"B24012",46.000,"Life, physical, and social science occupations","65,2