l Area in the United States",,,,
"C07201",1.000,"Total:","107,566","+/-6,082","101,484","113,648"
"C07201",2.000,"Same house 1 year ago","91,205","+/-6,177","85,028","97,382"
"C07201",3.000,"Different house in United States 1 year ago:","15,121","+/-3,124","11,997","18,245"
"C07201",4.000,"Same Metropolitan Statistical Area:","8,328","+/-2,532","5,796","10,860"
"C07201",5.000,"Moved from principal city","8,108","+/-2,500","5,608","10,608"
"C07201",6.000,"Moved from remainder of Metropolitan Statistical Area