cash public assistance income in the past 12 months","40","+/-66","0","106"
"B17015",7.000,"Without Social Security income in the past 12 months:","601","+/-382","219","983"
"B17015",8.000,"With SSI and/or cash public assistance income in the past 12 months","0","+/-292","0","292"
"B17015",9.000,"Without SSI or cash public assistance income in the past 12 months","601","+/-382","219","983"
"B17015",10.000,"Other family:","1,876","+/-765","1,111","2,641"
"B17015",11.000,"Male householder, no wife present:","