science occupations:","N","N","N","N"
"B24010",26.000,"Life and physical scientists","N","N","N","N"
"B24010",27.000,"Social scientists and related workers","N","N","N","N"
"B24010",28.000,"Life, physical, and social science technicians","N","N","N","N"
"B24010",29.000,"Community and social services occupations:","N","N","N","N"
"B24010",30.000,"Counselors, social workers, and other community and social service specialists","N","N","N","N"
"B24010",31.000,"Religious workers","N","N","N","N"
"B24010",32.000,