000,"Public transportation (excluding taxicab):","2,872","+/-700","2,172","3,572"
"B08130",17.000,"Worked in state of residence:","2,872","+/-700","2,172","3,572"
"B08130",18.000,"Worked in county of residence","612","+/-372","240","984"
"B08130",19.000,"Worked outside county of residence","2,260","+/-637","1,623","2,897"
"B08130",20.000,"Worked outside state of residence","0","+/-292","0","292"
"B08130",21.000,"Walked:","819","+/-487","332","1,306"
"B08130",22.000,"Worked in state of residence:","742","+/-