2,763"
"C17021",7.000,"Female householder, no husband present","5,109","+/-2,251","2,858","7,360"
"C17021",8.000,"In non-family households and other living arrangement","2,761","+/-824","1,937","3,585"
"C17021",9.000,"Income in the past 12 months at or above poverty level:","95,195","+/-6,229","88,966","101,424"
"C17021",10.000,"In family households:","82,769","+/-6,149","76,620","88,918"
"C17021",11.000,"In married couple families","60,604","+/-6,068","54,536","66,672"
"C17021",12.000,"In other families:",