","18,510"
"B08130",10.000,"Worked outside state of residence","291","+/-411","0","702"
"B08130",11.000,"Car, truck, or van - carpooled:","8,418","+/-1,433","6,985","9,851"
"B08130",12.000,"Worked in state of residence:","8,418","+/-1,433","6,985","9,851"
"B08130",13.000,"Worked in county of residence","1,746","+/-594","1,152","2,340"
"B08130",14.000,"Worked outside county of residence","6,672","+/-1,381","5,291","8,053"
"B08130",15.000,"Worked outside state of residence","0","+/-292","0","292"
"B08130",16.