.000,"Retail trade","N","N","N","N"
"B08126",97.000,"Transportation and warehousing, and utilities","N","N","N","N"
"B08126",98.000,"Information","N","N","N","N"
"B08126",99.000,"Finance and insurance, and real estate and rental and leasing","N","N","N","N"
"B08126",100.000,"Professional, scientific, and management, and administrative and waste management services","N","N","N","N"
"B08126",101.000,"Educational services, and health care and social assistance","N","N","N","N"
"B08126",102.000,"Arts, entertain