 did not work in the past 12 months","1,349","+/-494","855","1,843"
"B17016",35.000,"Householder did not work in the past 12 months:","3,937","+/-870","3,067","4,807"
"B17016",36.000,"Spouse worked full-time, year-round in the past 12 months","1,213","+/-524","689","1,737"
"B17016",37.000,"Spouse worked part-time or part-year in the past 12 months","526","+/-265","261","791"
"B17016",38.000,"Spouse did not work in the past 12 months","2,198","+/-640","1,558","2,838"
"B17016",39.000,"Other family:","6,871","