,"256","+/-224","32","480"
"C17010I",4.000,"With related children under 18 years","216","+/-214","2","430"
"C17010I",5.000,"Other family:","362","+/-314","48","676"
"C17010I",6.000,"Male householder, no wife present","100","+/-163","0","263"
"C17010I",7.000,"With related children under 18 years","0","+/-292","0","292"
"C17010I",8.000,"Female householder, no husband present","262","+/-273","0","535"
"C17010I",9.000,"With related children under 18 years","262","+/-273","0","535"
"C17010I",10.000,"Income in th