l trade:","N","N","N","N"
"B24040",49.000,"Motor vehicle and parts dealers","N","N","N","N"
"B24040",50.000,"Furniture and home furnishings, and household appliance stores","N","N","N","N"
"B24040",51.000,"Radio, TV, and computer and software, and other electronic stores","N","N","N","N"
"B24040",52.000,"Building material and garden equipment and supplies dealers","N","N","N","N"
"B24040",53.000,"Food and beverage stores","N","N","N","N"
"B24040",54.000,"Pharmacies and drug stores","N","N","N","N"
"B24040",