119.000,"Management, professional, and related occupations:","N","N","N","N"
"B24060",120.000,"Management, business, and financial occupations:","N","N","N","N"
"B24060",121.000,"Management occupations","N","N","N","N"
"B24060",122.000,"Business and financial operations occupations","N","N","N","N"
"B24060",123.000,"Professional and related occupations:","N","N","N","N"
"B24060",124.000,"Computer and mathematical occupations","N","N","N","N"
"B24060",125.000,"Architecture and engineering occupations","N","N