months","0","+/-292","0","292"
"B17015",22.000,"Without Social Security income in the past 12 months:","1,316","+/-654","662","1,970"
"B17015",23.000,"With SSI and/or cash public assistance income in the past 12 months","478","+/-370","108","848"
"B17015",24.000,"Without SSI or cash public assistance income in the past 12 months","838","+/-547","291","1,385"
"B17015",25.000,"Income in the past 12 months at or above poverty level:","22,782","+/-1,603","21,179","24,385"
"B17015",26.000,"Married-couple family: