000,"Without any disability","3,986","+/-861","3,125","4,847"
"C18001",26.000,"With one type of disability","1,346","+/-471","875","1,817"
"C18001",27.000,"With two or more types of disability","1,968","+/-700","1,268","2,668"
"C18002",.,"SEX BY AGE BY DISABILITY STATUS FOR THE CIVILIAN NONINSTITUTIONALIZED POPULATION 5 YEARS AND OVER",,,,
"C18002",.,"Universe:  Civilian noninstitutionalized population 5 years and over",,,,
"C18002",1.000,"Total:","101,137","+/-5,587","95,550","106,724"
"C18002",2.000,"Male