otal:","88,389","+/-4,841","83,548","93,230"
"C17004",2.000,"Income in the past 12 months below poverty level:","8,779","+/-2,008","6,771","10,787"
"C17004",3.000,"Worked full time, year-round","189","+/-188","1","377"
"C17004",4.000,"Worked part-time or part-year","3,083","+/-952","2,131","4,035"
"C17004",5.000,"Did not work","5,507","+/-1,525","3,982","7,032"
"C17004",6.000,"Income in the past 12 months at or above poverty level:","79,610","+/-5,069","74,541","84,679"
"C17004",7.000,"Worked full time, yea