der, no wife present:","320","+/-280","40","600"
"B17018",10.000,"Less than high school graduate","0","+/-292","0","292"
"B17018",11.000,"High school graduate (includes equivalency)","114","+/-174","0","288"
"B17018",12.000,"Some college, associate's degree","100","+/-163","0","263"
"B17018",13.000,"Bachelor's degree or higher","106","+/-128","0","234"
"B17018",14.000,"Female householder, no husband present:","1,556","+/-717","839","2,273"
"B17018",15.000,"Less than high school graduate","487","+/-472","15"