"Bookkeeping, accounting, and auditing clerks","N","N","N","N"
"B24020",85.000,"Information and record clerks except customer service representatives","N","N","N","N"
"B24020",86.000,"Customer service representatives","N","N","N","N"
"B24020",87.000,"Material recording, scheduling, dispatching, and distributing workers","N","N","N","N"
"B24020",88.000,"Secretaries and administrative assistants","N","N","N","N"
"B24020",89.000,"Other office and administrative support workers including supervisors","N","N","N