,2.000,"Car, truck, or van - drove alone","12,854","+/-2,020","10,834","14,874"
"C08105A",3.000,"Car, truck, or van - carpooled","2,452","+/-755","1,697","3,207"
"C08105A",4.000,"Public transportation (excluding taxicab)","1,361","+/-544","817","1,905"
"C08105A",5.000,"Taxicab, motorcycle, bicycle, walked, or other means","887","+/-486","401","1,373"
"C08105A",6.000,"Worked at home","1,147","+/-510","637","1,657"
"C08105B",.,"MEANS OF TRANSPORTATION TO WORK (BLACK OR AFRICAN AMERICAN ALONE)",,,,
"C08105B",.