75",24.000,"$750,000 to $999,999","N","N","N","N"
"B25075",25.000,"$1,000,000 or more","N","N","N","N"
"B25076",.,"LOWER VALUE QUARTILE (DOLLARS)",,,,
"B25076",.,"Universe:  Owner-occupied housing units",,,,
"B25076",1.000,"Lower value quartile (dollars)","337,100","+/-11,890","325,210","348,990"
"B25077",.,"MEDIAN VALUE (DOLLARS)",,,,
"B25077",.,"Universe:  Owner-occupied housing units",,,,
"B25077",1.000,"Median value (dollars)","446,300","+/-16,169","430,131","462,469"
"B25078",.,"UPPER VALUE QUARTILE (D