,110.000,"Food processing workers","N","N","N","N"
"B24010",111.000,"Metal workers and plastic workers","N","N","N","N"
"B24010",112.000,"Printing workers","N","N","N","N"
"B24010",113.000,"Textile, apparel, and furnishings workers","N","N","N","N"
"B24010",114.000,"Woodworkers","N","N","N","N"
"B24010",115.000,"Plant and system operators","N","N","N","N"
"B24010",116.000,"Other production occupations including supervisors","N","N","N","N"
"B24010",117.000,"Transportation and material moving occupations:","