
"B08016",14.000,"Worked in Metropolitan Statistical Area of residence:","N","N","N","N"
"B08016",15.000,"Worked in a principal city","N","N","N","N"
"B08016",16.000,"Worked outside any principal city","N","N","N","N"
"B08016",17.000,"Worked in a different Metropolitan Statistical Area:","N","N","N","N"
"B08016",18.000,"Worked in a principal city","N","N","N","N"
"B08016",19.000,"Worked outside any principal city","N","N","N","N"
"B08016",20.000,"Worked in a Micropolitan Statistical Area:","N","N","N","N"
"