ming, fishing, and forestry occupations","N","N","N","N"
"B24010E",27.000,"Construction, extraction, maintenance, and repair occupations:","N","N","N","N"
"B24010E",28.000,"Construction and extraction occupations","N","N","N","N"
"B24010E",29.000,"Installation, maintenance, and repair occupations","N","N","N","N"
"B24010E",30.000,"Production, transportation, and material moving occupations:","N","N","N","N"
"B24010E",31.000,"Production occupations","N","N","N","N"
"B24010E",32.000,"Transportation and materi