4060",129.000,"Life, physical, and social science occupations","N","N","N","N"
"C24060",130.000,"Community and social services occupations","N","N","N","N"
"C24060",131.000,"Legal occupations","N","N","N","N"
"C24060",132.000,"Education, training, and library occupations","N","N","N","N"
"C24060",133.000,"Arts, design, entertainment, sports, and media occupations","N","N","N","N"
"C24060",134.000,"Healthcare practitioner and technical occupations","N","N","N","N"
"C24060",135.000,"Service occupations:","N",