000 or more","N","N","N","N"
"B25086",.,"AGGREGATE PRICE ASKED (DOLLARS)",,,,
"B25086",.,"Universe:  Vacant-for-sale-only and sold, not occupied housing units",,,,
"B25086",1.000,"Aggregate price asked (dollars)","724,750,000","+/-421,094,262","303,655,738","1,145,844,262"
"B25087",.,"MORTGAGE STATUS AND SELECTED MONTHLY OWNER COSTS",,,,
"B25087",.,"Universe:  Owner-occupied housing units",,,,
"B25087",1.000,"Total:","24,427","+/-1,845","22,582","26,272"
"B25087",2.000,"Housing units with a mortgage:","19,1