graduate (includes equivalency)","841","+/-595","246","1,436"
"C15002I",5.000,"Some college or associate's degree","1,747","+/-771","976","2,518"
"C15002I",6.000,"Bachelor's degree or higher","466","+/-296","170","762"
"C15002I",7.000,"Female:","5,880","+/-1,123","4,757","7,003"
"C15002I",8.000,"Less than high school diploma","2,225","+/-774","1,451","2,999"
"C15002I",9.000,"High school graduate (includes equivalency)","1,358","+/-596","762","1,954"
"C15002I",10.000,"Some college or associate's degree","1,9