20","1,306"
"B23010",9.000,"Spouse worked less than full-time, year-round in the past 12 months","690","+/-360","330","1,050"
"B23010",10.000,"Spouse did not work in the past 12 months","441","+/-274","167","715"
"B23010",11.000,"Householder did not work in the past 12 months:","1,075","+/-503","572","1,578"
"B23010",12.000,"Spouse worked full-time, year-round in the past 12 months","577","+/-361","216","938"
"B23010",13.000,"Spouse worked less than full-time, year-round in the past 12 months","325","+/-315