24010F",28.000,"Construction and extraction occupations","N","N","N","N"
"B24010F",29.000,"Installation, maintenance, and repair occupations","N","N","N","N"
"B24010F",30.000,"Production, transportation, and material moving occupations:","N","N","N","N"
"B24010F",31.000,"Production occupations","N","N","N","N"
"B24010F",32.000,"Transportation and material moving occupations","N","N","N","N"
"B24010F",33.000,"Female:","N","N","N","N"
"B24010F",34.000,"Management, professional, and related occupations:","N","