","N","N","N"
"B24030",25.000,"Furniture and related products","N","N","N","N"
"B24030",26.000,"Miscellaneous manufacturing","N","N","N","N"
"B24030",27.000,"Wholesale trade:","N","N","N","N"
"B24030",28.000,"Motor vehicle, parts and supplies merchant wholesalers","N","N","N","N"
"B24030",29.000,"Furniture and home furnishing merchant wholesalers","N","N","N","N"
"B24030",30.000,"Lumber and other construction materials merchant wholesalers","N","N","N","N"
"B24030",31.000,"Professional and commercial equipm