e or associate's degree","8,937","+/-1,331","7,606","10,268"
"B25013",6.000,"Bachelor's degree or higher","7,921","+/-1,082","6,839","9,003"
"B25013",7.000,"Renter-occupied housing units:","13,051","+/-1,532","11,519","14,583"
"B25013",8.000,"Less than high school graduate","3,167","+/-939","2,228","4,106"
"B25013",9.000,"High school graduate (including equivalency)","3,751","+/-941","2,810","4,692"
"B25013",10.000,"Some college or associate's degree","3,800","+/-895","2,905","4,695"
"B25013",11.000,"Bachel