a sensory disability:","395","+/-459","0","854"
"B18011",3.000,"Enrolled in school:","0","+/-292","0","292"
"B18011",4.000,"Below college","0","+/-292","0","292"
"B18011",5.000,"College or graduate school","0","+/-292","0","292"
"B18011",6.000,"Not enrolled in school:","395","+/-459","0","854"
"B18011",7.000,"Less than high school graduate","259","+/-422","0","681"
"B18011",8.000,"High school graduate (includes equivalency)","136","+/-175","0","311"
"B18011",9.000,"Some college or associate's degree","0","+