"B24010H",10.000,"Architecture and engineering occupations","412","+/-326","86","738"
"B24010H",11.000,"Life, physical, and social science occupations","126","+/-153","0","279"
"B24010H",12.000,"Community and social services occupations","65","+/-109","0","174"
"B24010H",13.000,"Legal occupations","97","+/-111","0","208"
"B24010H",14.000,"Education, training, and library occupations","433","+/-278","155","711"
"B24010H",15.000,"Arts, design, entertainment, sports, and media occupations","286","+/-250","36",