9",5.000,"Bachelor's degree","13,706","+/-1,725","11,981","15,431"
"B07009",6.000,"Graduate or professional degree","4,181","+/-1,034","3,147","5,215"
"B07009",7.000,"Same house 1 year ago:","62,115","+/-3,903","58,212","66,018"
"B07009",8.000,"Less than high school graduate","10,248","+/-2,044","8,204","12,292"
"B07009",9.000,"High school graduate (includes equivalency)","15,818","+/-2,375","13,443","18,193"
"B07009",10.000,"Some college or associate's degree","20,726","+/-2,523","18,203","23,249"
"B07009"