27,650","32,056"
"B17003",15.000,"Less than high school graduate","4,656","+/-1,260","3,396","5,916"
"B17003",16.000,"High school graduate (includes equivalency)","7,503","+/-1,518","5,985","9,021"
"B17003",17.000,"Some college, associate's degree","10,658","+/-1,467","9,191","12,125"
"B17003",18.000,"Bachelor's degree or higher","7,036","+/-1,197","5,839","8,233"
"B17003",19.000,"Female:","34,757","+/-2,346","32,411","37,103"
"B17003",20.000,"Less than high school graduate","5,471","+/-1,175","4,296","6,64