","15,911","+/-1,486","14,425","17,397"
"B17015",27.000,"With Social Security income in the past 12 months:","4,187","+/-734","3,453","4,921"
"B17015",28.000,"With SSI and/or cash public assistance income in the past 12 months","398","+/-313","85","711"
"B17015",29.000,"Without SSI or cash public assistance income in the past 12 months","3,789","+/-750","3,039","4,539"
"B17015",30.000,"Without Social Security income in the past 12 months:","11,724","+/-1,444","10,280","13,168"
"B17015",31.000,"With SSI and/