/-837","3,187","4,861"
"B23007",36.000,"Employed or in Armed Forces","3,934","+/-823","3,111","4,757"
"B23007",37.000,"Unemployed","90","+/-103","0","193"
"B23007",38.000,"Wife not in labor force","1,318","+/-510","808","1,828"
"B23007",39.000,"Unemployed:","194","+/-158","36","352"
"B23007",40.000,"Wife in labor force:","146","+/-134","12","280"
"B23007",41.000,"Employed or in Armed Forces","146","+/-134","12","280"
"B23007",42.000,"Unemployed","0","+/-292","0","292"
"B23007",43.000,"Wife not in labor forc