ness workers:","N","N","N","N"
"B24060",80.000,"Management, professional, and related occupations:","N","N","N","N"
"B24060",81.000,"Management, business, and financial occupations:","N","N","N","N"
"B24060",82.000,"Management occupations","N","N","N","N"
"B24060",83.000,"Business and financial operations occupations","N","N","N","N"
"B24060",84.000,"Professional and related occupations:","N","N","N","N"
"B24060",85.000,"Computer and mathematical occupations","N","N","N","N"
"B24060",86.000,"Architecture an