rs only","N","N","N","N"
"B17010G",39.000,"Under 5 years and 5 to 17 years","N","N","N","N"
"B17010G",40.000,"5 to 17 years only","N","N","N","N"
"B17010G",41.000,"No related children under 18 years","N","N","N","N"
"B17010H",.,"POVERTY STATUS IN THE PAST 12 MONTHS OF FAMILIES BY FAMILY TYPE BY PRESENCE OF RELATED CHILDREN UNDER 18 YEARS BY AGE OF RELATED CHILDREN (WHITE ALONE, NOT HISPANIC OR LATINO HOUSEHOLDER)",,,,
"B17010H",.,"Universe:  Families with a householder who is White alone, not Hispanic or La