320","+/-280","40","600"
"B17015",12.000,"With Social Security income in the past 12 months:","0","+/-292","0","292"
"B17015",13.000,"With SSI and/or cash public assistance income in the past 12 months","0","+/-292","0","292"
"B17015",14.000,"Without SSI or cash public assistance income in the past 12 months","0","+/-292","0","292"
"B17015",15.000,"Without Social Security income in the past 12 months:","320","+/-280","40","600"
"B17015",16.000,"With SSI and/or cash public assistance income in the past 12 mo