 English less than ""very well""","597","+/-530","67","1,127"
"C16004",35.000,"Speak other Indo-European languages:","179","+/-138","41","317"
"C16004",36.000,"Speak English ""very well""","128","+/-118","10","246"
"C16004",37.000,"Speak English less than ""very well""","51","+/-86","0","137"
"C16004",38.000,"Speak Asian and Pacific Island languages:","3,444","+/-721","2,723","4,165"
"C16004",39.000,"Speak English ""very well""","783","+/-378","405","1,161"
"C16004",40.000,"Speak English less than ""very we