n married-couple family","15,223","+/-2,585","12,638","17,808"
"B09005",4.000,"In male householder, no wife present, family","1,643","+/-845","798","2,488"
"B09005",5.000,"In female householder, no husband present, family","7,248","+/-2,005","5,243","9,253"
"B09005",6.000,"In nonfamily households","47","+/-79","0","126"
"B09006",.,"RELATIONSHIP TO HOUSEHOLDER FOR CHILDREN UNDER 18 YEARS IN HOUSEHOLDS",,,,
"B09006",.,"Universe:  Population under 18 years in households (excluding householders, spouses, and un