past 12 months at or above the poverty level","45,119","+/-3,679","41,440","48,798"
"C18035",.,"GO-OUTSIDE-HOME DISABILITY BY SEX BY POVERTY STATUS FOR THE CIVILIAN NONINSTITUTIONALIZED POPULATION 16 YEARS AND OVER",,,,
"C18035",.,"Universe:  Civilian noninstitutionalized population 16 years and over for whom poverty status is determined",,,,
"C18035",1.000,"Total:","88,252","+/-4,823","83,429","93,075"
"C18035",2.000,"With a go-outside-home disability:","5,097","+/-1,186","3,911","6,283"
"C18035",3.000,"Ma