ance and insurance","N","N","N","N"
"B24050",42.000,"Real estate and rental and leasing","N","N","N","N"
"B24050",43.000,"Professional, scientific, and management, and administrative and waste management services:","N","N","N","N"
"B24050",44.000,"Professional, scientific, and technical services","N","N","N","N"
"B24050",45.000,"Management of companies and enterprises","N","N","N","N"
"B24050",46.000,"Administrative and support and waste management services","N","N","N","N"
"B24050",47.000,"Educational serv