 fighting and prevention, and other protective service workers including supervisors","N","N","N","N"
"B24060",21.000,"Law enforcement workers including supervisors","N","N","N","N"
"B24060",22.000,"Food preparation and serving related occupations","N","N","N","N"
"B24060",23.000,"Building and grounds cleaning and maintenance occupations","N","N","N","N"
"B24060",24.000,"Personal care and service occupations","N","N","N","N"
"B24060",25.000,"Sales and office occupations","N","N","N","N"
"B24060",26.000,"Sal