van - drove alone:","32,822","+/-2,794","30,028","35,616"
"C08124",10.000,"Management, professional, and related occupations","10,467","+/-1,472","8,995","11,939"
"C08124",11.000,"Service occupations","4,911","+/-1,053","3,858","5,964"
"C08124",12.000,"Sales and office occupations","9,187","+/-1,637","7,550","10,824"
"C08124",13.000,"Farming, fishing, and forestry occupations","230","+/-279","0","509"
"C08124",14.000,"Construction and extraction, and maintenance occupations","4,076","+/-1,105","2,971","5,18