and related occupations:","3,332","+/-689","2,643","4,021"
"B24010A",4.000,"Management, business, and financial occupations:","1,274","+/-417","857","1,691"
"B24010A",5.000,"Management occupations except farmers and farm managers","902","+/-399","503","1,301"
"B24010A",6.000,"Farmers and farm managers","0","+/-292","0","292"
"B24010A",7.000,"Business and financial operations occupations","372","+/-234","138","606"
"B24010A",8.000,"Professional and related occupations:","2,058","+/-607","1,451","2,665"
"B240