TY ITEMS FOR THE CIVILIAN NONINSTITUTIONALIZED POPULATION 5 YEARS AND OVER",,,,
"B99181",.,"Universe:  Civilian noninstitutionalized population 5 years and over",,,,
"B99181",1.000,"Total:","101,137","+/-5,587","95,550","106,724"
"B99181",2.000,"One or more disability items imputed","3,763","+/-1,253","2,510","5,016"
"B99181",3.000,"No disability items imputed","97,374","+/-5,728","91,646","103,102"
"B99182",.,"IMPUTATION OF SENSORY DISABILITY FOR THE CIVILIAN NONINSTITUTIONALIZED POPULATION 5 YEARS AND OVE