laska Native alone population in the United States",,,,
"B06004C",1.000,"Total:","N","N","N","N"
"B06004C",2.000,"Born in state of residence","N","N","N","N"
"B06004C",3.000,"Born in other state in the United States","N","N","N","N"
"B06004C",4.000,"Native; born outside the United States","N","N","N","N"
"B06004C",5.000,"Foreign born","N","N","N","N"
"B06004D",.,"PLACE OF BIRTH BY RACE (ASIAN ALONE) IN THE UNITED STATES",,,,
"B06004D",.,"Universe:  Asian alone population in the United States",,,,
"B06004D",