ale householder, no husband present:","4,735","+/-1,096","3,639","5,831"
"B17015",42.000,"With Social Security income in the past 12 months:","1,278","+/-482","796","1,760"
"B17015",43.000,"With SSI and/or cash public assistance income in the past 12 months","404","+/-333","71","737"
"B17015",44.000,"Without SSI or cash public assistance income in the past 12 months","874","+/-407","467","1,281"
"B17015",45.000,"Without Social Security income in the past 12 months:","3,457","+/-878","2,579","4,335"
"B17015"