 part-year in the past 12 months","2,365","+/-827","1,538","3,192"
"B17016",30.000,"Spouse did not work in the past 12 months","1,621","+/-753","868","2,374"
"B17016",31.000,"Householder worked part-time or part-year in the past 12 months:","3,738","+/-704","3,034","4,442"
"B17016",32.000,"Spouse worked full-time, year-round in the past 12 months","1,163","+/-541","622","1,704"
"B17016",33.000,"Spouse worked part-time or part-year in the past 12 months","1,226","+/-382","844","1,608"
"B17016",34.000,"Spouse