ment occupations except farmers and farm managers","N","N","N","N"
"B24010B",37.000,"Farmers and farm managers","N","N","N","N"
"B24010B",38.000,"Business and financial operations occupations","N","N","N","N"
"B24010B",39.000,"Professional and related occupations:","N","N","N","N"
"B24010B",40.000,"Computer and mathematical occupations","N","N","N","N"
"B24010B",41.000,"Architecture and engineering occupations","N","N","N","N"
"B24010B",42.000,"Life, physical, and social science occupations","N","N","N","N"