rt and waste management services","40,616","+/-16,785","23,831","57,401"
"B24042",20.000,"Educational services, and health care and social assistance:","45,925","+/-13,250","32,675","59,175"
"B24042",21.000,"Educational services","50,736","+/-5,415","45,321","56,151"
"B24042",22.000,"Health care and social assistance","33,817","+/-14,648","19,169","48,465"
"B24042",23.000,"Arts, entertainment, and recreation, and accommodation and food services:","40,104","+/-11,673","28,431","51,777"
"B24042",24.000,"Arts,