"3,572"
"B08137",11.000,"Householder lived in owner-occupied housing units","2,406","+/-643","1,763","3,049"
"B08137",12.000,"Householder lived in renter-occupied housing units","466","+/-329","137","795"
"B08137",13.000,"Walked:","819","+/-487","332","1,306"
"B08137",14.000,"Householder lived in owner-occupied housing units","426","+/-330","96","756"
"B08137",15.000,"Householder lived in renter-occupied housing units","393","+/-358","35","751"
"B08137",16.000,"Taxicab, motorcycle, bicycle, or other means:"