TION-ADJUSTED DOLLARS)",,,,
"B19113",.,"Universe:  Families",,,,
"B19113",1.000,"Median family income in the past 12 months (in 2007 inflation-adjusted dollars)","70,277","+/-6,731","63,546","77,008"
"B19113A",.,"MEDIAN FAMILY INCOME IN THE PAST 12 MONTHS (IN 2007 INFLATION-ADJUSTED DOLLARS) (WHITE ALONE HOUSEHOLDER)",,,,
"B19113A",.,"Universe:  Families with a householder who is White alone",,,,
"B19113A",1.000,"Median family income in the past 12 months (in 2007 inflation-adjusted dollars)","76,258","+/-1