050",6.000,"Retail trade","5,371","+/-1,406","3,965","6,777"
"C24050",7.000,"Transportation and warehousing, and utilities","3,867","+/-1,203","2,664","5,070"
"C24050",8.000,"Information","1,025","+/-487","538","1,512"
"C24050",9.000,"Finance and insurance, and real estate and rental and leasing","4,376","+/-957","3,419","5,333"
"C24050",10.000,"Professional, scientific, and management, and administrative and waste management services","4,824","+/-1,118","3,706","5,942"
"C24050",11.000,"Educational services