ool graduate","114","+/-142","0","256"
"B13014",5.000,"High school graduate (includes equivalency)","92","+/-112","0","204"
"B13014",6.000,"Some college or associate's degree","169","+/-164","5","333"
"B13014",7.000,"Bachelor's degree","179","+/-210","0","389"
"B13014",8.000,"Graduate or professional degree","95","+/-111","0","206"
"B13014",9.000,"Unmarried (never married, widowed and divorced):","355","+/-294","61","649"
"B13014",10.000,"Less than high school graduate","123","+/-206","0","329"
"B13014",11.