227","+/-269","0","496"
"B13002B",5.000,"Women who did not have a birth in the past 12 months:","6,575","+/-1,282","5,293","7,857"
"B13002B",6.000,"Now married (including separated and spouse absent)","1,670","+/-634","1,036","2,304"
"B13002B",7.000,"Unmarried (never married, widowed and divorced)","4,905","+/-1,116","3,789","6,021"
"B13002C",.,"WOMEN 15 TO 50 YEARS WHO HAD A BIRTH IN THE PAST 12 MONTHS BY MARITAL STATUS (AMERICAN INDIAN AND ALASKA NATIVE ALONE)",,,,
"B13002C",.,"Universe:  American Indian 