related occupations","663","+/-359","304","1,022"
"C24010I",11.000,"Service occupations","1,506","+/-785","721","2,291"
"C24010I",12.000,"Sales and office occupations","1,599","+/-632","967","2,231"
"C24010I",13.000,"Farming, fishing, and forestry occupations","0","+/-292","0","292"
"C24010I",14.000,"Construction, extraction, maintenance, and repair occupations","0","+/-292","0","292"
"C24010I",15.000,"Production, transportation, and material moving occupations","206","+/-334","0","540"
"C24020",.,"SEX BY O