ITH OWN GRANDCHILDREN UNDER 18 YEARS BY RESPONSIBILITY FOR OWN GRANDCHILDREN BY PRESENCE OF PARENT OF GRANDCHILDREN AND AGE OF GRANDPARENT",,,,
"B10051",.,"Universe:  Grandparents living with own grandchildren under 18 years",,,,
"B10051",1.000,"Total:","3,845","+/-1,169","2,676","5,014"
"B10051",2.000,"Grandparent responsible for own grandchildren under 18 years:","1,263","+/-682","581","1,945"
"B10051",3.000,"Householder or spouse with no parent of grandchildren present:","1,118","+/-671","447","1,789"
"B