1.000,"Male:","40,932","+/-2,789","38,143","43,721"
"B24082",2.000,"Private for-profit wage and salary workers:","39,157","+/-5,778","33,379","44,935"
"B24082",3.000,"Employee of private company workers","39,200","+/-5,779","33,421","44,979"
"B24082",4.000,"Self-employed in own incorporated business workers","24,869","+/-85,090","-60,221","109,959"
"B24082",5.000,"Private not-for-profit wage and salary workers","45,444","+/-13,861","31,583","59,305"
"B24082",6.000,"Local government workers","50,928","+/-10,