nd spouse absent)","N","N","N","N"
"B13002F",4.000,"Unmarried (never married, widowed and divorced)","N","N","N","N"
"B13002F",5.000,"Women who did not have a birth in the past 12 months:","N","N","N","N"
"B13002F",6.000,"Now married (including separated and spouse absent)","N","N","N","N"
"B13002F",7.000,"Unmarried (never married, widowed and divorced)","N","N","N","N"
"B13002G",.,"WOMEN 15 TO 50 YEARS WHO HAD A BIRTH IN THE PAST 12 MONTHS BY MARITAL STATUS (TWO OR MORE RACES)",,,,
"B13002G",.,"Universe:  