
"B17010H",41.000,"No related children under 18 years","N","N","N","N"
"B17010I",.,"POVERTY STATUS IN THE PAST 12 MONTHS OF FAMILIES BY FAMILY TYPE BY PRESENCE OF RELATED CHILDREN UNDER 18 YEARS BY AGE OF RELATED CHILDREN (HISPANIC OR LATINO)",,,,
"B17010I",.,"Universe:  Families with a householder who is Hispanic or Latino",,,,
"B17010I",1.000,"Total:","N","N","N","N"
"B17010I",2.000,"Income in the past 12 months below poverty level:","N","N","N","N"
"B17010I",3.000,"Married-couple family:","N","N","N","N"