10",11.000,"No disability:","22,907","+/-2,679","20,228","25,586"
"B18010",12.000,"Enrolled in school:","9,006","+/-1,775","7,231","10,781"
"B18010",13.000,"Below college","898","+/-449","449","1,347"
"B18010",14.000,"College or graduate school","8,108","+/-1,638","6,470","9,746"
"B18010",15.000,"Not enrolled in school:","13,901","+/-2,215","11,686","16,116"
"B18010",16.000,"Less than high school graduate","2,857","+/-1,039","1,818","3,896"
"B18010",17.000,"High school graduate (includes equivalency)","4,45