"N","N","N","N"
"B24020",193.000,"Food and beverage serving workers except waiters/waitresses","N","N","N","N"
"B24020",194.000,"Other food preparation and serving workers including supervisors","N","N","N","N"
"B24020",195.000,"Building and grounds cleaning and maintenance occupations","N","N","N","N"
"B24020",196.000,"Personal care and service occupations:","N","N","N","N"
"B24020",197.000,"Personal appearance workers","N","N","N","N"
"B24020",198.000,"Transportation, tourism, and lodging attendants","N",