,"+/-1,515","7,806","10,836"
"C25117",9.000,"Electricity","3,560","+/-872","2,688","4,432"
"C25117",10.000,"Fuel oil, kerosene, etc.","51","+/-87","0","138"
"C25117",11.000,"All other fuels and no fuel used","119","+/-149","0","268"
"C25121",.,"HOUSEHOLD INCOME IN THE PAST 12 MONTHS (IN 2007 INFLATION-ADJUSTED DOLLARS) BY VALUE",,,,
"C25121",.,"Universe:  Owner-occupied housing units",,,,
"C25121",1.000,"Total:","N","N","N","N"
"C25121",1.700,"Household income the past 12 months (in 2007 inflation-adjusted 