5006",7.000,"Householder who is Some other race alone","2,937","+/-897","2,040","3,834"
"B25006",8.000,"Householder who is Two or more races:","1,386","+/-567","819","1,953"
"B25006",9.000,"Householder who is Two races including Some other race","394","+/-288","106","682"
"B25006",10.000,"Householder who is Two races excluding Some other race, and three or more races","992","+/-486","506","1,478"
"B25007",.,"TENURE BY AGE OF HOUSEHOLDER",,,,
"B25007",.,"Universe:  Occupied housing units",,,,
"B25007",1.000,