r","54,689","+/-2,965","51,724","57,654"
"C15002I",.,"SEX BY EDUCATIONAL ATTAINMENT FOR THE POPULATION 25 YEARS AND OVER (HISPANIC OR LATINO)",,,,
"C15002I",.,"Universe:  Hispanic or Latino population 25 years and over",,,,
"C15002I",1.000,"Total:","103,326","+/-4,637","98,689","107,963"
"C15002I",2.000,"Male:","51,014","+/-3,080","47,934","54,094"
"C15002I",3.000,"Less than high school diploma","13,301","+/-2,614","10,687","15,915"
"C15002I",4.000,"High school graduate (includes equivalency)","17,949","+/-