,"0","400"
"B13002G",5.000,"Women who did not have a birth in the past 12 months:","2,288","+/-806","1,482","3,094"
"B13002G",6.000,"Now married (including separated and spouse absent)","812","+/-425","387","1,237"
"B13002G",7.000,"Unmarried (never married, widowed and divorced)","1,476","+/-679","797","2,155"
"B13002H",.,"WOMEN 15 TO 50 YEARS WHO HAD A BIRTH IN THE PAST 12 MONTHS BY MARITAL STATUS (WHITE ALONE, NOT HISPANIC OR LATINO)",,,,
"B13002H",.,"Universe:  White alone, not Hispanic or Latino women 1