upations","245","+/-165","80","410"
"C24010F",14.000,"Construction, extraction, maintenance, and repair occupations","57","+/-97","0","154"
"C24010F",15.000,"Production, transportation, and material moving occupations","1,180","+/-597","583","1,777"
"C24010G",.,"SEX BY OCCUPATION FOR THE CIVILIAN EMPLOYED POPULATION 16 YEARS AND OVER (TWO OR MORE RACES)",,,,
"C24010G",.,"Universe:  Civilian employed Two or more races population 16 years and over",,,,
"C24010G",1.000,"Total:","5,071","+/-1,148","3,923","6,21