occupations:","4,716","+/-1,422","3,294","6,138"
"B24020",197.000,"Personal appearance workers","1,138","+/-579","559","1,717"
"B24020",198.000,"Transportation, tourism, and lodging attendants","103","+/-126","0","229"
"B24020",199.000,"Child care workers","1,227","+/-866","361","2,093"
"B24020",200.000,"Supervisors and other personal care and service workers except personal appearance, transportation, and child care workers","2,248","+/-860","1,388","3,108"
"B24020",201.000,"Sales and office occupations:",