above the poverty level","314,333","+/-8,628","305,705","322,961"
"C18034",.,"SELF-CARE DISABILITY BY SEX BY POVERTY STATUS FOR THE CIVILIAN NONINSTITUTIONALIZED POPULATION 5 YEARS AND OVER",,,,
"C18034",.,"Universe:  Civilian noninstitutionalized population 16 years and over for whom poverty status is determined",,,,
"C18034",1.000,"Total:","721,472","+/-15,527","705,945","736,999"
"C18034",2.000,"With a self-care disability:","20,151","+/-2,687","17,464","22,838"
"C18034",3.000,"Male:","8,348","+/-1,365",