B08124",8.000,"Armed forces","373","+/-296","77","669"
"B08124",9.000,"Car, truck, or van - drove alone:","307,676","+/-9,272","298,404","316,948"
"B08124",10.000,"Management, professional, and related occupations","113,871","+/-5,209","108,662","119,080"
"B08124",11.000,"Service occupations","48,427","+/-4,224","44,203","52,651"
"B08124",12.000,"Sales and office occupations","91,364","+/-5,670","85,694","97,034"
"B08124",13.000,"Farming, fishing, and forestry occupations","785","+/-467","318","1,252"
"B081