87","+/-1,299","3,888","6,486"
"C24020",24.000,"Building and grounds cleaning and maintenance occupations","5,826","+/-1,445","4,381","7,271"
"C24020",25.000,"Personal care and service occupations","1,873","+/-801","1,072","2,674"
"C24020",26.000,"Sales and office occupations:","32,281","+/-3,281","29,000","35,562"
"C24020",27.000,"Sales and related occupations","20,439","+/-2,271","18,168","22,710"
"C24020",28.000,"Office and administrative support occupations","11,842","+/-2,217","9,625","14,059"
"C24020"