"B10051D",4.000,"60 years and over","N","N","N","N"
"B10051D",5.000,"Grandparent not responsible for own grandchildren under 18 years:","N","N","N","N"
"B10051D",6.000,"30 to 59 years","N","N","N","N"
"B10051D",7.000,"60 years and over","N","N","N","N"
"B10051E",.,"GRANDPARENTS LIVING WITH OWN GRANDCHILDREN UNDER 18 YEARS BY RESPONSIBILITY FOR OWN GRANDCHILDREN AND AGE OF GRANDPARENT (NATIVE HAWAIIAN AND OTHER PACIFIC ISLANDER ALONE)",,,,
"B10051E",.,"Universe:  Grandparents (Native Hawaiian and Other Pacif