,353","2,639"
"C24010D",11.000,"Service occupations","1,361","+/-572","789","1,933"
"C24010D",12.000,"Sales and office occupations","2,562","+/-705","1,857","3,267"
"C24010D",13.000,"Farming, fishing, and forestry occupations","0","+/-303","0","303"
"C24010D",14.000,"Construction, extraction, maintenance, and repair occupations","0","+/-303","0","303"
"C24010D",15.000,"Production, transportation, and material moving occupations","212","+/-212","0","424"
"C24010E",.,"SEX BY OCCUPATION FOR THE CIVILIAN EMPLOY