 administrative support occupations","46,650","+/-4,232","42,418","50,882"
"C24060",54.000,"Farming, fishing, and forestry occupations","1,580","+/-744","836","2,324"
"C24060",55.000,"Construction extraction, maintenance, and repair occupations:","33,165","+/-4,311","28,854","37,476"
"C24060",56.000,"Construction and extraction occupations","24,488","+/-3,988","20,500","28,476"
"C24060",57.000,"Installation, maintenance, and repair occupations","8,677","+/-1,941","6,736","10,618"
"C24060",58.000,"Production