/-303","0","303"
"C24060",98.000,"Architecture and engineering occupations","0","+/-303","0","303"
"C24060",99.000,"Life, physical, and social science occupations","285","+/-324","0","609"
"C24060",100.000,"Community and social services occupations","2,091","+/-725","1,366","2,816"
"C24060",101.000,"Legal occupations","118","+/-136","0","254"
"C24060",102.000,"Education, training, and library occupations","2,642","+/-798","1,844","3,440"
"C24060",103.000,"Arts, design, entertainment, sports, and media occup