o races:","14,850","+/-2,579","12,271","17,429"
"C02003",13.000,"White; Black or African American","3,152","+/-1,397","1,755","4,549"
"C02003",14.000,"White; American Indian and Alaska Native","3,286","+/-1,122","2,164","4,408"
"C02003",15.000,"White; Asian","1,815","+/-728","1,087","2,543"
"C02003",16.000,"Black or African American; American Indian and Alaska Native","216","+/-269","0","485"
"C02003",17.000,"All other two race combinations","6,381","+/-1,928","4,453","8,309"
"C02003",18.000,"Population of 