"2,273","4,527"
"C24060",154.000,"Management occupations","2,304","+/-950","1,354","3,254"
"C24060",155.000,"Business and financial operations occupations","1,096","+/-567","529","1,663"
"C24060",156.000,"Professional and related occupations:","3,592","+/-938","2,654","4,530"
"C24060",157.000,"Computer and mathematical occupations","404","+/-381","23","785"
"C24060",158.000,"Architecture and engineering occupations","195","+/-160","35","355"
"C24060",159.000,"Life, physical, and social science occupations",