+/-786","885","2,457"
"B24060",162.000,"Professional and related occupations:","17,139","+/-2,217","14,922","19,356"
"B24060",163.000,"Computer and mathematical occupations","904","+/-495","409","1,399"
"B24060",164.000,"Architecture and engineering occupations","459","+/-297","162","756"
"B24060",165.000,"Life, physical, and social science occupations","491","+/-333","158","824"
"B24060",166.000,"Community and social services occupations","1,586","+/-665","921","2,251"
"B24060",167.000,"Legal occupations",