ce and insurance","9,240","+/-1,709","7,531","10,949"
"C24030",43.000,"Real estate and rental and leasing","5,422","+/-1,320","4,102","6,742"
"C24030",44.000,"Professional, scientific, and management, and administrative and waste management services:","22,559","+/-2,425","20,134","24,984"
"C24030",45.000,"Professional, scientific, and technical services","12,278","+/-1,580","10,698","13,858"
"C24030",46.000,"Management of companies and enterprises","0","+/-303","0","303"
"C24030",47.000,"Administrative and 