1",30.000,"Less than high school graduate","4,660","+/-1,171","3,489","5,831"
"C15001",31.000,"High school graduate (includes equivalency)","11,784","+/-1,848","9,936","13,632"
"C15001",32.000,"Some college or associate's degree","13,624","+/-2,229","11,395","15,853"
"C15001",33.000,"Bachelor's degree or higher","4,400","+/-1,051","3,349","5,451"
"C15001",34.000,"25 to 34 years:","58,399","+/-2,821","55,578","61,220"
"C15001",35.000,"Less than high school graduate","4,899","+/-1,489","3,410","6,388"
"C15001