,962"
"B24010",206.000,"Other sales and related workers including supervisors","9,357","+/-1,798","7,559","11,155"
"B24010",207.000,"Office and administrative support occupations:","41,319","+/-4,132","37,187","45,451"
"B24010",208.000,"Communications equipment operators","491","+/-384","107","875"
"B24010",209.000,"Financial clerks except bookkeeping, accounting, and auditing clerks","2,474","+/-899","1,575","3,373"
"B24010",210.000,"Bookkeeping, accounting, and auditing clerks","4,063","+/-862","3,201","4