","+/-2,598","27,684","32,880"
"B24010A",40.000,"Computer and mathematical occupations","1,227","+/-425","802","1,652"
"B24010A",41.000,"Architecture and engineering occupations","518","+/-412","106","930"
"B24010A",42.000,"Life, physical, and social science occupations","1,534","+/-549","985","2,083"
"B24010A",43.000,"Community and social services occupations","1,214","+/-501","713","1,715"
"B24010A",44.000,"Legal occupations","2,166","+/-730","1,436","2,896"
"B24010A",45.000,"Education, training, and libr