8",.,"Universe:  Owner-occupied housing units",,,,
"B25088",0.700,"Median selected monthly owner costs (dollars) --",,,,
"B25088",1.000,"Total:","1,258","+/-42","1,216","1,300"
"B25088",2.000,"Housing units with a mortgage (dollars)","1,589","+/-39","1,550","1,628"
"B25088",3.000,"Housing units without a mortgage (dollars)","400","+/-20","380","420"
"B25089",.,"AGGREGATE SELECTED MONTHLY OWNER COSTS (DOLLARS) BY MORTGAGE STATUS",,,,
"B25089",.,"Universe:  Owner-occupied housing units",,,,
"B25089",1.000,"Ag