,550"
"B21003",4.000,"High school graduate (includes equivalency)","19,803","+/-2,387","17,416","22,190"
"B21003",5.000,"Some college or associate's degree","20,490","+/-2,277","18,213","22,767"
"B21003",6.000,"Bachelor's degree or higher","16,470","+/-1,917","14,553","18,387"
"B21003",7.000,"Nonveteran:","467,036","+/-9,722","457,314","476,758"
"B21003",8.000,"Less than high school graduate","59,478","+/-4,989","54,489","64,467"
"B21003",9.000,"High school graduate (includes equivalency)","139,613","+/-7,0