lesalers","146","+/-148","0","294"
"B24030",38.000,"Paper and paper product merchant wholesalers","0","+/-303","0","303"
"B24030",39.000,"Drugs and druggists' sundries, and chemical and allied products merchant wholesalers","276","+/-251","25","527"
"B24030",40.000,"Apparel, piece goods, and notions merchant wholesalers","141","+/-201","0","342"
"B24030",41.000,"Grocery and related product merchant wholesalers","1,872","+/-641","1,231","2,513"
"B24030",42.000,"Farm product raw material merchant wholesalers"