"500","+/-293","207","793"
"B20005I",.,"SEX BY WORK EXPERIENCE IN THE PAST 12 MONTHS BY EARNINGS IN THE PAST 12 MONTHS (IN 2007 INFLATION-ADJUSTED DOLLARS) FOR THE POPULATION 16 YEARS AND OVER (HISPANIC OR LATINO)",,,,
"B20005I",.,"Universe:  Hispanic or Latino population 16 years and over",,,,
"B20005I",1.000,"Total:","126,156","+/-5,840","120,316","131,996"
"B20005I",2.000,"Male:","63,371","+/-3,849","59,522","67,220"
"B20005I",3.000,"Worked full-time, year-round in the past 12 months:","37,340","+/-3,378