4.000,"Finance and insurance","42,413","+/-4,591","37,822","47,004"
"B24031",15.000,"Real estate and rental and leasing","33,643","+/-6,472","27,171","40,115"
"B24031",16.000,"Professional, scientific, and management, and administrative and waste management services:","39,552","+/-3,195","36,357","42,747"
"B24031",17.000,"Professional, scientific, and technical services","46,597","+/-3,936","42,661","50,533"
"B24031",18.000,"Management of companies and enterprises","91,277","+/-75,502","15,775","166,779"
"B