,"253","+/-421","0","674"
"B24030",43.000,"Petroleum and petroleum products merchant wholesalers","132","+/-160","0","292"
"B24030",44.000,"Alcoholic beverage merchant wholesalers","137","+/-163","0","300"
"B24030",45.000,"Farm supplies merchant wholesalers","55","+/-94","0","149"
"B24030",46.000,"Miscellaneous nondurable goods merchant wholesalers","546","+/-456","90","1,002"
"B24030",47.000,"Wholesale electronic markets and agents and brokers","184","+/-173","11","357"
"B24030",48.000,"Retail trade:","24,