al, and social science occupations:","1,786","+/-588","1,198","2,374"
"B24010",152.000,"Life and physical scientists","599","+/-378","221","977"
"B24010",153.000,"Social scientists and related workers","957","+/-515","442","1,472"
"B24010",154.000,"Life, physical, and social science technicians","230","+/-195","35","425"
"B24010",155.000,"Community and social services occupations:","2,210","+/-682","1,528","2,892"
"B24010",156.000,"Counselors, social workers, and other community and social service specialis