onstruction materials merchant wholesalers","120","+/-142","0","262"
"B24030",136.000,"Professional and commercial equipment and supplies merchant wholesalers","223","+/-184","39","407"
"B24030",137.000,"Metal and mineral, except petroleum, merchant wholesalers","0","+/-303","0","303"
"B24030",138.000,"Electrical and electronic goods merchant wholesalers","330","+/-313","17","643"
"B24030",139.000,"Hardware, plumbing and heating equipment and supplies merchant wholesalers","64","+/-104","0","168"
"B24030",1