e management services:","13,082","+/-1,962","11,120","15,044"
"B24050",98.000,"Professional, scientific, and technical services","5,968","+/-1,245","4,723","7,213"
"B24050",99.000,"Management of companies and enterprises","0","+/-303","0","303"
"B24050",100.000,"Administrative and support and waste management services","7,114","+/-1,503","5,611","8,617"
"B24050",101.000,"Educational services, and health care and social assistance:","7,905","+/-1,427","6,478","9,332"
"B24050",102.000,"Educational services","