,29.000,"Construction, extraction, maintenance, and repair occupations:","27,686","+/-2,289","25,397","29,975"
"B24012",30.000,"Construction and extraction occupations","26,391","+/-2,651","23,740","29,042"
"B24012",31.000,"Installation, maintenance, and repair occupations","34,664","+/-6,308","28,356","40,972"
"B24012",32.000,"Production, transportation, and material moving occupations:","27,510","+/-3,424","24,086","30,934"
"B24012",33.000,"Production occupations","30,447","+/-2,537","27,910","32,984"
"B2