tatistical Area:","2,985","+/-912","2,073","3,897"
"B08016",7.000,"Worked in a principal city","1,906","+/-738","1,168","2,644"
"B08016",8.000,"Worked outside any principal city","1,079","+/-604","475","1,683"
"B08016",9.000,"Worked in a Micropolitan Statistical Area:","534","+/-490","44","1,024"
"B08016",10.000,"Worked in a principal city","39","+/-64","0","103"
"B08016",11.000,"Worked outside any principal city","495","+/-487","8","982"
"B08016",12.000,"Worked outside any Metropolitan or Micropolitan Stat