professional, and related occupations:","N","N","N","N"
"B24010E",4.000,"Management, business, and financial occupations:","N","N","N","N"
"B24010E",5.000,"Management occupations except farmers and farm managers","N","N","N","N"
"B24010E",6.000,"Farmers and farm managers","N","N","N","N"
"B24010E",7.000,"Business and financial operations occupations","N","N","N","N"
"B24010E",8.000,"Professional and related occupations:","N","N","N","N"
"B24010E",9.000,"Computer and mathematical occupations","N","N","N","N"