BILITY FOR OWN GRANDCHILDREN BY LENGTH OF TIME RESPONSIBLE FOR OWN GRANDCHILDREN FOR THE POPULATION 30 YEARS AND OVER",,,,
"B10050",.,"Universe:  Population 30 years and over",,,,
"B10050",1.000,"Total:","468,880","+/-8,923","459,957","477,803"
"B10050",2.000,"Living with own grandchildren under 18 years:","19,861","+/-2,699","17,162","22,560"
"B10050",3.000,"Grandparent responsible for own grandchildren under 18 years:","7,424","+/-1,785","5,639","9,209"
"B10050",4.000,"Grandparent responsible less than 6 