8.000,"Graduate or professional degree","31,592","+/-2,641","28,951","34,233"
"B06009",19.000,"Native; born outside the United States:","41,671","+/-3,793","37,878","45,464"
"B06009",20.000,"Less than high school graduate","8,500","+/-1,635","6,865","10,135"
"B06009",21.000,"High school graduate (includes equivalency)","13,050","+/-2,361","10,689","15,411"
"B06009",22.000,"Some college or associate's degree","11,442","+/-2,053","9,389","13,495"
"B06009",23.000,"Bachelor's degree","6,892","+/-1,688","5,204",