ning and maintenance occupations","6,747","+/-1,694","5,053","8,441"
"B24010",196.000,"Personal care and service occupations:","9,399","+/-1,961","7,438","11,360"
"B24010",197.000,"Personal appearance workers","3,136","+/-1,141","1,995","4,277"
"B24010",198.000,"Transportation, tourism, and lodging attendants","357","+/-263","94","620"
"B24010",199.000,"Child care workers","2,038","+/-875","1,163","2,913"
"B24010",200.000,"Supervisors and other personal care and service workers except personal appearance, t