 with a householder who is Some other race alone",,,,
"B22005F",1.000,"Total:","18,234","+/-2,794","15,440","21,028"
"B22005F",2.000,"Household received Food Stamps in the past 12 months","2,371","+/-801","1,570","3,172"
"B22005F",3.000,"Household did not receive Food Stamps in the past 12 months","15,863","+/-2,602","13,261","18,465"
"B22005G",.,"RECEIPT OF FOOD STAMPS IN THE PAST 12 MONTHS BY RACE OF HOUSEHOLDER (TWO OR MORE RACES)",,,,
"B22005G",.,"Universe:  Households with a householder who is Two or m