943","31,671","39,557"
"B08128",22.000,"Private for-profit wage and salary workers:","28,505","+/-3,481","25,024","31,986"
"B08128",23.000,"Employee of private company workers","25,839","+/-3,204","22,635","29,043"
"B08128",24.000,"Self-employed in own incorporated business workers","2,666","+/-868","1,798","3,534"
"B08128",25.000,"Private not-for-profit wage and salary workers","1,647","+/-598","1,049","2,245"
"B08128",26.000,"Local government workers","1,874","+/-758","1,116","2,632"
"B08128",27.000,"Stat