313","+/-730","583","2,043"
"C17010G",.,"POVERTY STATUS IN THE PAST 12 MONTHS OF FAMILIES BY FAMILY TYPE BY PRESENCE OF RELATED CHILDREN UNDER 18 YEARS (TWO OR MORE RACES HOUSEHOLDER)",,,,
"C17010G",.,"Universe:  Families with a householder who is Two or more races",,,,
"C17010G",1.000,"Total:","N","N","N","N"
"C17010G",2.000,"Income in the past 12 months below poverty level:","N","N","N","N"
"C17010G",3.000,"Married-couple family:","N","N","N","N"
"C17010G",4.000,"With related children under 18 years","N",