4","+/-2,660","23,114","28,434"
"C24010",6.000,"Business and financial operations occupations","8,369","+/-1,610","6,759","9,979"
"C24010",7.000,"Professional and related occupations:","34,164","+/-3,072","31,092","37,236"
"C24010",8.000,"Computer and mathematical occupations","6,048","+/-1,339","4,709","7,387"
"C24010",9.000,"Architecture and engineering occupations","7,120","+/-1,239","5,881","8,359"
"C24010",10.000,"Life, physical, and social science occupations","1,060","+/-479","581","1,539"
"C24010",1