"22,317","+/-3,146","19,171","25,463"
"B24012",24.000,"Personal care and service occupations","18,158","+/-3,237","14,921","21,395"
"B24012",25.000,"Sales and office occupations:","33,684","+/-4,427","29,257","38,111"
"B24012",26.000,"Sales and related occupations","41,269","+/-6,169","35,100","47,438"
"B24012",27.000,"Office and administrative support occupations","27,393","+/-3,995","23,398","31,388"
"B24012",28.000,"Farming, fishing, and forestry occupations","13,708","+/-6,900","6,808","20,608"
"B24012"