l city","54,630","+/-6,880","47,750","61,510"
"B07201",6.000,"Moved from remainder of Metropolitan Statistical Area","42,113","+/-5,707","36,406","47,820"
"B07201",7.000,"Different Metropolitan Statistical Area:","31,205","+/-4,825","26,380","36,030"
"B07201",8.000,"Moved from principal city","19,056","+/-3,675","15,381","22,731"
"B07201",9.000,"Moved from remainder of Metropolitan Statistical Area","12,149","+/-2,670","9,479","14,819"
"B07201",10.000,"Micropolitan Statistical Area:","3,534","+/-1,836","1,6