ions","139","+/-134","5","273"
"B24010H",27.000,"Construction, extraction, maintenance, and repair occupations:","20,545","+/-2,567","17,978","23,112"
"B24010H",28.000,"Construction and extraction occupations","14,319","+/-2,231","12,088","16,550"
"B24010H",29.000,"Installation, maintenance, and repair occupations","6,226","+/-1,504","4,722","7,730"
"B24010H",30.000,"Production, transportation, and material moving occupations:","15,684","+/-2,345","13,339","18,029"
"B24010H",31.000,"Production occupations",