B13012",8.000,"Not in labor force","1,249","+/-685","564","1,934"
"B13012",9.000,"Women who did not have a birth in the past 12 months:","188,276","+/-5,521","182,755","193,797"
"B13012",10.000,"Now married (including separated and spouse absent):","91,852","+/-4,564","87,288","96,416"
"B13012",11.000,"In labor force","65,375","+/-3,715","61,660","69,090"
"B13012",12.000,"Not in labor force","26,477","+/-2,915","23,562","29,392"
"B13012",13.000,"Unmarried (never married, widowed and divorced):","96,424","+/