-2,320","14,918","19,558"
"B08124",50.000,"Management, professional, and related occupations","7,916","+/-1,636","6,280","9,552"
"B08124",51.000,"Service occupations","1,297","+/-664","633","1,961"
"B08124",52.000,"Sales and office occupations","4,466","+/-1,037","3,429","5,503"
"B08124",53.000,"Farming, fishing, and forestry occupations","331","+/-384","0","715"
"B08124",54.000,"Construction and extraction, and maintenance occupations","2,068","+/-1,131","937","3,199"
"B08124",55.000,"Production, transport