0","23,254"
"B25068",37.000,"No cash rent","1,534","+/-734","800","2,268"
"B25069",.,"INCLUSION OF UTILITIES IN RENT",,,,
"B25069",.,"Universe:  Renter-occupied housing units",,,,
"B25069",1.000,"Total:","101,186","+/-5,442","95,744","106,628"
"B25069",2.000,"Pay extra for one or more utilities","94,609","+/-5,271","89,338","99,880"
"B25069",3.000,"No extra payment for any utilities","6,577","+/-1,449","5,128","8,026"
"B25070",.,"GROSS RENT AS A PERCENTAGE OF HOUSEHOLD INCOME IN THE PAST 12 MONTHS",,,,
"B25