,"N","N","N","N"
"C17010C",4.000,"With related children under 18 years","N","N","N","N"
"C17010C",5.000,"Other family:","N","N","N","N"
"C17010C",6.000,"Male householder, no wife present","N","N","N","N"
"C17010C",7.000,"With related children under 18 years","N","N","N","N"
"C17010C",8.000,"Female householder, no husband present","N","N","N","N"
"C17010C",9.000,"With related children under 18 years","N","N","N","N"
"C17010C",10.000,"Income in the past 12 months at or above poverty level:","N","N","N","N"
"C