ve service workers including supervisors","1,802","+/-826","976","2,628"
"C24010",59.000,"Law enforcement workers including supervisors","1,054","+/-556","498","1,610"
"C24010",60.000,"Food preparation and serving related occupations","11,802","+/-2,066","9,736","13,868"
"C24010",61.000,"Building and grounds cleaning and maintenance occupations","6,747","+/-1,694","5,053","8,441"
"C24010",62.000,"Personal care and service occupations","9,399","+/-1,961","7,438","11,360"
"C24010",63.000,"Sales and office occ