700","1,507","2,907"
"B17016",16.000,"Other family:","10,302","+/-1,977","8,325","12,279"
"B17016",17.000,"Male householder, no wife present:","1,107","+/-501","606","1,608"
"B17016",18.000,"Householder worked full-time, year-round in the past 12 months","334","+/-379","0","713"
"B17016",19.000,"Householder worked part-time or part-year in the past 12 months","472","+/-404","68","876"
"B17016",20.000,"Householder did not work in the past 12 months","301","+/-277","24","578"
"B17016",21.000,"Female household