any workers:","285,941","+/-9,369","276,572","295,310"
"C24060",32.000,"Management, professional, and related occupations:","82,053","+/-4,357","77,696","86,410"
"C24060",33.000,"Management, business, and financial occupations:","42,068","+/-3,497","38,571","45,565"
"C24060",34.000,"Management occupations","29,138","+/-2,738","26,400","31,876"
"C24060",35.000,"Business and financial operations occupations","12,930","+/-1,807","11,123","14,737"
"C24060",36.000,"Professional and related occupations:","39,985"