,279","21,631"
"B24032",51.000,"Arts, entertainment, and recreation","21,883","+/-6,911","14,972","28,794"
"B24032",52.000,"Accommodation and food services","16,440","+/-2,092","14,348","18,532"
"B24032",53.000,"Other services except public administration","19,233","+/-3,710","15,523","22,943"
"B24032",54.000,"Public administration","33,891","+/-4,938","28,953","38,829"
"B24040",.,"SEX BY INDUSTRY FOR THE FULL-TIME, YEAR-ROUND CIVILIAN EMPLOYED POPULATION 16 YEARS AND OVER",,,,
"B24040",.,"Universe:  Full-t