0","90,338"
"B24022",45.000,"Architecture and engineering occupations","38,395","+/-5,244","33,151","43,639"
"B24022",46.000,"Life, physical, and social science occupations","49,500","+/-15,244","34,256","64,744"
"B24022",47.000,"Community and social services occupations","35,729","+/-3,591","32,138","39,320"
"B24022",48.000,"Legal occupations","51,822","+/-17,702","34,120","69,524"
"B24022",49.000,"Education, training, and library occupations","36,087","+/-4,401","31,686","40,488"
"B24022",50.000,"Arts, de