9.000,"Worked outside county of residence","29,121","+/-3,079","26,042","32,200"
"B08007",10.000,"Worked outside state of residence","2,879","+/-858","2,021","3,737"
"B08007",11.000,"Female:","173,328","+/-5,695","167,633","179,023"
"B08007",12.000,"Worked in state of residence:","172,268","+/-5,675","166,593","177,943"
"B08007",13.000,"Worked in county of residence","151,450","+/-6,040","145,410","157,490"
"B08007",14.000,"Worked outside county of residence","20,818","+/-2,635","18,183","23,453"
"B08007",1