97","138","932"
"C24010I",14.000,"Construction, extraction, maintenance, and repair occupations","584","+/-533","51","1,117"
"C24010I",15.000,"Production, transportation, and material moving occupations","2,698","+/-971","1,727","3,669"
"C24020",.,"SEX BY OCCUPATION FOR THE FULL-TIME, YEAR-ROUND CIVILIAN EMPLOYED POPULATION 16 YEARS AND OVER",,,,
"C24020",.,"Universe:  Full-time, year-round civilian employed population 16 years and over",,,,
"C24020",1.000,"Total:","266,606","+/-10,314","256,292","276,920"
