05001",2.000,"U.S. citizen, born in the United States","610,866","+/-14,511","596,355","625,377"
"C05001",3.000,"U.S. citizen, born in Puerto Rico, U.S. Island Areas, or born abroad of American parent(s)","57,262","+/-6,033","51,229","63,295"
"C05001",4.000,"U.S. citizen by naturalization","50,730","+/-4,210","46,520","54,940"
"C05001",5.000,"Not a U.S. citizen","69,540","+/-7,007","62,533","76,547"
"C05002",.,"PLACE OF BIRTH BY CITIZENSHIP STATUS",,,,
"C05002",.,"Universe: Total population",,,,
"C05002",1.