ce and administrative support occupations","592","+/-387","205","979"
"B24060",106.000,"Farming, fishing, and forestry occupations","0","+/-303","0","303"
"B24060",107.000,"Construction, extraction, maintenance, and repair occupations:","2,779","+/-1,014","1,765","3,793"
"B24060",108.000,"Construction and extraction occupations","2,632","+/-1,058","1,574","3,690"
"B24060",109.000,"Installation, maintenance, and repair occupations","147","+/-173","0","320"
"B24060",110.000,"Production, transportation, and ma