02005",5.000,"Navajo","N","N","N","N"
"C02005",6.000,"Sioux","N","N","N","N"
"C02005",7.000,"All specified other American Indian tribes","N","N","N","N"
"C02005",8.000,"Alaska Native tribes, specified","N","N","N","N"
"C02005",9.000,"American Indian or Alaska Native tribe, not specified","N","N","N","N"
"C02006",.,"ASIAN ALONE BY SELECTED GROUPS",,,,
"C02006",.,"Universe:  Total Asian alone population",,,,
"C02006",1.000,"Total:","31,436","+/-3,422","28,014","34,858"
"C02006",2.000,"Asian Indian","12,053","