DENCE IN THE UNITED STATES",,,,
"B07004A",.,"Universe:  White alone population 1 year and over in the United States",,,,
"B07004A",1.000,"Total:","583,958","+/-13,346","570,612","597,304"
"B07004A",2.000,"Same house 1 year ago","487,821","+/-15,185","472,636","503,006"
"B07004A",3.000,"Moved within same county","59,979","+/-6,643","53,336","66,622"
"B07004A",4.000,"Moved from different county within same state","14,465","+/-2,869","11,596","17,334"
"B07004A",5.000,"Moved from different state","15,109","+/-2