15,599","20,047"
"B24070",130.000,"Health care and social assistance","1,568","+/-709","859","2,277"
"B24070",131.000,"Arts, entertainment, and recreation, and accommodation and food services:","856","+/-483","373","1,339"
"B24070",132.000,"Arts, entertainment, and recreation","640","+/-449","191","1,089"
"B24070",133.000,"Accommodation and food services","216","+/-163","53","379"
"B24070",134.000,"Other services, except public administration","238","+/-371","0","609"
"B24070",135.000,"Public administration