50",38.000,"Utilities","470","+/-325","145","795"
"B24050",39.000,"Information","4,343","+/-1,039","3,304","5,382"
"B24050",40.000,"Finance and insurance, and real estate and rental and leasing:","10,737","+/-1,589","9,148","12,326"
"B24050",41.000,"Finance and insurance","7,562","+/-1,364","6,198","8,926"
"B24050",42.000,"Real estate and rental and leasing","3,175","+/-1,008","2,167","4,183"
"B24050",43.000,"Professional, scientific, and management, and administrative and waste management services:","28,91