7","47,959"
"C24010",27.000,"Sales and related occupations","27,362","+/-2,744","24,618","30,106"
"C24010",28.000,"Office and administrative support occupations","16,786","+/-2,471","14,315","19,257"
"C24010",29.000,"Farming, fishing, and forestry occupations","587","+/-444","143","1,031"
"C24010",30.000,"Construction, extraction, maintenance, and repair occupations:","40,160","+/-3,969","36,191","44,129"
"C24010",31.000,"Construction and extraction occupations","30,727","+/-3,846","26,881","34,573"
"C24010