-976","2,640","4,592"
"B07009",19.000,"Moved from different county within same state:","12,354","+/-2,479","9,875","14,833"
"B07009",20.000,"Less than high school graduate","1,738","+/-772","966","2,510"
"B07009",21.000,"High school graduate (includes equivalency)","4,092","+/-1,478","2,614","5,570"
"B07009",22.000,"Some college or associate's degree","3,252","+/-1,021","2,231","4,273"
"B07009",23.000,"Bachelor's degree","2,054","+/-791","1,263","2,845"
"B07009",24.000,"Graduate or professional degree","1,2