s, and sales managers","2,082","+/-922","1,160","3,004"
"B24010",134.000,"Financial managers","1,761","+/-735","1,026","2,496"
"B24010",135.000,"Operations specialties managers except financial managers","2,421","+/-1,041","1,380","3,462"
"B24010",136.000,"Farmers and farm managers","286","+/-316","0","602"
"B24010",137.000,"Other management occupations except farmers and farm managers","9,603","+/-1,586","8,017","11,189"
"B24010",138.000,"Business and financial operations occupations:","9,395","+/-1,779","