ioners and technical occupations","960","+/-517","443","1,477"
"B24010",180.000,"Health technologists and technicians","4,189","+/-1,167","3,022","5,356"
"B24010",181.000,"Service occupations:","36,519","+/-3,083","33,436","39,602"
"B24010",182.000,"Healthcare support occupations:","5,715","+/-1,374","4,341","7,089"
"B24010",183.000,"Nursing, psychiatric, and home health aides","1,886","+/-840","1,046","2,726"
"B24010",184.000,"Occupational and physical therapist assistants and aides","0","+/-303","0","303"