l and leasing","0","+/-303","0","303"
"C24050",66.000,"Professional, scientific, and management, and administrative and waste management services","0","+/-303","0","303"
"C24050",67.000,"Educational services, and health care and social assistance","0","+/-303","0","303"
"C24050",68.000,"Arts, entertainment, and recreation, and accommodation and food services","65","+/-108","0","173"
"C24050",69.000,"Other services, except public administration","0","+/-303","0","303"
"C24050",70.000,"Public administration",