Arts, entertainment, and recreation, and accommodation and food services","58,371","+/-4,379","53,992","62,750"
"C08126",12.000,"Other services (except public administration)","16,938","+/-2,926","14,012","19,864"
"C08126",13.000,"Public administration","13,524","+/-2,023","11,501","15,547"
"C08126",14.000,"Armed forces","685","+/-430","255","1,115"
"C08126",15.000,"Car, truck, or van - drove alone:","307,676","+/-9,272","298,404","316,948"
"C08126",16.000,"Agriculture, forestry, fishing and hunting, and mi