40.000,"Machinery, equipment, and supplies merchant wholesalers","102","+/-120","0","222"
"B24030",141.000,"Recyclable material merchant wholesalers","0","+/-303","0","303"
"B24030",142.000,"Miscellaneous durable goods merchant wholesalers","238","+/-333","0","571"
"B24030",143.000,"Paper and paper product merchant wholesalers","47","+/-75","0","122"
"B24030",144.000,"Drugs and druggists' sundries, and chemical and allied products merchant wholesalers","699","+/-554","145","1,253"
"B24030",145.000,"Apparel,