952","588","2,492"
"C24060",149.000,"Production occupations","47","+/-78","0","125"
"C24060",150.000,"Transportation and material moving occupations","1,493","+/-950","543","2,443"
"C24060",151.000,"Self-employed in own not incorporated business workers and unpaid family workers:","20,879","+/-2,683","18,196","23,562"
"C24060",152.000,"Management, professional, and related occupations:","6,992","+/-1,497","5,495","8,489"
"C24060",153.000,"Management, business, and financial occupations:","3,400","+/-1,127",