sonal care and service occupations","197","+/-191","6","388"
"B24010F",23.000,"Sales and office occupations:","3,058","+/-1,104","1,954","4,162"
"B24010F",24.000,"Sales and related occupations","1,404","+/-772","632","2,176"
"B24010F",25.000,"Office and administrative support occupations","1,654","+/-656","998","2,310"
"B24010F",26.000,"Farming, fishing, and forestry occupations","224","+/-335","0","559"
"B24010F",27.000,"Construction, extraction, maintenance, and repair occupations:","8,989","+/-3,255","5,