onths:","881","+/-383","498","1,264"
"B17015",16.000,"With SSI and/or cash public assistance income in the past 12 months","200","+/-248","0","448"
"B17015",17.000,"Without SSI or cash public assistance income in the past 12 months","681","+/-435","246","1,116"
"B17015",18.000,"Female householder, no husband present:","9,195","+/-1,926","7,269","11,121"
"B17015",19.000,"With Social Security income in the past 12 months:","492","+/-297","195","789"
"B17015",20.000,"With SSI and/or cash public assistance inco