nths:","35,499","+/-2,800","32,699","38,299"
"B17016",36.000,"Spouse worked full-time, year-round in the past 12 months","10,592","+/-1,970","8,622","12,562"
"B17016",37.000,"Spouse worked part-time or part-year in the past 12 months","3,909","+/-1,035","2,874","4,944"
"B17016",38.000,"Spouse did not work in the past 12 months","20,998","+/-1,930","19,068","22,928"
"B17016",39.000,"Other family:","44,056","+/-3,925","40,131","47,981"
"B17016",40.000,"Male householder, no wife present:","14,712","+/-2,187","