95","167,633","179,023"
"B08008",12.000,"Living in a place:","102,637","+/-5,575","97,062","108,212"
"B08008",13.000,"Worked in place of residence","30,926","+/-3,143","27,783","34,069"
"B08008",14.000,"Worked outside place of residence","71,711","+/-4,461","67,250","76,172"
"B08008",15.000,"Not living in a place","70,691","+/-4,108","66,583","74,799"
"B08009",.,"SEX OF WORKERS BY PLACE OF WORK--MINOR CIVIL DIVISION LEVEL FOR 12 SELECTED STATES (CT, ME, MA, MI, MN, NH, NJ, NY, PA, RI, VT, WI)",,,,
"B08009",