dollars)","52,764","+/-1,262","42,651","+/-4,683"
"716","Central America:",216,"With earnings","81.8","+/-1.0","96.0","+/-2.7"
"716","Central America:",217,"Mean earnings (dollars)","67,031","+/-1,902","48,297","+/-3,916"
"716","Central America:",218,"With Social Security income","27.0","+/-1.0","6.2","+/-2.6"
"716","Central America:",219,"Mean Social Security income (dollars)","14,430","+/-445","10,701","+/-3,341"
"716","Central America:",220,"With Supplemental Security Income","3.3","+/-0.5","0.8","+/-0.8