0,"With Supplemental Security Income","3.3","+/-0.5","3.2","+/-1.3"
"535","German (032-045)",221,"Mean Supplemental Security Income (dollars)","9,822","+/-1,262","7,151","+/-1,260"
"535","German (032-045)",222,"With cash public assistance income","1.5","+/-0.4","0.7","+/-0.4"
"535","German (032-045)",223,"Mean cash public assistance income (dollars)","3,460","+/-804","6,833","+/-3,213"
"535","German (032-045)",224,"With retirement income","18.4","+/-1.0","19.2","+/-2.3"
"535","German (032-045)",225,"Mean re