o grade 12","71.9","+/-2.3","57.2","+/-6.5"
"535","German (032-045)",88,"Percent enrolled in college or graduate school","23.7","+/-2.2","37.5","+/-6.4"
"535","German (032-045)",89,"Population 25 years and over","525,110","+/-5,237","101,459","+/-5,203"
"535","German (032-045)",90,"Less than high school diploma","15.3","+/-0.9","8.0","+/-1.5"
"535","German (032-045)",91,"High school graduate (includes equivalency)","30.2","+/-1.3","28.4","+/-2.5"
"535","German (032-045)",92,"Some college or associate's degr