sional degree","5.8","+/-0.5","6.7","+/-1.8"
"541","Irish (050, 081)",95,"High school graduate or higher","77.3","+/-1.1","82.1","+/-2.7"
"541","Irish (050, 081)",96,"Male, high school graduate or higher","75.5","+/-1.5","80.0","+/-4.3"
"541","Irish (050, 081)",97,"Female, high school graduate or higher","78.9","+/-1.3","84.0","+/-3.3"
"541","Irish (050, 081)",98,"Bachelor's degree or higher","16.0","+/-0.9","17.4","+/-3.1"
"541","Irish (050, 081)",99,"Male, bachelor's degree or higher","16.4","+/-1.1","20.