sh (050, 081)",89,"Population 25 years and over","468,585","+/-3,587","56,841","+/-4,070"
"541","Irish (050, 081)",90,"Less than high school diploma","22.7","+/-1.1","17.9","+/-2.7"
"541","Irish (050, 081)",91,"High school graduate (includes equivalency)","37.1","+/-1.1","36.2","+/-3.6"
"541","Irish (050, 081)",92,"Some college or associate's degree","24.2","+/-1.1","28.5","+/-3.7"
"541","Irish (050, 081)",93,"Bachelor's degree","10.2","+/-0.7","10.7","+/-2.3"
"541","Irish (050, 081)",94,"Graduate or profes