7.5","+/-1.1"
"002","White alone",96,"Male, high school graduate or higher","75.5","+/-1.5","75.5","+/-1.5"
"002","White alone",97,"Female, high school graduate or higher","78.9","+/-1.3","79.2","+/-1.4"
"002","White alone",98,"Bachelor's degree or higher","16.0","+/-0.9","16.1","+/-0.9"
"002","White alone",99,"Male, bachelor's degree or higher","16.4","+/-1.1","16.4","+/-1.1"
"002","White alone",100,"Female, bachelor's degree or higher","15.7","+/-1.2","15.9","+/-1.2"
"002","White alone",101,"Women 15 to 5