management services","6.1","+/-0.9","4.6","+/-1.6"
"573","American (993-994)",206,"Educational services, and health care and social assistance","19.8","+/-1.2","17.8","+/-2.3"
"573","American (993-994)",207,"Arts, entertainment, and recreation, and accommodation and food services","9.9","+/-1.2","9.6","+/-2.2"
"573","American (993-994)",208,"Other services (except public administration)","5.9","+/-0.9","6.8","+/-2.0"
"573","American (993-994)",209,"Public administration","3.1","+/-0.5","3.3","+/-1.0"
"573",