C",3.0000,"Moved within same county","N","N","N","N"
"B07404C",4.0000,"Moved to different county within same state","N","N","N","N"
"B07404C",5.0000,"Moved to different state","N","N","N","N"
"B07404D",.,"GEOGRAPHICAL MOBILITY IN THE PAST YEAR BY RACE (ASIAN ALONE) FOR RESIDENCE 1 YEAR AGO IN THE UNITED STATES",,,,
"B07404D",.,"Universe:  Asian alone population 1 year and over in the United States",,,,
"B07404D",1.0000,"Total living in area 1 year ago:","N","N","N","N"
"B07404D",2.0000,"Same house","N","N",