 YEAR BY RACE (WHITE ALONE) FOR RESIDENCE 1 YEAR AGO IN THE UNITED STATES",,,,
"B07404A",.,"Universe:  White alone population 1 year and over in the United States",,,,
"B07404A",1.0000,"Total living in area 1 year ago:","92,112","+/-2,310","89,802","94,422"
"B07404A",2.0000,"Same house","79,928","+/-2,146","77,782","82,074"
"B07404A",3.0000,"Moved within same county","7,505","+/-2,026","5,479","9,531"
"B07404A",4.0000,"Moved to different county within same state","2,714","+/-874","1,840","3,588"
"B07404A",5