03; unit Kag, HU002; unit Ki15, LC002)"
251,2411,2411,Kgt,Tourmaline bearing granite (HE002)
251,137,2420,Kgd,"Granodiorite (unit Kg, GU002; units Ki14, KI13, Ki11, KI10, Ki7, Ki3, Ki2, Ki1, LC002; part unit Kg, MZ002)"
672,2440,2440,Kmum,"Gabbro of Mount Moffit (unit gbm, MH002; unit Kd, BD002; unit Km?, TN002; unit Km, KH003)"
672,2445,2445,Kmum,"Serpentinite, diabase, gabbro, and mafic volcaniclastic rocks (unit Km, KH003)"
251,2450,2450,Kg,"Alaskite (LG002; unit Kp, BD002) [Overprint symbol 13]"
2