ed in owner-occupied housing units","1,551,847","+/-16,284","1,535,563","1,568,131"
"B07413",3.0000,"Householder lived in renter-occupied housing units","537,305","+/-16,151","521,154","553,456"
"B07413",4.0000,"Same house:","1,777,036","+/-16,160","1,760,876","1,793,196"
"B07413",5.0000,"Householder lived in owner-occupied housing units","1,443,268","+/-17,001","1,426,267","1,460,269"
"B07413",6.0000,"Householder lived in renter-occupied housing units","333,768","+/-13,105","320,663","346,873"
"B07413",7.0