estry occupations","0.2","+/-0.2","0.1","+/-0.2"
"401","Mexican",195,"Construction, extraction, maintenance, and repair occupations","0.6","+/-0.3","1.2","+/-0.9"
"401","Mexican",196,"Production, transportation, and material moving occupations","4.1","+/-0.9","5.9","+/-2.1"
"401","Mexican",197,"Agriculture, forestry, fishing and hunting, and mining","0.9","+/-0.2","1.7","+/-0.7"
"401","Mexican",198,"Construction","8.2","+/-0.7","13.8","+/-2.2"
"401","Mexican",199,"Manufacturing","7.7","+/-0.7","6.2","+/-1.4