 income (dollars)","14,955","+/-321","12,398","+/-1,072"
"686","Americas:",220,"With Supplemental Security Income","3.4","+/-0.4","2.4","+/-1.2"
"686","Americas:",221,"Mean Supplemental Security Income (dollars)","7,742","+/-716","5,196","+/-927"
"686","Americas:",222,"With cash public assistance income","2.4","+/-0.4","2.0","+/-1.3"
"686","Americas:",223,"Mean cash public assistance income (dollars)","3,238","+/-638","4,600","+/-2,475"
"686","Americas:",224,"With retirement income","20.1","+/-0.7","9.1","+