657","+/-4,565"
"687","Latin America:",90,"Less than high school diploma","12.9","+/-0.7","43.6","+/-3.7"
"687","Latin America:",91,"High school graduate (includes equivalency)","25.1","+/-0.8","26.2","+/-3.8"
"687","Latin America:",92,"Some college or associate's degree","32.5","+/-0.8","19.1","+/-2.7"
"687","Latin America:",93,"Bachelor's degree","17.3","+/-0.7","7.0","+/-1.8"
"687","Latin America:",94,"Graduate or professional degree","12.2","+/-0.7","4.1","+/-1.2"
"687","Latin America:",95,"High school 