management, and administrative and waste management services","11.9","+/-0.9","13.3","+/-3.8"
"717","Mexico",206,"Educational services, and health care and social assistance","22.8","+/-1.3","14.2","+/-3.4"
"717","Mexico",207,"Arts, entertainment, and recreation, and accommodation and food services","11.9","+/-0.9","19.1","+/-4.2"
"717","Mexico",208,"Other services (except public administration)","4.9","+/-0.6","6.2","+/-2.1"
"717","Mexico",209,"Public administration","5.9","+/-0.6","2.4","+/-1.5"
"717","Me