"Civilian employed population 16 years and over",,,"422,792","+/-6,218"
"001","Total population",177,"Management, professional, and related occupations",,,"35.1","+/-1.3"
"001","Total population",178,"Service occupations",,,"19.5","+/-1.1"
"001","Total population",179,"Sales and office occupations",,,"25.6","+/-1.0"
"001","Total population",180,"Farming, fishing, and forestry occupations",,,"0.3","+/-0.1"
"001","Total population",181,"Construction, extraction, maintenance, and repair occupations",,,"10.7","