one",291,"Renter-occupied housing units","135,979","+/-4,471","90,833","+/-4,068"
"002","White alone",292,"Less than 30 percent","50.4","+/-2.6","53.7","+/-2.9"
"002","White alone",293,"30 percent or more","49.6","+/-2.6","46.3","+/-2.9"
"002","White alone",294,"Median gross rent (dollars)","710","+/-22","747","+/-27"
"003","White alone or in combination with one or more other races",1,"Total population","967,089","*****","704,983","+/-9,118"
"003","White alone or in combination with one or more other races