,903"
"529","English (015, 022)",87,"Percent enrolled in kindergarten to grade 12","60.0","+/-1.7","53.0","+/-11.5"
"529","English (015, 022)",88,"Percent enrolled in college or graduate school","35.7","+/-1.9","45.8","+/-11.2"
"529","English (015, 022)",89,"Population 25 years and over","635,539","+/-713","78,051","+/-3,725"
"529","English (015, 022)",90,"Less than high school diploma","12.9","+/-0.7","4.4","+/-1.4"
"529","English (015, 022)",91,"High school graduate (includes equivalency)","25.1","+/-0.8"