cash public assistance income",,,"2.4","+/-0.4"
"001","Total population",223,"Mean cash public assistance income (dollars)",,,"3,238","+/-638"
"001","Total population",224,"With retirement income",,,"20.1","+/-0.7"
"001","Total population",225,"Mean retirement income (dollars)",,,"23,738","+/-1,130"
"001","Total population",226,"With Food Stamp benefits",,,"8.4","+/-0.8"
"001","Total population",227,"Families",,,"231,648","+/-4,443"
"001","Total population",228,"Median family income (dollars)",,,"55,219","+