school graduate (includes equivalency)","25.1","+/-0.8","27.3","+/-4.0"
"717","Mexico",92,"Some college or associate's degree","32.5","+/-0.8","18.3","+/-3.1"
"717","Mexico",93,"Bachelor's degree","17.3","+/-0.7","6.2","+/-1.8"
"717","Mexico",94,"Graduate or professional degree","12.2","+/-0.7","3.3","+/-1.2"
"717","Mexico",95,"High school graduate or higher","87.1","+/-0.7","55.0","+/-4.0"
"717","Mexico",96,"Male, high school graduate or higher","87.3","+/-1.1","54.7","+/-5.2"
"717","Mexico",97,"Female, hi