ation, and material moving occupations","8.8","+/-0.9","7.1","+/-0.8"
"002","White alone",183,"Male civilian employed population 16 years and over","224,883","+/-3,769","157,273","+/-3,721"
"002","White alone",184,"Management, professional, and related occupations","32.1","+/-1.6","37.8","+/-2.1"
"002","White alone",185,"Service occupations","17.9","+/-1.7","14.9","+/-1.7"
"002","White alone",186,"Sales and office occupations","17.1","+/-1.2","18.3","+/-1.6"
"002","White alone",187,"Farming, fishing, and fo