"+/-6,218","47,948","+/-4,114"
"686","Americas:",177,"Management, professional, and related occupations","35.1","+/-1.3","14.9","+/-2.9"
"686","Americas:",178,"Service occupations","19.5","+/-1.1","34.5","+/-5.0"
"686","Americas:",179,"Sales and office occupations","25.6","+/-1.0","12.0","+/-2.4"
"686","Americas:",180,"Farming, fishing, and forestry occupations","0.3","+/-0.1","1.2","+/-0.8"
"686","Americas:",181,"Construction, extraction, maintenance, and repair occupations","10.7","+/-0.8","23.2","+/-3.7"