"+/-6,096",,,,,,,,
"S2302",1.5,"EMPLOYMENT STATUS CHARACTERISTICS",,,,,,,,,,,,
"S2302",2.0,"Married-couple families","177,087","+/-4,765","65,468","+/-3,804",,,,,,,,
"S2302",3.0,"Both husband and wife in labor force","46.9","+/-1.6","64.2","+/-2.6",,,,,,,,
"S2302",4.0,"Husband in labor force, wife not in labor force","22.8","+/-1.6","27.5","+/-2.9",,,,,,,,
"S2302",5.0,"Wife in labor force, husband not in labor force","7.3","+/-1.0","4.6","+/-1.4",,,,,,,,
"S2302",6.0,"Both husband and wife not in labor force