0,"Language status (speak a language other than English)","0.6","(X)",,,,,,,,,,
"S1602",8.0,"Ability to speak English","2.6","(X)",,,,,,,,,,
"S1603",0.0,,,,,,,,,,,,,
"S1603",0.5,,,,,,"Percent distribution of people who speak a language other than English at home",,,,,,,
"S1603",0.7,,"Total","Margin of Error","People who speak only English at home","Margin of Error","Total","Margin of Error","Spanish or Spanish Creole","Margin of Error",,,,
"S1603",1.0,"Total population 5 years and over","1,049,039","+/-18,0