sian","N","N","N","N","N","N","N","N","N","N","N","N"
"S1201",22.0,"Native Hawaiian and Other Pacific Islander","N","N","N","N","N","N","N","N","N","N","N","N"
"S1201",23.0,"Some other race","12,595","+/-2,030","40.7","+/-13.4","1.3","+/-1.5","4.7","+/-3.4","3.3","+/-2.9","49.9","+/-14.1"
"S1201",24.0,"Two or more races","8,280","+/-1,714","42.5","+/-8.7","4.8","+/-4.0","8.9","+/-4.4","3.9","+/-3.0","39.7","+/-8.3"
"S1201",24.3,,,,,,,,,,,,,
"S1201",25.0,"Hispanic or Latino origin (of any race)","26,379","+/