,"2,652,458","2,675,392"
"B08537",2.000,"Householder lived in owner-occupied housing units","2,149,913","+/-15,797","2,134,116","2,165,710"
"B08537",3.000,"Householder lived in renter-occupied housing units","514,012","+/-13,376","500,636","527,388"
"B08537",4.000,"Car, truck, or van - drove alone:","2,093,458","+/-11,410","2,082,048","2,104,868"
"B08537",5.000,"Householder lived in owner-occupied housing units","1,733,679","+/-14,459","1,719,220","1,748,138"
"B08537",6.000,"Householder lived in renter-occu