e","3,938","+/-991","2,947","4,929"
"B08526",96.000,"Retail trade","8,567","+/-1,263","7,304","9,830"
"B08526",97.000,"Transportation and warehousing, and utilities","3,254","+/-697","2,557","3,951"
"B08526",98.000,"Information","3,985","+/-803","3,182","4,788"
"B08526",99.000,"Finance and insurance, and real estate and rental and leasing","13,093","+/-2,070","11,023","15,163"
"B08526",100.000,"Professional, scientific, and management, and administrative and waste management services","21,023","+/-1,851","1