","+/-4,444","80,140","89,028"
"C08505B",2.000,"Car, truck, or van - drove alone","56,287","+/-3,900","52,387","60,187"
"C08505B",3.000,"Car, truck, or van - carpooled","8,781","+/-1,560","7,221","10,341"
"C08505B",4.000,"Public transportation (excluding taxicab)","12,439","+/-2,147","10,292","14,586"
"C08505B",5.000,"Taxicab, motorcycle, bicycle, walked, or other means","5,465","+/-1,220","4,245","6,685"
"C08505B",6.000,"Worked at home","1,612","+/-635","977","2,247"
"C08505C",.,"MEANS OF TRANSPORTATION TO