31,347","+/-2,612","28,735","33,959"
"C08524",45.000,"Farming, fishing, and forestry occupations","2,267","+/-449","1,818","2,716"
"C08524",46.000,"Construction and extraction, and maintenance occupations","7,480","+/-1,267","6,213","8,747"
"C08524",47.000,"Production, transportation, and material moving occupations","6,490","+/-1,009","5,481","7,499"
"C08524",48.000,"Armed forces","229","+/-246","0","475"
"C08526",.,"MEANS OF TRANSPORTATION TO WORK BY INDUSTRY FOR WORKPLACE GEOGRAPHY",,,,
"C08526",.,"Unive