ng","43,085","+/-3,253","39,832","46,338"
"C08526",33.000,"Wholesale trade","6,881","+/-1,283","5,598","8,164"
"C08526",34.000,"Retail trade","24,743","+/-2,349","22,394","27,092"
"C08526",35.000,"Transportation and warehousing, and utilities","8,468","+/-1,490","6,978","9,958"
"C08526",36.000,"Information and finance and insurance, and real estate and rental and leasing","20,432","+/-2,236","18,196","22,668"
"C08526",37.000,"Professional, scientific, and management, and administrative and waste management 