ANSPORTATION TO WORK BY CLASS OF WORKER FOR WORKPLACE GEOGRAPHY",,,,
"B08528",.,"Universe:  Workers 16 years and over",,,,
"B08528",1.000,"Total:","2,699,357","+/-11,495","2,687,862","2,710,852"
"B08528",2.000,"Private for-profit wage and salary workers:","1,930,688","+/-15,712","1,914,976","1,946,400"
"B08528",3.000,"Employee of private company workers","1,820,951","+/-15,330","1,805,621","1,836,281"
"B08528",4.000,"Self-employed in own incorporated business workers","109,737","+/-4,349","105,388","114,086