its","514,012","+/-13,376","500,636","527,388"
"C08537",4.000,"Car, truck, or van - drove alone:","2,093,458","+/-11,410","2,082,048","2,104,868"
"C08537",5.000,"Householder lived in owner-occupied housing units","1,733,679","+/-14,459","1,719,220","1,748,138"
"C08537",6.000,"Householder lived in renter-occupied housing units","359,779","+/-10,251","349,528","370,030"
"C08537",7.000,"Car, truck, or van - carpooled:","247,891","+/-8,001","239,890","255,892"
"C08537",8.000,"Householder lived in owner-occupied