B08528",50.000,"Unpaid family workers","336","+/-140","196","476"
"B08528",51.000,"Taxicab, motorcycle, bicycle, or other means:","42,062","+/-2,916","39,146","44,978"
"B08528",52.000,"Private for-profit wage and salary workers:","30,183","+/-2,609","27,574","32,792"
"B08528",53.000,"Employee of private company workers","29,182","+/-2,545","26,637","31,727"
"B08528",54.000,"Self-employed in own incorporated business workers","1,001","+/-354","647","1,355"
"B08528",55.000,"Private not-for-profit wage and sal