 at home","891","+/-454","437","1,345"
"C08505G",.,"MEANS OF TRANSPORTATION TO WORK FOR WORKPLACE GEOGRAPHY (TWO OR MORE RACES)",,,,
"C08505G",.,"Universe:  Two or more races workers 16 years and over",,,,
"C08505G",1.000,"Total:","28,840","+/-3,104","25,736","31,944"
"C08505G",2.000,"Car, truck, or van - drove alone","19,449","+/-2,415","17,034","21,864"
"C08505G",3.000,"Car, truck, or van - carpooled","4,167","+/-1,129","3,038","5,296"
"C08505G",4.000,"Public transportation (excluding taxicab)","1,668","+