",5.000,"Taxicab, motorcycle, bicycle, walked, or other means","1,793,630","+/-154,342","1,639,288","1,947,972"
"C08537",.,"MEANS OF TRANSPORTATION TO WORK BY TENURE FOR WORKPLACE GEOGRAPHY",,,,
"C08537",.,"Universe: Workers 16 years and over in households",,,,
"C08537",1.000,"Total:","2,663,925","+/-11,467","2,652,458","2,675,392"
"C08537",2.000,"Householder lived in owner-occupied housing units","2,149,913","+/-15,797","2,134,116","2,165,710"
"C08537",3.000,"Householder lived in renter-occupied housing un