"+/-0.1","16.0","+/-0.2",,,,,,
"S2502",19.0,"High school graduate (includes equivalency)","28.8","+/-0.2","27.6","+/-0.2","31.6","+/-0.3",,,,,,
"S2502",20.0,"Some college or associate's degree","30.1","+/-0.1","29.4","+/-0.2","31.9","+/-0.3",,,,,,
"S2502",21.0,"Bachelor's degree or higher","30.3","+/-0.1","34.4","+/-0.2","20.4","+/-0.3",,,,,,
"S2502",21.3,,,,,,,,,,,,,
"S2502",21.5,"YEAR HOUSEHOLDER MOVED INTO UNIT",,,,,,,,,,,,
"S2502",22.0,"Moved in 2000 or later","54.8","+/-0.1","42.1","+/-0.1","84.9","+/-