1801",12.0,"With any disability","11.5","+/-0.1","11.5","+/-0.1","11.6","+/-0.1",,,,,,
"S1801",13.0,"With a sensory disability","2.4","+/-0.1","2.8","+/-0.1","2.0","+/-0.1",,,,,,
"S1801",14.0,"With a physical disability","6.6","+/-0.1","6.2","+/-0.1","7.1","+/-0.1",,,,,,
"S1801",15.0,"With a mental disability","4.6","+/-0.1","4.8","+/-0.1","4.5","+/-0.1",,,,,,
"S1801",16.0,"With a self-care disability","2.1","+/-0.1","1.9","+/-0.1","2.3","+/-0.1",,,,,,
"S1801",17.0,"With a go-outside-home disability","3.1",