raduate (includes equivalency)","30.9","+/-0.1","34.2","+/-0.2","25.7","+/-0.2","24.6","+/-1.6",,,,
"S0601",35.0,"Some college or associate's degree","28.3","+/-0.1","30.5","+/-0.2","27.2","+/-0.2","27.1","+/-1.4",,,,
"S0601",36.0,"Bachelor's degree","18.4","+/-0.1","17.2","+/-0.1","21.6","+/-0.2","17.6","+/-1.4",,,,
"S0601",37.0,"Graduate or professional degree","10.4","+/-0.1","8.2","+/-0.1","14.1","+/-0.2","11.3","+/-0.9",,,,
"S0601",37.3,,,,,,,,,,,,,
"S0601",37.5,"INDIVIDUALS' INCOME IN THE PAST 12 MONT