lander","0.0","+/-0.1","0.0","+/-0.1","0.1","+/-0.1","0.1","+/-0.1",,,,
"S0802",17.0,"Some other race","3.4","+/-0.1","2.8","+/-0.1","7.6","+/-0.4","8.4","+/-0.7",,,,
"S0802",18.0,"Two or more races","1.1","+/-0.1","1.0","+/-0.1","1.5","+/-0.2","1.4","+/-0.2",,,,
"S0802",18.3,,,,,,,,,,,,,
"S0802",19.0,"Hispanic or Latino origin (of any race)","6.4","+/-0.1","5.3","+/-0.1","13.6","+/-0.5","12.5","+/-0.7",,,,
"S0802",20.0,"White alone, not Hispanic or Latino","79.7","+/-0.1","82.3","+/-0.1","69.7","+/-0.6","4