,38.0,"Retail trade","14.8%","1.6","12.9%","1.3",
"DP03",39.0,"Transportation and warehousing, and utilities","3.5%","0.7","7.0%","1.0","*"
"DP03",40.0,"Information","1.4%","0.4","2.7%","0.8",
"DP03",41.0,"Finance and insurance, and real estate and rental and leasing","6.4%","1.2","5.8%","1.0",
"DP03",42.0,"Professional, scientific, and management, and administrative and waste management services","6.5%","1.1","6.6%","1.1",
"DP03",43.0,"Educational services, and health care and social assistance","18.7%","1