, and sinking/capsized water vehicles involved in transportation.  Does not include fishing boats. ",,,,,,,,,,,,,,
"g  Includes collisions between railway vehicles, railway vehicle and other vehicle, railway vehicle and other object, and derailment. ",,,,,,,,,,,,,,
"h Data do not include fatalities from the terrorist attacks of September 11 which totaled 2,886. ",,,,,,,,,,,,,,
,,,,,,,,,,,,,,
NOTES,,,,,,,,,,,,,,
Percentages may not add to totals due to rounding.,,,,,,,,,,,,,,
"The above categories do n