P02",4.0,"Married-couple family","82,842","+/-2,461","55.4","+/-1.6"
"DP02",5.0,"With own children under 18 years","37,619","+/-1,754","25.2","+/-1.2"
"DP02",6.0,"Male householder, no wife present, family","5,011","+/-1,035","3.4","+/-0.7"
"DP02",7.0,"With own children under 18 years","2,933","+/-798","2.0","+/-0.5"
"DP02",8.0,"Female householder, no husband present, family","11,259","+/-1,509","7.5","+/-1.0"
"DP02",9.0,"With own children under 18 years","7,865","+/-1,340","5.3","+/-0.9"
"DP02",10.0,"Nonfam