02",4.0,"Married-couple family","27,884","+/-2,031","58.1","+/-4.1"
"DP02",5.0,"With own children under 18 years","14,912","+/-1,700","31.1","+/-3.1"
"DP02",6.0,"Male householder, no wife present, family","1,840","+/-809","3.8","+/-1.7"
"DP02",7.0,"With own children under 18 years","1,333","+/-716","2.8","+/-1.5"
"DP02",8.0,"Female householder, no husband present, family","6,393","+/-1,543","13.3","+/-3.0"
"DP02",9.0,"With own children under 18 years","4,381","+/-1,300","9.1","+/-2.5"
"DP02",10.0,"Nonfamily