7,686","8,521","+/-1,532","126,630","+/-7,439",,,,,,
"S2101",28.0,"Less than high school graduate","12.0","+/-1.5","8.7","+/-4.4","12.2","+/-1.6",,,,,,
"S2101",29.0,"High school graduate (includes equivalency)","31.9","+/-2.3","37.4","+/-10.5","31.5","+/-2.4",,,,,,
"S2101",30.0,"Some college or associate's degree","25.3","+/-2.1","35.3","+/-9.0","24.6","+/-2.1",,,,,,
"S2101",31.0,"Bachelor's degree or higher","30.8","+/-2.3","18.6","+/-7.0","31.6","+/-2.4",,,,,,
"S2101",31.3,,,,,,,,,,,,,
"S2101",31.5,"EMPLO