st 12 months","34.1","+/-4.2","39.7","+/-7.3",,,,,,,,
"S2302",21.0,"Householder worked part-time or part-year in the past 12 months","20.5","+/-3.3","24.1","+/-5.4",,,,,,,,
"S2302",22.0,"Spouse worked part-time or part-year in the past 12 months","9.4","+/-2.5","13.0","+/-4.7",,,,,,,,
"S2302",23.0,"Householder did not work in the past 12 months","20.8","+/-3.3","7.7","+/-3.4",,,,,,,,
"S2302",24.0,"Spouse did not work in the past 12 months","12.5","+/-2.7","1.9","+/-1.4",,,,,,,,
"S2303",0.0,,,,,,,,,,,,,
"S23