l graduate or higher","72.8","+/-5.2","75.9","+/-6.5","70.7","+/-6.0",,,,,,
"S1501",27.0,"Bachelor's degree or higher","18.6","+/-3.9","18.4","+/-6.2","18.6","+/-4.5",,,,,,
"S1501",27.3,,,,,,,,,,,,,
"S1501",27.5,"POVERTY RATE FOR THE POPULATION 25 YEARS AND OVER FOR WHOM POVERTY STATUS IS DETERMINED BY EDUCATIONAL ATTAINMENT LEVEL",,,,,,,,,,,,
"S1501",28.0,"Less than high school graduate","11.0","+/-4.0","5.6","+/-3.7","15.9","+/-6.6",,,,,,
"S1501",29.0,"High school graduate (includes equivalency)","5.1","+