S0801",17.3,,,,,,,,,,,,,
"S0801",18.0,"Living in a place","100.0","+/-0.2","100.0","+/-0.3","100.0","+/-0.4",,,,,,
"S0801",19.0,"Worked in place of residence","77.1","+/-2.5","79.0","+/-3.2","74.9","+/-3.5",,,,,,
"S0801",20.0,"Worked outside place of residence","22.9","+/-2.5","21.0","+/-3.2","25.1","+/-3.5",,,,,,
"S0801",21.0,"Not living in a place","0.0","+/-0.2","0.0","+/-0.3","0.0","+/-0.4",,,,,,
"S0801",21.3,,,,,,,,,,,,,
"S0801",22.0,"Living in 12 selected states","100.0","+/-0.2","100.0","+/-0.3","100