27,921","+/-535","(X)","(X)"
"DP03",93.5,"PERCENTAGE OF FAMILIES AND PEOPLE WHOSE INCOME IN THE PAST 12 MONTHS IS BELOW THE POVERTY LEVEL",,,,
"DP03",94.0,"Median earnings for male full-time, year-round workers (dollars)","39,627","+/-924","(X)","(X)"
"DP03",95.0,"Median earnings for female full-time, year-round workers (dollars)","32,839","+/-782","(X)","(X)"
"DP03",95.3,,,,,
"DP03",96.0,"All families","9.5","+/-0.5","(X)","(X)"
"DP03",97.0,"With related children under 18 years","13.9","+/-0.8","(X)","(X)"